id,원카테고리,JSON카테고리,검색어,기사제목,기사제목_정규화,언론사,정규언론사,게시일,본문요약,링크,수집채널,랭킹점수,중요도점수,사건태그,사건단계,주요주체,랭킹감점사유,정책규제의무,강제검토,강제검토사유,자사홍보성,이슈패밀리,코드힌트,오늘성점수,오늘성사유,기사유형,v26이벤트키,v26진행단계,v27_industry_ok,v27_industry_reason,v27_industry_score,v32_competitor_basis,v32_competitor_portfolio,v32_actor_group,랭킹원점수,편집신호,스토리버킷,전역사건키,전역사건기본키,Gemini카테고리,Gemini내부카테고리,Gemini이슈패밀리,Gemini이슈그룹,Gemini관련성,Gemini중요도,Gemini대외협력중요도,Gemini관련도,GeminiPR성,Gemini제외,Gemini판단사유,Gemini라벨소스,Gemini자사티어,Gemini정부티어,Gemini경쟁사티어,Gemini경쟁사범위,Gemini정책영향경로,Gemini경쟁시사점,Gemini중복그룹,Gemini이슈유형,v27_event_key,v26_2_profile_reason,v26가드레일사유
168,자사 및 계열사 이슈,자사_및_계열사_이슈,카카오,"카카오, 카카오톡 채팅방에서 사용하는 ‘ChatGPT 챗봇’ 기능 출시",카카오 카카오톡 채팅방에서 사용하는 chatgpt 챗봇 기능 출시,kakaocorp.com,kakaocorp.com,"Mon, 15 Jun 2026 19:44:15 GMT","카카오, 카카오톡 채팅방에서 사용하는 ‘ChatGPT 챗봇’ 기능 출시 kakaocorp.com",https://news.google.com/rss/articles/CBMiVkFVX3lxTE5IUFJtSlNURXZjWkl2am5MaU9ON2ZnWmJVTE1OYjItSW9ERUVfMTNlbEwxU1NSa0RWLWJCNEN3YmNlTG1peUxBRi1udURXc25HRXBHZ1Fn?oc=5,google_rss_카카오 AI when:2d,63.8,32.0,ai_infrastructure_security,ai_infrastructure_security,"오픈AI,카카오,카카오서비스,카카오톡",,,,,,,general,14.0,published_yesterday,general,event:오픈AI+카카오:ai_infrastructure_security,general,Y,"industry_basis_pass:actor=True,change=True,bridge=True",3,competitor_actor_action_pass,Y,global,63.8,ai_infrastructure_security,self:ai_strategy,,,자사_및_계열사_이슈,SELF_AFFILIATE_BUSINESS,self_strategic_reference,카카오톡 내 ChatGPT 연동,"카카오·계열사의 사업 확장, 제휴, MOU, 신규 서비스 참고 이슈",3,3,3,,,v41: 실제 카카오 주체의 사업 확장·제휴성 이슈로 2순위 허용,gemini,STRATEGIC_REFERENCE,,,other,,,카카오톡 내 ChatGPT 연동,self_strategic_reference,,,
533,정부/국회,정부_국회,과학기술정보통신부,KT 개인정보 유출 규모 1만6000명으로 줄어…과징금 수위 변수로,kt 개인정보 유출 규모 1만6000명으로 줄어 과징금 수위 변수로,전자신문,전자신문,"Tue, 16 Jun 2026 05:41:49 GMT",KT 개인정보 유출 규모 1만6000명으로 줄어…과징금 수위 변수로 전자신문,https://news.google.com/rss/articles/CBMiTkFVX3lxTE5wN1ZlT3NHQzhoT19QT181aDVXVlN4VnlQSlNDVmxmMU91SGIwV09zbS1YWFlGTXJFOEdsMWhvSlk0ZWpYX1lTSFJZZElkQQ?oc=5,google_rss_과학기술정보통신부 과징금 when:2d,62.6,4.0,"antitrust_platform,legal_regulatory_enforcement,phishing_security,privacy_security_reliability",antitrust_general,KT,v43_not_government_policy,Y,,,,,platform_operator_obligation,14.0,published_yesterday,official_action,privacy_security:kt:data_leak,penalty_or_sanction,Y,"industry_basis_pass:actor=True,change=False,bridge=True",2,naver_telco_strategy_or_infra,Y,telco,62.6,"legal_regulatory_enforcement,privacy_security_reliability",government:regulatory_enforcement,global_incident:platform_regulation:kt:platform_regulation:sanction_penalty,global_incident:platform_regulation:kt:platform_regulation,경쟁사_해외이슈,OFF_TOPIC,경쟁사_개인정보_유출,KT_개인정보_유출_및_과징금_변수,국내 경쟁사인 KT의 개인정보 유출 및 과징금 이슈는 카카오의 개인정보보호 의무 및 관련 규제 리스크 관리 시 참고 자료가 됨.,2,1,3,,,경쟁사 KT의 개인정보 유출 사태와 과징금 논의는 카카오의 개인정보보호 및 규제 대응에 시사하는 바가 큼.,gemini,,OFF_TOPIC,COMP_DOMESTIC_DIRECT_RISK,domestic,카카오 플랫폼·AI·대관 대응 경로에 영향을 줄 수 있는 정책/감독 이슈,국내 경쟁사인 KT의 개인정보 유출 및 과징금 이슈는 카카오의 개인정보보호 의무 및 관련 규제 리스크 관리 시 참고 자료가 됨.,KT_개인정보_유출_및_과징금_변수,경쟁사_개인정보_유출,,weak_gov_basis:no_public_actor_action_domain,
1890,경쟁사/해외이슈,경쟁사_해외이슈,네이버,"배틀그라운드 e스포츠, 네이버 치지직 연계로 콘텐츠 경쟁력 강화..PNC 첫 시작",배틀그라운드 e스포츠 네이버 치지직 연계로 콘텐츠 경쟁력 강화 pnc 첫 시작,v.daum.net,v.daum.net,"Wed, 17 Jun 2026 00:06:50 GMT","배틀그라운드 e스포츠, 네이버 치지직 연계로 콘텐츠 경쟁력 강화..PNC 첫 시작 v.daum.net",https://news.google.com/rss/articles/CBMiRkFVX3lxTFBSVGtlMjJ1MEU2NmcyMHBDa0diZGhVU1plczhkS3N2SUdvaVdvOF9lZ2ROdGlLNmdFb1FSMjlfN2RqT3RpVHc?oc=5,google_rss_네이버 when:2d,59.0,46.5,,,네이버,v43_not_true_competitor,Y,,,,competitor:platform_obligation,platform_operator_obligation,24.0,published_today,general,global_incident:platform_regulation:naver:platform_content_moderation_obligation,general,Y,"industry_basis_pass:actor=True,change=False,bridge=True",2,competitor_actor_action_pass,Y,naver,59.0,,competitor:platform_obligation,global_incident:platform_regulation:naver:platform_content_moderation_obligation:general,global_incident:platform_regulation:naver:platform_content_moderation_obligation,경쟁사_해외이슈,COMPETITOR_PLATFORM_RISK,경쟁사_콘텐츠_전략,네이버_치지직_e스포츠_콘텐츠_강화,국내 경쟁사인 네이버 치지직의 e스포츠 콘텐츠 강화 전략은 카카오의 게임 및 콘텐츠 플랫폼 전략에 대한 경쟁 환경 변화를 시사.,2,2,2,,Y,"국내 경쟁사 네이버의 스트리밍 플랫폼 치지직의 콘텐츠 경쟁력 강화 움직임으로, 카카오의 콘텐츠 전략에 시사하는 바가 있음. / v23_guardrail_fail:v41_competitor_guard_no_actual_competitor",gemini,OFF_TOPIC,,COMP_DOMESTIC_STRATEGY,domestic,,국내 경쟁사인 네이버 치지직의 e스포츠 콘텐츠 강화 전략은 카카오의 게임 및 콘텐츠 플랫폼 전략에 대한 경쟁 환경 변화를 시사.,네이버_치지직_e스포츠_콘텐츠_강화,경쟁사_콘텐츠_전략,,,
2454,경쟁사/해외이슈,경쟁사_해외이슈,배달의민족,배달앱이 마케팅까지 맡는다...배민·피자헛 전략적 협력 본격화,배달앱이 마케팅까지 맡는다 배민 피자헛 전략적 협력 본격화,중앙이코노미뉴스,중앙이코노미뉴스,"Wed, 17 Jun 2026 03:30:00 GMT",배달앱이 마케팅까지 맡는다...배민·피자헛 전략적 협력 본격화 중앙이코노미뉴스,https://news.google.com/rss/articles/CBMickFVX3lxTE1NZnJCeGRBcDFCMGIxS1JKR0thQVRYZ3EtSEpPX1NSR1AyOV9maWMtc3UxTzBJajdhcjhCSkE1R2d0bEItazk5RW54YmZKRFo5cWRSMFZEcEoyajRnM3hJc05BVnFmZjlmUDBGZEV1eVFNUQ?oc=5,google_rss_배달의민족 when:2d,56.0,11.0,policy_legislation,policy_legislation,배달의민족,,,,,,,general,24.0,published_today,business_change,global_incident:platform_regulation:baemin:delivery_app_fee_policy,general,Y,"industry_basis_pass:actor=True,change=False,bridge=True",2,competitor_actor_action_pass,Y,baemin,56.0,policy_legislation,competitor:general,global_incident:platform_regulation:baemin:delivery_app_fee_policy:general,global_incident:platform_regulation:baemin:delivery_app_fee_policy,경쟁사_해외이슈,COMPETITOR_PLATFORM_RISK,경쟁사_커머스_전략,배달의민족_피자헛_전략적_협력,국내 배달 플랫폼 경쟁사인 배달의민족이 피자헛과의 협력을 통해 커머스 서비스 경쟁력을 강화하는 움직임은 카카오의 로컬 서비스 전략에 참고.,2,2,2,,,"국내 로컬 커머스 시장 경쟁사인 배달의민족의 전략적 협력 사례로, 카카오의 로컬 서비스 경쟁 환경에 시사하는 바가 있음.",gemini,,,COMP_DOMESTIC_FINANCE_COMMERCE,domestic,,국내 배달 플랫폼 경쟁사인 배달의민족이 피자헛과의 협력을 통해 커머스 서비스 경쟁력을 강화하는 움직임은 카카오의 로컬 서비스 전략에 참고.,배달의민족_피자헛_전략적_협력,경쟁사_커머스_전략,,,
2026,경쟁사/해외이슈,경쟁사_해외이슈,네이버,네이버플레이스에서 동물병원도 찾는다…특화 필터 적용 | 노트펫,네이버플레이스에서 동물병원도 찾는다 특화 필터 적용 노트펫,매일경제,매일경제,"Tue, 16 Jun 2026 01:18:36 GMT",네이버플레이스에서 동물병원도 찾는다…특화 필터 적용 | 노트펫 매일경제,https://news.google.com/rss/articles/CBMiVEFVX3lxTE9BOVVIbkZJUGVtT1k5WWtMS0k5UFg2RzZxSUg2OU9KRDJIN0xxSTM4VXhueE9nM3RxSlJMYVY2WVl6NXY3c0otXzUxYlVfWGdXMzVlS9IBWkFVX3lxTE1UR05NY3F1T1RGLWQ2QU5uRWpHSG5nVDJzdzd3dWxnS19FVDJFUFdseXBXbWtQZFJFc0M4SWlJc2U1SVVzYU9DTjdFNUFEQkFZSGpqc0ZNd0kwQQ?oc=5,google_rss_네이버 site:mk.co.kr when:2d,55.5,67.5,platform_obligation,platform_obligation,네이버,v43_not_true_competitor,Y,,,,competitor:platform_obligation,platform_operator_obligation,14.0,published_yesterday,general,global_incident:platform_regulation:naver:platform_operator_obligation,action_started,Y,"industry_basis_pass:actor=True,change=False,bridge=True",2,competitor_actor_action_pass,Y,naver,55.5,platform_obligation,competitor:platform_obligation,global_incident:platform_regulation:naver:platform_operator_obligation:general,global_incident:platform_regulation:naver:platform_operator_obligation,경쟁사_해외이슈,COMPETITOR_PLATFORM_RISK,경쟁사_로컬_서비스_강화,네이버플레이스_특화_필터_확대,"국내 로컬 정보 플랫폼 경쟁사인 네이버플레이스가 서비스 범위를 확장하고 특화 기능을 강화하는 전략으로, 카카오의 로컬 서비스 전략에 참고할 필요가 있음.",2,2,2,,Y,"국내 경쟁사 네이버가 로컬 검색 서비스(네이버플레이스)의 기능을 강화하는 움직임으로, 카카오의 로컬 서비스 경쟁 환경에 시사하는 바가 있음. / v23_guardrail_fail:v41_competitor_guard_no_actual_competitor",gemini,,,COMP_DOMESTIC_STRATEGY,domestic,,"국내 로컬 정보 플랫폼 경쟁사인 네이버플레이스가 서비스 범위를 확장하고 특화 기능을 강화하는 전략으로, 카카오의 로컬 서비스 전략에 참고할 필요가 있음.",네이버플레이스_특화_필터_확대,경쟁사_로컬_서비스_강화,,,
535,정부/국회,정부_국회,과학기술정보통신부,"LGU+, 이용자 보호 '매우우수'…과징금 감경 '유예' : 네이버 블로그",lgu+ 이용자 보호 매우우수 과징금 감경 유예 네이버 블로그,Naver Blog,Naver Blog,"Tue, 16 Jun 2026 14:32:53 GMT","LGU+, 이용자 보호 '매우우수'…과징금 감경 '유예' : 네이버 블로그 Naver Blog",https://news.google.com/rss/articles/CBMijwFBVV95cUxPMnplV1pGeF9kTVpDNGVGQmV0WlNxalhoUGdxTXlnd1B1Si1fa0pqMXVFSEVnNmFGUXFUb3drWWRvQzl5T0ZjYThPT09COXpObTJuUWwwY3hpZ3NjamxKQy1CbURvQ0VndWs3RHNWdk9pVU1JZHlXMFdZNzd0VlYybjhMQVpFVWRFNko1WWY2WQ?oc=5,google_rss_과학기술정보통신부 과징금 when:2d,55.1,8.5,"antitrust_platform,legal_regulatory_enforcement",antitrust_general,"LGU+,네이버",v43_not_government_policy,Y,,,,government:platform_obligation,platform_operator_obligation,14.0,published_yesterday,official_action,global_incident:platform_regulation:naver:platform_transaction_user_protection_obligation,penalty_or_sanction,Y,"industry_basis_pass:actor=True,change=False,bridge=True",2,naver_telco_strategy_or_infra,Y,naver,55.1,legal_regulatory_enforcement,government:platform_obligation,global_incident:platform_regulation:naver:platform_transaction_user_protection_obligation:sanction_penalty,global_incident:platform_regulation:naver:platform_transaction_user_protection_obligation,경쟁사_해외이슈,OFF_TOPIC,경쟁사_규제_대응,LGU+_이용자_보호_평가_및_과징금_감경,국내 경쟁사인 LGU+의 이용자 보호 평가 및 과징금 감경 논의는 카카오의 규제 준수 노력과 정부의 플랫폼 사업자 평가 기준을 이해하는 데 참고 자료가 됨.,2,1,3,,,경쟁사 LGU+의 이용자 보호 평가 및 과징금 감경 사례는 플랫폼 사업자에 대한 정부 규제 및 평가 기조를 이해하는 데 중요.,gemini,,OFF_TOPIC,COMP_DOMESTIC_DIRECT_RISK,domestic,정부/국회 기사이나 카카오 플랫폼·AI·디지털금융과 연결 경로가 약함,국내 경쟁사인 LGU+의 이용자 보호 평가 및 과징금 감경 논의는 카카오의 규제 준수 노력과 정부의 플랫폼 사업자 평가 기준을 이해하는 데 참고 자료가 됨.,LGU+_이용자_보호_평가_및_과징금_감경,경쟁사_규제_대응,,weak_gov_basis:no_public_actor_action_domain,
364,자사 및 계열사 이슈,자사_및_계열사_이슈,카카오페이,"금융당국, 쿠팡페이·쿠팡파이낸셜 제재 착수…연내 완료 목표",금융당국 쿠팡페이 쿠팡파이낸셜 제재 착수 연내 완료 목표,연합뉴스,연합뉴스,"Wed, 17 Jun 2026 02:13:06 GMT","금융당국, 쿠팡페이·쿠팡파이낸셜 제재 착수…연내 완료 목표 연합뉴스",https://news.google.com/rss/articles/CBMiW0FVX3lxTE44NWh5T2w0U3VzNjYyaXp3SmptM0luTkVINWJ3UC0zZHdIeHFwa0FzSWMzX1Fmcy1pWTE0eVgxdTdjQ29ISVozVThxa3hHNHlYdW42T2haTlpTMnfSAWBBVV95cUxPNFotbjc3OXpHeUVZXzN1Y1JjVUFBdXprR2E3WUpva3ZYSjUxWDhCZ3FDRlNKRG94VWJiMmlqcjFMRDlMMTh2Ykc2SnhKeTlpdHg3eEpaOUdwTHE5Zm1nQUc?oc=5,google_rss_카카오페이 site:yna.co.kr when:2d,53.8,-52.0,legal_regulatory_enforcement,legal_regulatory_enforcement,쿠팡,v43_self_not_actual_actor:OFF_TOPIC;brand_not_in_title,Y,,,,competitor:platform_obligation,platform_operator_obligation,24.0,published_today,official_action,global_incident:platform_regulation:coupang:platform_operator_obligation,penalty_or_sanction,Y,"industry_basis_pass:actor=True,change=False,bridge=True",2,coupang_competitor_enforcement_or_risk,Y,coupang,53.8,legal_regulatory_enforcement,competitor:platform_obligation,global_incident:platform_regulation:coupang:platform_operator_obligation:sanction_penalty,global_incident:platform_regulation:coupang:platform_operator_obligation,경쟁사_해외이슈,COMPETITOR_PLATFORM_RISK,경쟁사_금융_규제,쿠팡페이_쿠팡파이낸셜_금융당국_제재_착수,"국내 핀테크 경쟁사인 쿠팡페이/파이낸셜에 대한 금융당국 제재는 카카오페이 등 유사 금융 플랫폼 사업자에 대한 규제 환경 변화를 시사하며, 선제적 대응 필요.",2,1,3,,,"국내 핀테크 경쟁사 쿠팡페이/파이낸셜에 대한 금융당국의 제재 착수 소식으로, 카카오페이 등 유사 금융 플랫폼에 대한 규제 동향 파악에 중요.",gemini,DIRECT_RISK,,COMP_DOMESTIC_FINANCE_COMMERCE,domestic,,"국내 핀테크 경쟁사인 쿠팡페이/파이낸셜에 대한 금융당국 제재는 카카오페이 등 유사 금융 플랫폼 사업자에 대한 규제 환경 변화를 시사하며, 선제적 대응 필요.",쿠팡페이_쿠팡파이낸셜_금융당국_제재_착수,경쟁사_금융_규제,,,
3209,산업동향,산업동향,인공지능 산업 동향,"중국 손잡은 한국투자증권, 글로벌 자산관리 강화",중국 손잡은 한국투자증권 글로벌 자산관리 강화,비즈트리뷴,비즈트리뷴,"Tue, 16 Jun 2026 06:22:00 GMT","중국 손잡은 한국투자증권, 글로벌 자산관리 강화 비즈트리뷴",https://news.google.com/rss/articles/CBMicEFVX3lxTE9oZWhBZjh2MUpmRFYzSkpsSzh0a3hZYlZhNmJjaEx6a0wyaEpSSGY4Y09PRE5NUzNud1hBMGNrdUNQT1RmRFRJeFM1MTUzTHpwN2s3OFdUZEsxUHJIWEN2OWNZUHB2S0xjQ0phcXg4d1I?oc=5,google_rss_인공지능 산업 동향 when:2d,47.5,2.0,,,,v43_not_structural_industry,,,,,,general,14.0,published_yesterday,general,,general,,"insufficient_industry_basis:actor=False,change=True,bridge=False",1,global_platform_or_overseas_rule,Y,global,47.5,ai_infrastructure_security,,,,산업동향,OFF_TOPIC,government_ai_core_policy,government_ai_core_policy:중국 손잡은 한국투자증권 글로벌 자산관리 강화,카카오 AI agent/AI 서비스 전략과 연결되는 핵심 정책환경,4,4,5,,Y,"한국투자증권의 글로벌 자산관리 협력 소식으로, 카카오의 핀테크 사업 또는 정책 환경에 직접적인 영향 경로가 약함. / v23_guardrail_fail:v27_industry_without_two_of_three_basis:insufficient_industry_basis:actor=False,change=True,bridge=False",gemini,,OFF_TOPIC,,other,카카오 AI agent/AI 서비스 전략과 연결되는 핵심 정책환경,,government_ai_core_policy:중국 손잡은 한국투자증권 글로벌 자산관리 강화,government_ai_core_policy,,,
2433,경쟁사/해외이슈,경쟁사_해외이슈,배달의민족,"배민-피자헛, 맞손…기획 메뉴·공동 마케팅 등 협력",배민 피자헛 맞손 기획 메뉴 공동 마케팅 등 협력,뉴스1,뉴스1,"Tue, 16 Jun 2026 23:43:09 GMT","배민-피자헛, 맞손…기획 메뉴·공동 마케팅 등 협력 뉴스1",https://news.google.com/rss/articles/CBMiX0FVX3lxTE1vbExBbWQyd2pKTTh6MEJhUVVPTEo4VnFpeGp6Mks3aHEyYTIxUWlnRURycFYwX210X2tHcENpbTlyQkRON0ctNkpxajhLRGhock1NUVhfLW1uNF9vVlc0?oc=5,google_rss_배달의민족 when:2d,47.0,4.0,,,배달의민족,,,,,,,general,12.0,published_today+analysis_without_direct_event,analysis_feature,global_incident:platform_regulation:baemin:delivery_app_fee_policy,general,Y,"industry_basis_pass:actor=True,change=False,bridge=True",2,competitor_actor_action_pass,Y,baemin,47.0,,,global_incident:platform_regulation:baemin:delivery_app_fee_policy:general,global_incident:platform_regulation:baemin:delivery_app_fee_policy,경쟁사_해외이슈,COMPETITOR_PLATFORM_RISK,경쟁사_커머스_전략,배달의민족_피자헛_전략적_협력,국내 배달 플랫폼 경쟁사인 배달의민족이 피자헛과의 협력을 통해 커머스 서비스 경쟁력을 강화하는 움직임은 카카오의 로컬 서비스 전략에 참고.,2,2,2,,,"국내 로컬 커머스 시장 경쟁사인 배달의민족의 전략적 협력 사례로, 카카오의 로컬 서비스 경쟁 환경에 시사하는 바가 있음.",gemini,,,COMP_DOMESTIC_FINANCE_COMMERCE,domestic,,국내 배달 플랫폼 경쟁사인 배달의민족이 피자헛과의 협력을 통해 커머스 서비스 경쟁력을 강화하는 움직임은 카카오의 로컬 서비스 전략에 참고.,배달의민족_피자헛_전략적_협력,경쟁사_커머스_전략,,,
3214,산업동향,산업동향,인공지능 산업 동향,"SK바이오팜, BIO USA 2026 참가-글로벌 협력 확대·AI 기반 신약개발 전략 공개",sk바이오팜 bio usa 2026 참가 글로벌 협력 확대 ai 기반 신약개발 전략 공개,미디어파인,미디어파인,"Tue, 16 Jun 2026 01:32:33 GMT","SK바이오팜, BIO USA 2026 참가-글로벌 협력 확대·AI 기반 신약개발 전략 공개 미디어파인",https://news.google.com/rss/articles/CBMibkFVX3lxTE54NXlXYnFSYVA1V3MwMEN4THNocGphSlFHalhub2tfNmZ4UFo0Qi1EcWdldjJ3RXdUYUhJMlp4b0ZKdE5YTWN0Q0s4U3pZRW5VWkMtZXZhLV8zVmxLNDhHajdfWDdGdjZiQVdsU09R?oc=5,google_rss_인공지능 산업 동향 when:2d,46.5,16.0,"ai_infrastructure_security,policy_legislation",ai_infrastructure_security,,v43_not_structural_industry,,,,,,general,14.0,published_yesterday,business_change,,rumor_or_report,,"weak_form_without_full_basis:actor=False,change=True,bridge=False",1,global_platform_or_overseas_rule,Y,global,46.5,"policy_legislation,ai_infrastructure_security",industry:ai_infrastructure,,,산업동향,OFF_TOPIC,government_ai_core_policy,government_ai_core_policy:sk바이오팜 bio usa 2026 참가 글로벌 협력 확대 ai 기반 신약개발 전략 공개,카카오 AI agent/AI 서비스 전략과 연결되는 핵심 정책환경,2,4,5,,Y,"제약 산업 내 AI 활용 사례로, 카카오의 플랫폼/AI 사업 또는 정책 환경에 직접적인 영향 경로가 약함. / v23_guardrail_fail:v27_industry_without_two_of_three_basis:weak_form_without_full_basis:actor=False,change=True,bridge=False",gemini,,OFF_TOPIC,,other,카카오 AI agent/AI 서비스 전략과 연결되는 핵심 정책환경,,government_ai_core_policy:sk바이오팜 bio usa 2026 참가 글로벌 협력 확대 ai 기반 신약개발 전략 공개,government_ai_core_policy,,,
2444,경쟁사/해외이슈,경쟁사_해외이슈,배달의민족,배민·피자헛 맞손…온라인 사업 활성화 협력,배민 피자헛 맞손 온라인 사업 활성화 협력,스포츠한국,스포츠한국,"Wed, 17 Jun 2026 02:54:24 GMT",배민·피자헛 맞손…온라인 사업 활성화 협력 스포츠한국,https://news.google.com/rss/articles/CBMicEFVX3lxTE1Sb0lhWDNZbTBqR0JDdzE0YV9CTjFFQktCQ09IaF80QVlDR1pfakpHZHA5dVZUelFFYWwwc1otZElwdXBVdGY5ZU1sQjA4WXdaOWZIcjRoYXpJaXZ3Wm54YjBSaTFLSVh4Z2czTmN5T2vSAXRBVV95cUxPa2VMamhuQTByZjZBbWcxX0JLR2NLaW1WMEJCZHQybDZNVktieFh3aFgwUnl0RUpBdEZod3VJNkdFNi1HaFZWNkpMdWJ2Z3NobGVZdzZhN1JsU2JmOWxZUzIwMXFrTTJYMEVtUEZ1VHJPaHhzQw?oc=5,google_rss_배달의민족 when:2d,46.0,4.0,,,배달의민족,,,,,,,general,24.0,published_today,general,global_incident:platform_regulation:baemin:delivery_app_fee_policy,general,Y,"industry_basis_pass:actor=True,change=False,bridge=True",2,competitor_actor_action_pass,Y,baemin,46.0,,,global_incident:platform_regulation:baemin:delivery_app_fee_policy:general,global_incident:platform_regulation:baemin:delivery_app_fee_policy,경쟁사_해외이슈,COMPETITOR_PLATFORM_RISK,경쟁사_커머스_전략,배달의민족_피자헛_전략적_협력,국내 배달 플랫폼 경쟁사인 배달의민족이 피자헛과의 협력을 통해 커머스 서비스 경쟁력을 강화하는 움직임은 카카오의 로컬 서비스 전략에 참고.,2,2,2,,,"국내 로컬 커머스 시장 경쟁사인 배달의민족의 전략적 협력 사례로, 카카오의 로컬 서비스 경쟁 환경에 시사하는 바가 있음.",gemini,,,COMP_DOMESTIC_FINANCE_COMMERCE,domestic,,국내 배달 플랫폼 경쟁사인 배달의민족이 피자헛과의 협력을 통해 커머스 서비스 경쟁력을 강화하는 움직임은 카카오의 로컬 서비스 전략에 참고.,배달의민족_피자헛_전략적_협력,경쟁사_커머스_전략,,,
2423,경쟁사/해외이슈,경쟁사_해외이슈,배달의민족,배민-피자헛 손잡고 배달시장 공동 공략,배민 피자헛 손잡고 배달시장 공동 공략,디지털투데이,디지털투데이,"Wed, 17 Jun 2026 00:40:00 GMT",배민-피자헛 손잡고 배달시장 공동 공략 디지털투데이,https://news.google.com/rss/articles/CBMic0FVX3lxTE9vT1BfaVUzcU0zd2RvMEFTRUNhWDJ5SU5vT0hYODFveXJmckFXVHcySXVqblJWcGFISWdpeUNOVW0yR1MxUHVuMlJCSkF4bzVvb2RJVVc5NVY4Z3BYd3VOYjJWX3dxcEZ4TTRpRGlHQUdYbWM?oc=5,google_rss_배달의민족 when:2d,46.0,4.0,,,배달의민족,,,,,,,general,24.0,published_today,general,global_incident:platform_regulation:baemin:delivery_app_fee_policy,general,Y,"industry_basis_pass:actor=True,change=False,bridge=True",2,competitor_actor_action_pass,Y,baemin,46.0,,,global_incident:platform_regulation:baemin:delivery_app_fee_policy:general,global_incident:platform_regulation:baemin:delivery_app_fee_policy,경쟁사_해외이슈,COMPETITOR_PLATFORM_RISK,경쟁사_커머스_전략,배달의민족_피자헛_전략적_협력,국내 배달 플랫폼 경쟁사인 배달의민족이 피자헛과의 협력을 통해 커머스 서비스 경쟁력을 강화하는 움직임은 카카오의 로컬 서비스 전략에 참고.,2,2,2,,,"국내 로컬 커머스 시장 경쟁사인 배달의민족의 전략적 협력 사례로, 카카오의 로컬 서비스 경쟁 환경에 시사하는 바가 있음.",gemini,,,COMP_DOMESTIC_FINANCE_COMMERCE,domestic,,국내 배달 플랫폼 경쟁사인 배달의민족이 피자헛과의 협력을 통해 커머스 서비스 경쟁력을 강화하는 움직임은 카카오의 로컬 서비스 전략에 참고.,배달의민족_피자헛_전략적_협력,경쟁사_커머스_전략,,,
