id,원카테고리,JSON카테고리,검색어,기사제목,기사제목_정규화,언론사,정규언론사,게시일,본문요약,링크,수집채널,랭킹점수,중요도점수,사건태그,사건단계,주요주체,랭킹감점사유,정책규제의무,강제검토,강제검토사유,자사홍보성,이슈패밀리,코드힌트,오늘성점수,오늘성사유,기사유형,v26이벤트키,v26진행단계,v27_industry_ok,v27_industry_reason,v27_industry_score,v32_competitor_basis,v32_competitor_portfolio,v32_actor_group,랭킹원점수,편집신호,스토리버킷,전역사건키,전역사건기본키,Gemini카테고리,Gemini내부카테고리,Gemini이슈패밀리,Gemini이슈그룹,Gemini관련성,Gemini중요도,Gemini대외협력중요도,Gemini관련도,GeminiPR성,Gemini제외,Gemini판단사유,Gemini라벨소스,Gemini자사티어,Gemini정부티어,Gemini경쟁사티어,Gemini경쟁사범위,Gemini정책영향경로,Gemini경쟁시사점,Gemini중복그룹,Gemini이슈유형,v27_event_key,v26_2_profile_reason,v26가드레일사유
575,정부/국회,정부_국회,과학기술정보통신부,"KT그룹 희망나눔재단, 'K-AI 콘텐츠 공모전'…과기정통부 '전국민 AI 경진대회' 연계",kt그룹 희망나눔재단 k ai 콘텐츠 공모전 과기정통부 전국민 ai 경진대회 연계,네이트,네이트,"Wed, 17 Jun 2026 01:09:00 GMT","KT그룹 희망나눔재단, 'K-AI 콘텐츠 공모전'…과기정통부 '전국민 AI 경진대회' 연계 네이트",https://news.google.com/rss/articles/CBMiYEFVX3lxTE5uX0hRNDJyOE40VFZUZU9Yd1FISzJJY1JHcWVVcHZCSmF4U3VPMnZGMXJvUW5teDBwY0FVaGgtVVpBaU5aY2hPcGhZQzZYVjBpRTlraVVEUmE2OVlDSjU4RA?oc=5,google_rss_과학기술정보통신부 개인정보 when:2d,107.6,45.5,ai_infrastructure_security,ai_infrastructure_security,과기정통부,,,,,,,general,24.0,published_today,business_change,event:과기정통부:ai_infrastructure_security,general,Y,"industry_basis_pass:actor=True,change=False,bridge=True",2,,,,107.6,ai_infrastructure_security,government:tech_security_policy,,,정부_국회,COMPETITOR_PLATFORM_RISK,AI_인재_양성,과기정통부_KT그룹_K-AI_콘텐츠_공모전_연계,"정부와 경쟁사(KT)가 연계한 AI 인재 양성 및 대국민 AI 인식 제고 노력은 카카오의 AI 사업에 직접적인 영향은 적지만, AI 인력 수급 등 장기적인 환경 변화를 모니터링할 필요가 있음.",3,3,3,,,"정부와 경쟁사 연계 AI 행사로, 직접적인 영향은 적지만 AI 생태계 동향 파악에 참고.",gemini,,GOV_ADJACENT_DIGITAL_POLICY,COMP_DOMESTIC_AI_PLATFORM,domestic,"직접적인 정책 의무나 규제 변화는 없으나, 정부의 AI 인력 양성 정책 및 경쟁사의 AI 생태계 조성 노력을 파악하는 데 참고.",카카오 AI agent/AI 서비스 전략과 연결되는 핵심 정책환경,과기정통부_KT그룹_K-AI_콘텐츠_공모전_연계,AI_인재_양성,,,
416,정부/국회,정부_국회,과학기술정보통신부,"KT그룹 희망나눔재단, ‘K-AI 콘텐츠 공모전’…과기정통부 ‘전국민 AI 경진대회’ 연계",kt그룹 희망나눔재단 k ai 콘텐츠 공모전 과기정통부 전국민 ai 경진대회 연계,이투데이,이투데이,"Wed, 17 Jun 2026 01:08:00 GMT","KT그룹 희망나눔재단, ‘K-AI 콘텐츠 공모전’…과기정통부 ‘전국민 AI 경진대회’ 연계 이투데이",https://news.google.com/rss/articles/CBMiVEFVX3lxTE42VWNnQ2hhQkpoVUt2M1h5SHctVUhhYVRGdzNJU3hsXzN3dnlQU3NIc0VwZklnWXh2LWZqNU12WTk4X2Z6Yy1rY3FpRUd0NF9kcUx1Zw?oc=5,google_rss_과학기술정보통신부 when:2d,107.6,45.5,ai_infrastructure_security,ai_infrastructure_security,과기정통부,,,,,,,general,24.0,published_today,business_change,event:과기정통부:ai_infrastructure_security,general,Y,"industry_basis_pass:actor=True,change=False,bridge=True",2,,,,107.6,ai_infrastructure_security,government:tech_security_policy,,,정부_국회,COMPETITOR_PLATFORM_RISK,AI_인재_양성,과기정통부_KT그룹_K-AI_콘텐츠_공모전_연계,"정부와 경쟁사(KT)가 연계한 AI 인재 양성 및 대국민 AI 인식 제고 노력은 카카오의 AI 사업에 직접적인 영향은 적지만, AI 인력 수급 등 장기적인 환경 변화를 모니터링할 필요가 있음.",3,3,3,,,"정부와 경쟁사 연계 AI 행사로, 직접적인 영향은 적지만 AI 생태계 동향 파악에 참고 (575와 동일 이슈).",gemini,,GOV_ADJACENT_DIGITAL_POLICY,COMP_DOMESTIC_AI_PLATFORM,domestic,"직접적인 정책 의무나 규제 변화는 없으나, 정부의 AI 인력 양성 정책 및 경쟁사의 AI 생태계 조성 노력을 파악하는 데 참고.",카카오 AI agent/AI 서비스 전략과 연결되는 핵심 정책환경,과기정통부_KT그룹_K-AI_콘텐츠_공모전_연계,AI_인재_양성,,,
780,정부/국회,정부_국회,공정거래위원회,쿠팡 '심판이자 선수' 규제 사각지대 확대…공정위 칼날 어디까지,쿠팡 심판이자 선수 규제 사각지대 확대 공정위 칼날 어디까지,한국AI부동산신문,한국AI부동산신문,"Mon, 15 Jun 2026 21:42:10 GMT",쿠팡 '심판이자 선수' 규제 사각지대 확대…공정위 칼날 어디까지 한국AI부동산신문,https://news.google.com/rss/articles/CBMiTEFVX3lxTE1zXzJKTjU3cnBJMUE5YWZOV25zVzczOUZmbTRyUkwwZF8tM2duamQ1dVNOTF93UmE5dTUtMUpGbzRUUkZpLXRUTDZsYzA?oc=5,google_rss_공정거래위원회 규제 when:2d,106.6,121.5,"ai_infrastructure_security,antitrust_platform,policy_legislation",antitrust_general,"공정위,쿠팡",,Y,,,,government:platform_obligation,platform_operator_obligation,14.0,published_yesterday,business_change,global_incident:platform_regulation:coupang:platform_operator_obligation,general,Y,"industry_basis_pass:actor=True,change=True,bridge=True",3,,,,106.6,"policy_legislation,ai_infrastructure_security",government:platform_obligation,global_incident:platform_regulation:coupang:platform_operator_obligation:general,global_incident:platform_regulation:coupang:platform_operator_obligation,정부_국회,GOV_PLATFORM_REGULATION,플랫폼_시장_공정화,쿠팡_자사우대_규제_논의_및_공정위_칼날,쿠팡의 '심판이자 선수' 행위에 대한 공정위의 규제 논의는 카카오를 포함한 모든 대형 플랫폼 사업자에 적용될 수 있는 중요한 정책 방향을 제시.,2,1,1,,,쿠팡에 대한 공정위 규제는 플랫폼 전반의 자사우대 행위에 대한 정책 기조를 파악하는 데 중요.,gemini,,GOV_PLATFORM_MARKET_RULE,COMP_DOMESTIC_AI_PLATFORM,domestic,"플랫폼의 자사우대, PB 상품, 검색 노출 등과 관련된 공정거래 규제 및 가이드라인 강화로 이어질 수 있어 카카오 커머스 및 서비스 운영에 직접적인 영향.",카카오 AI agent/AI 서비스 전략과 연결되는 핵심 정책환경,쿠팡_자사우대_규제_논의_및_공정위_칼날,플랫폼_시장_공정화,,,
1820,정부/국회,정부_국회,AI기본법,"AI·자율주행 개발 더 쉽게…정부, 공간정보 규제 완화",ai 자율주행 개발 더 쉽게 정부 공간정보 규제 완화,연합뉴스,연합뉴스,"Tue, 16 Jun 2026 02:00:05 GMT","AI·자율주행 개발 더 쉽게…정부, 공간정보 규제 완화 연합뉴스",https://news.google.com/rss/articles/CBMiW0FVX3lxTE9qVlJoZjliVVpPY0Z0ekMyM3J0VmdsSkU3ZDNnVWVaRmhYTzI0VnBzWHhYaG16RGsyQkJQUFdnWkhQQ245NTBONGd1ZnBnM3FONVYyVjdzbk1PYU3SAWBBVV95cUxOU0doNkF3WlI3TWd1U2EzdHc4SzVxdFBJX0VUem1NZzIya2VQclpyM1NBdHpMaU9LX0lZWWw5alJtZUtYLWxRMnBXbW1uN2xzXy1mN0l4SktLUUlLSl9SSjM?oc=5,google_rss_AI기본법 when:2d,106.6,47.0,"ai_infrastructure_security,policy_legislation",ai_infrastructure_security,,,,,,,,general,14.0,published_yesterday,business_change,,general,,"insufficient_industry_basis:actor=False,change=True,bridge=False",1,,,,106.6,"policy_legislation,ai_infrastructure_security",government:tech_security_policy,,,정부_국회,GOV_AI_DIGITAL_POLICY,AI_규제_완화,AI_자율주행_공간정보_규제_완화,정부의 AI 및 자율주행 개발을 위한 공간정보 규제 완화는 카카오 모빌리티나 AI 지도/공간 정보 활용 서비스 개발에 긍정적인 영향을 줄 수 있음.,2,2,2,,,카카오 모빌리티 등 AI 기반 서비스 개발에 긍정적 영향을 미칠 수 있는 규제 완화.,gemini,,GOV_ADJACENT_DIGITAL_POLICY,,domestic,"공간정보 활용 장벽이 낮아져 AI 기반 서비스 개발 및 상용화에 유리한 환경이 조성되며, 카카오의 관련 사업 확장 기회.",,AI_자율주행_공간정보_규제_완화,AI_규제_완화,,,
125,자사 및 계열사 이슈,자사_및_계열사_이슈,카카오,"카카오, 은행들과 원화 스테이블코인 컨소시엄 추진",카카오 은행들과 원화 스테이블코인 컨소시엄 추진,Traders Union,Traders Union,"Tue, 16 Jun 2026 09:25:19 GMT","카카오, 은행들과 원화 스테이블코인 컨소시엄 추진 Traders Union",https://news.google.com/rss/articles/CBMioAFBVV95cUxPNDlvZ3VHbGxIRkw0eHhla24taVI4ZDFGRWR2RHMxQWNrY3RPVHNyVXV5RjV5emRkY3ppaVRxVTBaUFZvcEtVWkQ2cFNRMGlTclcwd1FtWVRLTm1BeDVMUC1mZ25fcng2TzF5V1RFbks5LVlmNXRRUmVDSHFDc3pOS3QzTjlxMTJIbTdaN2pmUzBCbkRCVHd2UVROWkUzaEU3?oc=5,google_rss_카카오 두나무 when:2d,105.8,90.5,"digital_asset_stablecoin,stablecoin,strategy_mna_governance",stablecoin_general,카카오,,,Y,must_review:self_strict:strategy_mna:strategy_mna_governance,,,direct_self_risk,14.0,published_yesterday,general,event:카카오:digital_asset_stablecoin+stablecoin,general,Y,"industry_basis_pass:actor=True,change=False,bridge=True",2,,,,105.8,"strategy_mna_governance,digital_asset_stablecoin",self:strategy_mna,,,자사_및_계열사_이슈,SELF_AFFILIATE_BUSINESS,self_strategic_reference,카카오_원화_스테이블코인_컨소시엄_추진,"카카오·계열사의 사업 확장, 제휴, MOU, 신규 서비스 참고 이슈",3,3,3,,,v41: 실제 카카오 주체의 사업 확장·제휴성 이슈로 2순위 허용,gemini,STRATEGIC_REFERENCE,,,other,,,카카오_원화_스테이블코인_컨소시엄_추진,self_strategic_reference,,,
1548,정부/국회,정부_국회,과학기술정보통신위원회,"디지털자산기본법, TF 해체에 정무위 재편까지…입법 재개 '안갯속'",디지털자산기본법 tf 해체에 정무위 재편까지 입법 재개 안갯속,핀포인트뉴스,핀포인트뉴스,"Tue, 16 Jun 2026 11:00:00 GMT","디지털자산기본법, TF 해체에 정무위 재편까지…입법 재개 '안갯속' 핀포인트뉴스",https://news.google.com/rss/articles/CBMic0FVX3lxTE4xSzY1eVNlVXZvQjlOOWlfMEh1a1l3bnZKVHc1OWdWZEVVRDNzaXhYS09mWWtRQ1lMZ3ZYRmR2SjRsUGJ3cGdtT3lXaHoxUTlNSGxYcjdIbVQxanpFWFhtZVdPd0ZDTmt6UFJ0a1BDd09kSVXSAXdBVV95cUxOcFRZT0dqcFZHNWR1T0xKRVYwcUplQmVVa0k2em1aazJheGdRSnNndllicTRON2FRbUJBcHAxQVA0VUtLbDFBVWVfVnZTV1FuVnlZR25wSkVEZGROM1dHd2dSMlpsV0dIWVNHV2xOWjRKUWl4cmRwNA?oc=5,google_rss_과학기술정보통신위원회 when:2d,105.6,85.0,"digital_asset_stablecoin,policy_legislation,stablecoin",stablecoin_legislation,,,,,,,,general,14.0,published_yesterday,general,global_incident:digital_asset_policy:digital_asset_sector:digital_asset_policy,general,Y,"industry_basis_pass:actor=False,change=True,bridge=True",2,,,,105.6,"policy_legislation,digital_asset_stablecoin",government:digital_asset,global_incident:digital_asset_policy:digital_asset_sector:digital_asset_policy:general,global_incident:digital_asset_policy:digital_asset_sector:digital_asset_policy,정부_국회,GOV_FINANCIAL_DIGITAL_POLICY,디지털자산_정책,디지털자산기본법_입법_지연_및_불확실성,디지털자산기본법의 입법 지연 및 불확실성은 카카오의 디지털자산 및 블록체인 사업 추진에 중대한 영향을 미쳐 전략 수립 및 규제 환경 예측에 어려움을 가중.,1,1,1,,,카카오의 디지털자산 사업에 직접적인 영향을 미치는 법안의 불확실성.,gemini,,GOV_DIGITAL_FINANCE_POLICY,,domestic,법적 프레임워크의 불확실성은 카카오의 블록체인 기반 서비스(예: 클레이튼) 개발 및 운영에 대한 리스크를 증가시키고 사업 계획 조정 필요성을 제기.,,디지털자산기본법_입법_지연_및_불확실성,디지털자산_정책,,,
406,정부/국회,정부_국회,과학기술정보통신부,"DGIST, 과학기술정보통신부 `AI 휴머노이드` 신규 과제 선정…77억5천만원 정부 지원",dgist 과학기술정보통신부 ai 휴머노이드 신규 과제 선정 77억5천만원 정부 지원,매일신문,매일신문,"Tue, 16 Jun 2026 23:56:18 GMT","DGIST, 과학기술정보통신부 `AI 휴머노이드` 신규 과제 선정…77억5천만원 정부 지원 매일신문",https://news.google.com/rss/articles/CBMiYkFVX3lxTE5DSHdEcTNuTWVLNU8zT3hNTE8xaF90WElWUzM0VEtaZXdkUUplVGtUdnFXM0N2M2dweWcxdEcwSE4yNkJwZUlQZHE0YU80VDRZQUUwZW4wcjFOM3ItbDdNNGVB?oc=5,google_rss_과학기술정보통신부 when:2d,105.1,42.5,ai_infrastructure_security,ai_infrastructure_security,과기정통부,,,,,,,general,24.0,published_today,business_change,event:과기정통부:ai_infrastructure_security,general,,"insufficient_industry_basis:actor=False,change=False,bridge=False",0,,,,105.1,ai_infrastructure_security,government:tech_security_policy,,,정부_국회,GOV_AI_DIGITAL_POLICY,AI_R&D_지원,과기정통부_AI_휴머노이드_연구_지원,"정부의 AI 휴머노이드 연구 지원은 카카오의 AI 핵심 전략(LLM, AI 에이전트 등)과는 다소 거리가 있지만, 장기적인 AI 기술 발전 방향을 모니터링하는 참고 자료.",3,3,3,,,"AI 관련 연구 지원이지만, 카카오의 핵심 AI 전략 및 사업과의 직접적 연관성이 낮음 (404와 동일 이슈).",gemini,,GOV_ADJACENT_DIGITAL_POLICY,,domestic,"직접적인 정책 의무나 규제 변화는 없으나, 정부의 AI 투자 및 육성 방향을 이해하고 미래 기술 트렌드를 예측하는 데 도움이 됨.",,과기정통부_AI_휴머노이드_연구_지원,AI_R&D_지원,,,
342,자사 및 계열사 이슈,자사_및_계열사_이슈,카카오톡,"'금요일 휴무' 엮어 4일짜리 파업 논란⋯전문가 ""카카오 노조 행보 이례적""",금요일 휴무 엮어 4일짜리 파업 논란 전문가 카카오 노조 행보 이례적,이투데이,이투데이,"Tue, 16 Jun 2026 06:00:00 GMT","'금요일 휴무' 엮어 4일짜리 파업 논란⋯전문가 ""카카오 노조 행보 이례적"" 이투데이",https://news.google.com/rss/articles/CBMiVEFVX3lxTE5BNjdtczRFNHgxOW1BMjdvZGcwNGN4SFE0UVZlZGFWbE1wMzRSRWp2YUx3NW5oR3kwdnRxYUhoS2VkcUdTWGx4OGZsbHREeHJzY1dKVA?oc=5,google_rss_카카오톡 노조 when:2d,104.8,89.5,"labor_dispute,labor_negotiation",labor_general,카카오,brand_not_in_title,,Y,must_review:self_strict:labor_strike:labor_negotiation,,,direct_self_risk,14.0,published_yesterday,direct_risk,global_incident:labor_ir:kakao:strike_negotiation,general,Y,"industry_basis_pass:actor=True,change=False,bridge=True",2,,,,104.8,labor_negotiation,self:labor_strike,global_incident:labor_ir:kakao:strike_negotiation:conflict_escalation,global_incident:labor_ir:kakao:strike_negotiation,자사_및_계열사_이슈,SELF_DIRECT_RISK,카카오_노조,카카오 노조 임단협/파업 및 내부 갈등,"노조의 파업은 서비스 운영 차질, 내부 직원 사기 저하, 기업 이미지 손상, 외부 주주 및 투자자 인식 악화 등 카카오에 직접적인 리스크를 초래할 수 있음.",1,1,1,,,카카오 노조의 2차 파업 예고는 직접적인 경영 리스크 (78과 동일 이슈).,gemini,DIRECT_RISK,,,other,,,카카오 노조 임단협/파업 및 내부 갈등,카카오_노조,,,
1003,정부/국회,정부_국회,금융위원회,"금융위, 30년 된 '화석 규제' 깬다…씬파일러·AI 위한 신정법 개정 착수",금융위 30년 된 화석 규제 깬다 씬파일러 ai 위한 신정법 개정 착수,뉴시스,뉴시스,"Tue, 16 Jun 2026 03:00:00 GMT","금융위, 30년 된 '화석 규제' 깬다…씬파일러·AI 위한 신정법 개정 착수 뉴시스",https://news.google.com/rss/articles/CBMiYEFVX3lxTE5ZY2dPNXllUVFXaV9ONkZWbTRpUjBGRWkxQU5DNlRUWUlZVkNjVE1aTEIzbnlIRFdoZnhOOVJFMHp2MW5tTzBTWURuNkFiWG1HMUhGXzZmOFlrcVlXZHdMWtIBeEFVX3lxTFBMYlFpMnNWTDFfNWlCUXh6ZGFRMW1tZk5YVUtNVkhFTmtZOGZUaXFTekg2N2dXQnlqTXgzeHNYeWtPR3FjZW9jenByeDFzeHVGeEJORzB5V2N3OURzMzFXVUZnMEJkeGhGUmY5QnJrYkFVWUNhT2V4OA?oc=5,google_rss_금융위원회 AI when:2d,103.6,52.5,"ai_infrastructure_security,policy_legislation",ai_infrastructure_security,금융위,,,,,,,general,14.0,published_yesterday,business_change,event:금융위:ai_infrastructure_security+policy_legislation,general,,"insufficient_industry_basis:actor=False,change=True,bridge=False",1,,,,103.6,"policy_legislation,ai_infrastructure_security",government:tech_security_policy,,,정부_국회,GOV_AI_DIGITAL_POLICY,금융_AI_규제,금융위_AI_기반_신용정보법_개정_추진,금융위원회의 신용정보법 개정은 카카오페이 등 핀테크 사업의 AI 기반 신용 평가 및 금융 서비스 혁신에 중요한 영향을 미칠 정책 변화.,1,1,1,,,카카오페이 등 AI 기반 금융 서비스에 직접적인 영향을 미치는 핵심 정책 변화.,gemini,,GOV_AI_CORE_POLICY,,domestic,"신용정보법 개정은 AI를 활용한 신용평가, 금융상품 추천 등 카카오 핀테크 서비스의 확장 및 고도화에 유리한 환경을 조성할 수 있음.",,금융위_AI_기반_신용정보법_개정_추진,금융_AI_규제,,,
718,정부/국회,정부_국회,공정거래위원회,"공정위, 사전 의견청취부터 신고인 참여…심의 통지도 앞당겨",공정위 사전 의견청취부터 신고인 참여 심의 통지도 앞당겨,뉴스1,뉴스1,"Tue, 16 Jun 2026 04:19:55 GMT","공정위, 사전 의견청취부터 신고인 참여…심의 통지도 앞당겨 뉴스1",https://news.google.com/rss/articles/CBMiVEFVX3lxTE9jN0hnaXVrS0NrVDdrQUZlYjkzR0Y0X201b2Jwb3JqXzFsalFjU2VsU3d6TzR3YURiYm10YzVaekpkcS1iUndpR1ZKX0hndWxoa2hvNw?oc=5,google_rss_공정거래위원회 when:2d,103.6,45.5,antitrust_platform,antitrust_general,공정위,,,,,,,general,14.0,published_yesterday,official_action,global_incident:platform_regulation:fair_trade_authority:platform_regulation,general,,"insufficient_industry_basis:actor=False,change=False,bridge=False",0,,,,103.6,policy_legislation,,global_incident:platform_regulation:fair_trade_authority:platform_regulation:general,global_incident:platform_regulation:fair_trade_authority:platform_regulation,정부_국회,GOV_PLATFORM_REGULATION,공정위_절차,공정위_심의절차_개선,"공정위의 심의 절차 개선은 카카오에 직접적인 정책 의무를 부과하는 것은 아니지만, 향후 공정위 조사나 제재 시 기업의 대응 방식에 영향을 줄 수 있는 참고 사항.",4,2,2,,,"공정위의 절차 개선으로, 직접적인 정책 영향보다는 절차적 참고 자료.",gemini,,GOV_GENERAL_LOW_RELEVANCE,,domestic,공정위 관련 이슈 발생 시 법무/대외협력팀의 대응 전략 수립에 필요한 정보로 활용될 수 있음.,,공정위_심의절차_개선,공정위_절차,,,
1420,정부/국회,정부_국회,중소벤처기업부,"중기부, '모두의 창업' 1기 출범…시니어 의료·AI 등 혁신 시동(종합)",중기부 모두의 창업 1기 출범 시니어 의료 ai 등 혁신 시동,연합뉴스,연합뉴스,"Tue, 16 Jun 2026 08:41:04 GMT","중기부, '모두의 창업' 1기 출범…시니어 의료·AI 등 혁신 시동(종합) 연합뉴스",https://news.google.com/rss/articles/CBMiW0FVX3lxTE1maWlZLUVFY1NsUU5OWjMyS1pVZlA3OEFXNWJodmRkRllnU0I4RnpWSGZWRFAyVzhlTnp2aVNsVzJYWFRtN0JZSEFlS2ZRN3RCVkJXSHdWNnZBUVXSAWBBVV95cUxQT3EtX3JYVkh6SzhTZEZocS1jUzFnNTQ0bE03bm9mbUpNeVFmaEZCMzJpQ3F3bF9UWjJJc1dUY2JNZkI2Qjh0aEFXWUVrdEhCclo0R0RPMUpxNnBJWE13NEo?oc=5,google_rss_중소벤처기업부 when:2d,103.6,40.0,ai_infrastructure_security,ai_infrastructure_security,,,,,,,,general,19.0,published_yesterday+exclusive_breaking,business_change,,action_started,,"insufficient_industry_basis:actor=False,change=False,bridge=False",0,,,,103.6,ai_infrastructure_security,government:tech_security_policy,,,정부_국회,GOV_AI_DIGITAL_POLICY,창업_지원,중기부_시니어_의료AI_창업_지원,"정부의 특정 분야 창업 지원은 카카오의 대외협력 및 정책 리스크와 직접적인 관련성은 낮지만, AI 생태계 확장에 간접적으로 기여할 수 있는 장기적인 동향.",4,2,2,,,"AI 관련 창업 지원이나, 카카오의 핵심 사업이나 규제 환경에 직접적인 영향은 미미함.",gemini,,GOV_GENERAL_LOW_RELEVANCE,,domestic,"카카오에 직접적인 정책 의무나 영향을 미치지는 않지만, AI 기반 스타트업 육성 동향을 파악하는 데 참고할 수 있음.",,중기부_시니어_의료AI_창업_지원,창업_지원,,,
985,정부/국회,정부_국회,금융위원회,"30년 묵은 신용정보 동의제도 손본다…금융위, AI 가로막는 '화석 규제' 정조준",30년 묵은 신용정보 동의제도 손본다 금융위 ai 가로막는 화석 규제 정조준,네이트,네이트,"Tue, 16 Jun 2026 08:00:00 GMT","30년 묵은 신용정보 동의제도 손본다…금융위, AI 가로막는 '화석 규제' 정조준 네이트",https://news.google.com/rss/articles/CBMiU0FVX3lxTFB5ejB4MnRneHBLNEYwSVhQRUNkV3E0Q0xwbGFCMGc5NXB2UzY3WmpqMGhVTWE5a1R5eWRDS3FuZ2NCcDRrNGprMWl5NUdSN3NQamdZ?oc=5,"google_rss_""금융위원회"" when:2d",102.6,52.5,"ai_infrastructure_security,policy_legislation",ai_infrastructure_security,금융위,,,,,,,general,14.0,published_yesterday,business_change,event:금융위:ai_infrastructure_security+policy_legislation,general,,"insufficient_industry_basis:actor=False,change=True,bridge=False",1,,,,102.6,"policy_legislation,ai_infrastructure_security",government:tech_security_policy,,,정부_국회,GOV_AI_DIGITAL_POLICY,금융_AI_규제,금융위_AI_기반_신용정보법_개정_추진,금융위원회의 신용정보법 개정은 카카오페이 등 핀테크 사업의 AI 기반 신용 평가 및 금융 서비스 혁신에 중요한 영향을 미칠 정책 변화.,1,1,1,,,카카오페이 등 AI 기반 금융 서비스에 직접적인 영향을 미치는 핵심 정책 변화 (1003과 동일 이슈).,gemini,,GOV_AI_CORE_POLICY,,domestic,"신용정보법 개정은 AI를 활용한 신용평가, 금융상품 추천 등 카카오 핀테크 서비스의 확장 및 고도화에 유리한 환경을 조성할 수 있음.",,금융위_AI_기반_신용정보법_개정_추진,금융_AI_규제,,,
903,정부/국회,정부_국회,금융위원회,"30년 묵은 신용정보 동의제도 손본다…금융위, AI 가로막는 '화석 규제' 정조준",30년 묵은 신용정보 동의제도 손본다 금융위 ai 가로막는 화석 규제 정조준,데일리안,데일리안,"Tue, 16 Jun 2026 07:59:00 GMT","30년 묵은 신용정보 동의제도 손본다…금융위, AI 가로막는 '화석 규제' 정조준 데일리안",https://news.google.com/rss/articles/CBMikAJBVV95cUxPbUxjNGcwTERSXzZmdDVvbTRvR2VYS1dEdGFFWFlUVlNvdFl6azI2NjlzOEpOcHpZZmczNWhWbGtZWDFZUHRZZTJDS1QtalY4Z2RncEhzQ3RUQUhwQkl6T0lvVlhBSzlKQjVKeEpSTnV0dEwxZGF4SE1oWG1mMTN4OEdvR0h1bVRrV2R3YjRaRUVtcTNJbmNIdlBjdUlDRU1xUlgwUmxmZDhPMUlCRTg3dnQyaXlfOVVBQVZuRXpOSHREN0tNVXFvWWExNFotTUhmeC1Wck1DLVQ2bk40WmhVN3BHX09WaXJOVXdOQ2llMGZGeFlGV0Z3LWR6RGdXOGhnTmVoclVTREotU3B6U0x6adIBkAJBVV95cUxPbUxjNGcwTERSXzZmdDVvbTRvR2VYS1dEdGFFWFlUVlNvdFl6azI2NjlzOEpOcHpZZmczNWhWbGtZWDFZUHRZZTJDS1QtalY4Z2RncEhzQ3RUQUhwQkl6T0lvVlhBSzlKQjVKeEpSTnV0dEwxZGF4SE1oWG1mMTN4OEdvR0h1bVRrV2R3YjRaRUVtcTNJbmNIdlBjdUlDRU1xUlgwUmxmZDhPMUlCRTg3dnQyaXlfOVVBQVZuRXpOSHREN0tNVXFvWWExNFotTUhmeC1Wck1DLVQ2bk40WmhVN3BHX09WaXJOVXdOQ2llMGZGeFlGV0Z3LWR6RGdXOGhnTmVoclVTREotU3B6U0x6aQ?oc=5,google_rss_금융위원회 when:2d,102.6,52.5,"ai_infrastructure_security,policy_legislation",ai_infrastructure_security,금융위,,,,,,,general,14.0,published_yesterday,business_change,event:금융위:ai_infrastructure_security+policy_legislation,general,,"insufficient_industry_basis:actor=False,change=True,bridge=False",1,,,,102.6,"policy_legislation,ai_infrastructure_security",government:tech_security_policy,,,정부_국회,GOV_AI_DIGITAL_POLICY,금융_AI_규제,금융위_AI_기반_신용정보법_개정_추진,금융위원회의 신용정보법 개정은 카카오페이 등 핀테크 사업의 AI 기반 신용 평가 및 금융 서비스 혁신에 중요한 영향을 미칠 정책 변화.,1,1,1,,,카카오페이 등 AI 기반 금융 서비스에 직접적인 영향을 미치는 핵심 정책 변화 (1003과 동일 이슈).,gemini,,GOV_AI_CORE_POLICY,,domestic,"신용정보법 개정은 AI를 활용한 신용평가, 금융상품 추천 등 카카오 핀테크 서비스의 확장 및 고도화에 유리한 환경을 조성할 수 있음.",,금융위_AI_기반_신용정보법_개정_추진,금융_AI_규제,,,
