id,원카테고리,JSON카테고리,검색어,기사제목,기사제목_정규화,언론사,정규언론사,게시일,본문요약,링크,수집채널,랭킹점수,중요도점수,사건태그,사건단계,주요주체,랭킹감점사유,정책규제의무,강제검토,강제검토사유,자사홍보성,이슈패밀리,코드힌트,오늘성점수,오늘성사유,기사유형,v26이벤트키,v26진행단계,v27_industry_ok,v27_industry_reason,v27_industry_score,v32_competitor_basis,v32_competitor_portfolio,v32_actor_group,랭킹원점수,편집신호,스토리버킷,전역사건키,전역사건기본키,Gemini카테고리,Gemini내부카테고리,Gemini이슈패밀리,Gemini이슈그룹,Gemini관련성,Gemini중요도,Gemini대외협력중요도,Gemini관련도,GeminiPR성,Gemini제외,Gemini판단사유,Gemini라벨소스,Gemini자사티어,Gemini정부티어,Gemini경쟁사티어,Gemini경쟁사범위,Gemini정책영향경로,Gemini경쟁시사점,Gemini중복그룹,Gemini이슈유형,v27_event_key,v26_2_profile_reason,v26가드레일사유
2619,경쟁사/해외이슈,경쟁사_해외이슈,오픈AI,스페이스X 이어 앤트로픽·오픈AI도 '언감생심',스페이스x 이어 앤트로픽 오픈ai도 언감생심,한스경제,한스경제,"Tue, 16 Jun 2026 08:17:10 GMT",스페이스X 이어 앤트로픽·오픈AI도 '언감생심' 한스경제,https://news.google.com/rss/articles/CBMia0FVX3lxTE50b0dMbVBGSUxYUmQtbXZfLVpLS2hCT3dqNW5vS01sMGRBQVkwc3ZfN2lsQlVSRDRnZU9QR2QzYnlJRzIyVDFLNGxTYXpZNzdZT1ZxbGhJS1g5M3N1eXBpXzFyQW1MVVJiUldn0gFvQVVfeXFMTWVCT1BROEQxT2VmNkZ6b1hxbWxfVjlFNF95QVhBWUVxTkI1VDlSMXpYMHhtaENwdnBzVTNranIzM191TU9ybjg2RzFhTWxqa3dtUHQzTWlXTGgwYS1IcUs4RjJyLXpTU2twNzU4Sm5v?oc=5,google_rss_오픈AI when:2d,202.0,13.5,ai_infrastructure_security,ai_infrastructure_security,"앤트로픽,오픈AI",,,,,,,general,14.0,published_yesterday,business_change,global_incident:ai_security_policy:openai:anthropic_glasswing_security,general,Y,"industry_basis_pass:actor=True,change=False,bridge=True",2,global_platform_or_overseas_rule,Y,global,202.0,ai_infrastructure_security,competitor:ai_strategy,global_incident:ai_security_policy:openai:anthropic_glasswing_security:general,global_incident:ai_security_policy:openai:anthropic_glasswing_security,경쟁사_해외이슈,COMPETITOR_AI_STRATEGY,글로벌 AI 기업 리스크,해외 AI 기업 조직문화/노동 환경 논란 ('0주 충격'),"해외 주요 AI 기업의 노동 환경 문제가 불거지고 있어, 카카오를 포함한 국내 IT/AI 기업들의 조직 문화 및 노동 이슈 관리에 시사점을 제공함.",1,1,1,,,로컬 보조 라벨 / v26.2: overseas structural industry candidate,gemini,,,COMP_OVERSEAS_PLATFORM_AI,overseas,,"해외 AI 선두 기업들의 조직 및 인사 관리 리스크를 이해하고, 카카오의 ESG 및 HR 전략에 참고할 필요가 있음.",해외 AI 기업 조직문화/노동 환경 논란 ('0주 충격'),글로벌 AI 기업 리스크,,,
2519,경쟁사/해외이슈,경쟁사_해외이슈,구글,"경기도경제과학진흥원, 구글·엔비디아·AWS 기반 AI 인재 60명 양성",경기도경제과학진흥원 구글 엔비디아 aws 기반 ai 인재 60명 양성,메트로신문,메트로신문,"Tue, 16 Jun 2026 07:18:24 GMT","경기도경제과학진흥원, 구글·엔비디아·AWS 기반 AI 인재 60명 양성 메트로신문",https://news.google.com/rss/articles/CBMiYEFVX3lxTE1wQzd2NFhVM1c0TVdtWlUyeGJVRjl1cDZFajZrWE9SVE54N0s4SWk1S2ZnZjUzQWR0Z01qRmxQdlVKdS14UW1PNVhyN2ZyWm9qZktrZFJjMzFCLTV6bExxVA?oc=5,google_rss_구글 when:2d,202.0,13.5,ai_infrastructure_security,ai_infrastructure_security,구글,,,,,,,general,14.0,published_yesterday,business_change,event:구글:ai_infrastructure_security,general,Y,"industry_basis_pass:actor=True,change=False,bridge=True",2,global_platform_or_overseas_rule,Y,global,202.0,ai_infrastructure_security,competitor:ai_strategy,,,정부_국회,GOV_AI_DIGITAL_POLICY,국내 AI 인재 양성,경기도 AI 인재 양성 프로그램,경기도가 해외 빅테크와 협력하여 AI 인재를 양성하는 것은 국내 AI 인력 수급 환경 및 카카오의 AI 인재 확보 전략에 영향을 미칠 수 있음.,1,1,1,,Y,로컬 보조 라벨 / v26.2: overseas structural industry candidate / v23_guardrail_fail:v26_2_government_without_central_public_actor_action:no_public_actor_action_domain,gemini,,GOV_AI_CORE_POLICY,COMP_OVERSEAS_PLATFORM_AI,overseas,정부 및 지자체의 AI 인재 양성 정책 방향과 해외 기업과의 협력 모델을 파악하여 카카오의 인재 전략 및 산학 협력 모델에 참고할 수 있음.,카카오가 경쟁사 전략·리스크·AI/플랫폼 대응을 비교 참고할 이슈,경기도 AI 인재 양성 프로그램,국내 AI 인재 양성,,,
2548,경쟁사/해외이슈,경쟁사_해외이슈,구글,"경과원, 구글·엔비디아·AWS와 'AI 인재' 60명 키운다",경과원 구글 엔비디아 aws와 ai 인재 60명 키운다,네이트,네이트,"Tue, 16 Jun 2026 04:40:00 GMT","경과원, 구글·엔비디아·AWS와 'AI 인재' 60명 키운다 네이트",https://news.google.com/rss/articles/CBMiU0FVX3lxTE40R3hHY1ZsSms5Yk9VQWI4OEhEY3VWY3VTVzRZVXhoc1lrVjNaUW9CMHNjaUplYkdmeURRVHVJc09WLVEwUjA3eU1nV2g3TTU4djBV?oc=5,google_rss_구글 AI when:2d,202.0,13.5,ai_infrastructure_security,ai_infrastructure_security,구글,,,,,,,general,14.0,published_yesterday,business_change,event:구글:ai_infrastructure_security,general,Y,"industry_basis_pass:actor=True,change=False,bridge=True",2,global_platform_or_overseas_rule,Y,global,202.0,ai_infrastructure_security,competitor:ai_strategy,,,정부_국회,GOV_AI_DIGITAL_POLICY,국내 AI 인재 양성,경기도 AI 인재 양성 프로그램,경기도가 해외 빅테크와 협력하여 AI 인재를 양성하는 것은 국내 AI 인력 수급 환경 및 카카오의 AI 인재 확보 전략에 영향을 미칠 수 있음.,1,1,1,,Y,로컬 보조 라벨 / v26.2: overseas structural industry candidate / v23_guardrail_fail:v26_2_government_without_central_public_actor_action:no_public_actor_action_domain,gemini,,GOV_AI_CORE_POLICY,COMP_OVERSEAS_PLATFORM_AI,overseas,정부 및 지자체의 AI 인재 양성 정책 방향과 해외 기업과의 협력 모델을 파악하여 카카오의 인재 전략 및 산학 협력 모델에 참고할 수 있음.,카카오가 경쟁사 전략·리스크·AI/플랫폼 대응을 비교 참고할 이슈,경기도 AI 인재 양성 프로그램,국내 AI 인재 양성,,,
2579,경쟁사/해외이슈,경쟁사_해외이슈,오픈AI,"소프트뱅크, 日서 오픈AI 기반 사이버 보안 서비스 출시… 美 규제 속 '기술 독립' 가속",소프트뱅크 서 오픈ai 기반 사이버 보안 서비스 출시 규제 속 기술 독립 가속,글로벌이코노믹,글로벌이코노믹,"Tue, 16 Jun 2026 22:01:41 GMT","소프트뱅크, 日서 오픈AI 기반 사이버 보안 서비스 출시… 美 규제 속 '기술 독립' 가속 글로벌이코노믹",https://news.google.com/rss/articles/CBMiiAFBVV95cUxQMUp3eGpLVlBReDNZQ2VQci12MEZSR01JWkNiOG5RWWgySS1PeWlPVGF1VUNKdGhnRGxmOXJzNFYzWjNPZF9EcXV5MXJQVHI4LXIyeHhsUjdRU3UxdE5TNjRTSklUZ1ZWbzlMQWVDSDF1dnNkQlBmMnhJVk02Wkdvc0RaM0YtOWxD?oc=5,google_rss_오픈AI when:2d,201.5,34.5,"ai_infrastructure_security,phishing_security,policy_legislation,privacy_security_reliability",security_general,오픈AI,,,,,,,general,24.0,published_today,direct_risk,global_incident:ai_security_policy:openai:openai_security_access,general,Y,"industry_basis_pass:actor=True,change=True,bridge=True",3,global_platform_or_overseas_rule,Y,global,201.5,"privacy_security_reliability,policy_legislation,ai_infrastructure_security",competitor:security_reliability,global_incident:ai_security_policy:openai:openai_security_access:general,global_incident:ai_security_policy:openai:openai_security_access,경쟁사_해외이슈,COMPETITOR_AI_STRATEGY,해외 AI 서비스 전략,소프트뱅크의 오픈AI 기반 사이버 보안 서비스 日 출시,소프트뱅크가 오픈AI 기반 보안 서비스를 일본에 출시하며 미국 규제 속 기술 독립을 모색하는 것은 카카오의 AI 서비스 개발 및 해외 시장 전략에 참고할 수 있음.,1,1,1,,,로컬 보조 라벨 / v26.2: overseas structural industry candidate,gemini,,,COMP_OVERSEAS_PLATFORM_AI,overseas,,해외 AI 시장의 서비스 개발 동향과 국가별 기술 독립 전략을 이해하여 카카오의 AI 사업 방향을 설정하는 데 필요함.,소프트뱅크의 오픈AI 기반 사이버 보안 서비스 日 출시,해외 AI 서비스 전략,,,
2626,경쟁사/해외이슈,경쟁사_해외이슈,오픈AI,오픈AI '51조' 쏟아붓고도 적자 늪,오픈ai 51조 쏟아붓고도 적자 늪,세이프머니,세이프머니,"Tue, 16 Jun 2026 11:18:16 GMT",오픈AI '51조' 쏟아붓고도 적자 늪 세이프머니,https://news.google.com/rss/articles/CBMibkFVX3lxTE4tV1FXSjNIQ3owY01panhWNlZKNmZVa3ZzblAwMmJOX3FCRG5YS01ycTNITUNfMV80dWR2UDlzTlppTU5aUVlrZjJQS3pJcFlzUW1uMU5nYVJHX0xleE1IdFNxbDBZaWtPSFBMNFB3?oc=5,google_rss_오픈AI when:2d,201.0,41.5,"ai_infrastructure_security,earnings,financial_performance",ai_infrastructure_security,오픈AI,,,,,,,general,14.0,published_yesterday,direct_risk,global_incident:ai_security_policy:openai:openai_security_access,general,Y,"industry_basis_pass:actor=True,change=False,bridge=True",2,global_platform_or_overseas_rule,Y,global,201.0,"financial_performance,ai_infrastructure_security",competitor:ai_strategy,global_incident:ai_security_policy:openai:openai_security_access:general,global_incident:ai_security_policy:openai:openai_security_access,경쟁사_해외이슈,COMPETITOR_AI_STRATEGY,글로벌 AI 기업 동향,오픈AI의 막대한 AI 투자 비용 및 IPO 재정 리스크,"오픈AI의 막대한 투자 지출은 AI 기술 개발의 고비용 구조를 보여주며, 카카오의 AI 사업 투자 및 수익화 전략 수립에 참고할 수 있음.",1,1,1,,,로컬 보조 라벨 / v26.2: overseas structural industry candidate,gemini,,,COMP_OVERSEAS_MARKET_SIGNAL,overseas,,글로벌 AI 선두 기업의 재정 상태와 투자 규모를 파악하여 카카오의 AI 사업 모델 및 투자 전략을 검토하는 데 필요함.,오픈AI의 막대한 AI 투자 비용 및 IPO 재정 리스크,글로벌 AI 기업 동향,,,
2664,경쟁사/해외이슈,경쟁사_해외이슈,오픈AI,"""오픈AI, 지난해 지출 51조원…매출의 2.6배""",오픈ai 지난해 지출 51조원 매출의 2 6배,매일경제 마켓,매일경제 마켓,"Tue, 16 Jun 2026 07:01:14 GMT","""오픈AI, 지난해 지출 51조원…매출의 2.6배"" 매일경제 마켓",https://news.google.com/rss/articles/CBMiUkFVX3lxTFBWbGJiTHJORk1zVkd4dFFBSzFiNERNQnpiMFluSHN4cDhIeVY1X1ZpaktMRE5NbzBtejMyb29kNVNVR2NZcUJOQ3dFMVJYTVhGNlE?oc=5,google_rss_오픈AI site:mk.co.kr when:2d,201.0,38.5,"ai_infrastructure_security,earnings,financial_performance",ai_infrastructure_security,오픈AI,,,,,,,general,14.0,published_yesterday,business_change,global_incident:ai_security_policy:openai:openai_security_access,general,Y,"industry_basis_pass:actor=True,change=False,bridge=True",2,global_platform_or_overseas_rule,Y,global,201.0,"financial_performance,ai_infrastructure_security",competitor:ai_strategy,global_incident:ai_security_policy:openai:openai_security_access:general,global_incident:ai_security_policy:openai:openai_security_access,경쟁사_해외이슈,COMPETITOR_AI_STRATEGY,글로벌 AI 기업 동향,오픈AI의 막대한 AI 투자 비용 및 IPO 재정 리스크,"오픈AI의 막대한 투자 지출은 AI 기술 개발의 고비용 구조를 보여주며, 카카오의 AI 사업 투자 및 수익화 전략 수립에 참고할 수 있음.",1,1,1,,,로컬 보조 라벨 / v26.2: overseas structural industry candidate,gemini,,,COMP_OVERSEAS_MARKET_SIGNAL,overseas,,글로벌 AI 선두 기업의 재정 상태와 투자 규모를 파악하여 카카오의 AI 사업 모델 및 투자 전략을 검토하는 데 필요함.,오픈AI의 막대한 AI 투자 비용 및 IPO 재정 리스크,글로벌 AI 기업 동향,,,
2711,경쟁사/해외이슈,경쟁사_해외이슈,MS,스페이스X 장중 MS·아마존 제치고 시총 4위…AI코딩업체 인수 - 머니투데이,스페이스x 장중 ms 아마존 제치고 시총 4위 ai코딩업체 인수,머니투데이,머니투데이,"Tue, 16 Jun 2026 17:55:52 GMT",스페이스X 장중 MS·아마존 제치고 시총 4위…AI코딩업체 인수 - 머니투데이 머니투데이,https://news.google.com/rss/articles/CBMibkFVX3lxTE1pb3Fjbk0yVGdvUnNpcG5KQXg0NkFMbk1GSGxVSXVwb1owVVpFS1pmdWNXeGlBcGthY1RONjVTSGExVmdZemp1a0I4XzNybHZLR1ZTYnN3SjFuSlIzYmY2elJXZVhLMS1nbFRhcmx30gFuQVVfeXFMTWlvcWNuTTJUZ29Sc2lwbkpBeDQ2QUxuTUZIbFVJdXBvWjBVWkVLWmZ1Y1d4aUFwa2FjVE42NVNIYTFWZ1l6anVrQjhfM3JsdktHVlNic3dKMW5KUjNiZjZ6UldlWEsxLWdsVGFybHc?oc=5,"google_rss_""MS"" when:2d",201.0,36.0,"ai_infrastructure_security,strategy_mna_governance",ai_infrastructure_security,,,,,,,,general,24.0,published_today,direct_risk,,general,Y,"industry_basis_pass:actor=True,change=True,bridge=True",3,global_platform_or_overseas_rule,Y,global,201.0,"strategy_mna_governance,ai_infrastructure_security",competitor:strategy_mna,,,경쟁사_해외이슈,COMPETITOR_AI_STRATEGY,글로벌 AI 시장 동향,스페이스X 시총 상승 및 AI 코딩업체 인수,"스페이스X의 기업 가치 상승 및 AI 코딩업체 인수는 글로벌 AI 시장의 역동적인 M&A 동향을 보여주며, 카카오의 AI 사업 전략 및 투자에 참고할 수 있음.",1,1,1,,,로컬 보조 라벨 / v26.2: overseas structural industry candidate,gemini,,,COMP_OVERSEAS_MARKET_SIGNAL,overseas,,글로벌 AI 시장의 주요 기업 가치 변화와 M&A 전략을 파악하여 카카오의 AI 사업 및 투자 전략을 수립하는 데 필요함.,스페이스X 시총 상승 및 AI 코딩업체 인수,글로벌 AI 시장 동향,,,
2601,경쟁사/해외이슈,경쟁사_해외이슈,오픈AI,"“오픈AI, 지난해 지출 51조 원…매출의 2.6배”",오픈ai 지난해 지출 51조 원 매출의 2 6배,KBS 뉴스,KBS 뉴스,"Tue, 16 Jun 2026 07:20:00 GMT","“오픈AI, 지난해 지출 51조 원…매출의 2.6배” KBS 뉴스",https://news.google.com/rss/articles/CBMiW0FVX3lxTE4zMGEyNjNVdjJ0ODFjMThvSDFFYjZYX0ZWUzZZNkI0TlU0UGgwTUZQdzBIYmNXa044RXlvR3FudXVZbmVzU2c5aUJTU0FZNUJnMWJIcVpPT2hVWUk?oc=5,google_rss_오픈AI when:2d,200.0,38.5,"ai_infrastructure_security,earnings,financial_performance",ai_infrastructure_security,오픈AI,,,,,,,general,14.0,published_yesterday,business_change,global_incident:ai_security_policy:openai:openai_security_access,general,Y,"industry_basis_pass:actor=True,change=False,bridge=True",2,global_platform_or_overseas_rule,Y,global,200.0,"financial_performance,ai_infrastructure_security",competitor:ai_strategy,global_incident:ai_security_policy:openai:openai_security_access:general,global_incident:ai_security_policy:openai:openai_security_access,경쟁사_해외이슈,COMPETITOR_AI_STRATEGY,글로벌 AI 기업 동향,오픈AI의 막대한 AI 투자 비용 및 IPO 재정 리스크,"오픈AI의 막대한 투자 지출은 AI 기술 개발의 고비용 구조를 보여주며, 카카오의 AI 사업 투자 및 수익화 전략 수립에 참고할 수 있음.",1,1,1,,,로컬 보조 라벨 / v26.2: overseas structural industry candidate,gemini,,,COMP_OVERSEAS_MARKET_SIGNAL,overseas,,글로벌 AI 선두 기업의 재정 상태와 투자 규모를 파악하여 카카오의 AI 사업 모델 및 투자 전략을 검토하는 데 필요함.,오픈AI의 막대한 AI 투자 비용 및 IPO 재정 리스크,글로벌 AI 기업 동향,,,
2618,경쟁사/해외이슈,경쟁사_해외이슈,오픈AI,"""오픈AI, 지난해 지출 51조원…매출의 2.6배""",오픈ai 지난해 지출 51조원 매출의 2 6배,biz.sbs.co.kr.,biz.sbs.co.kr.,"Tue, 16 Jun 2026 07:09:00 GMT","""오픈AI, 지난해 지출 51조원…매출의 2.6배"" biz.sbs.co.kr.",https://news.google.com/rss/articles/CBMiWEFVX3lxTE9NZUpsMFZHYUdVbzdtZXEyaWxxYmZXMUxNclhhRGJ3dE51S1I0WURnblZSU0I0RU9UWHYxQlRBYmQ3NVZoVllJVnQ1cjU5TG9ZUzcyUWViNU8?oc=5,google_rss_오픈AI when:2d,200.0,38.5,"ai_infrastructure_security,earnings,financial_performance",ai_infrastructure_security,오픈AI,,,,,,,general,14.0,published_yesterday,business_change,global_incident:ai_security_policy:openai:openai_security_access,general,Y,"industry_basis_pass:actor=True,change=False,bridge=True",2,global_platform_or_overseas_rule,Y,global,200.0,"financial_performance,ai_infrastructure_security",competitor:ai_strategy,global_incident:ai_security_policy:openai:openai_security_access:general,global_incident:ai_security_policy:openai:openai_security_access,경쟁사_해외이슈,COMPETITOR_AI_STRATEGY,글로벌 AI 기업 동향,오픈AI의 막대한 AI 투자 비용 및 IPO 재정 리스크,"오픈AI의 막대한 투자 지출은 AI 기술 개발의 고비용 구조를 보여주며, 카카오의 AI 사업 투자 및 수익화 전략 수립에 참고할 수 있음.",1,1,1,,,로컬 보조 라벨 / v26.2: overseas structural industry candidate,gemini,,,COMP_OVERSEAS_MARKET_SIGNAL,overseas,,글로벌 AI 선두 기업의 재정 상태와 투자 규모를 파악하여 카카오의 AI 사업 모델 및 투자 전략을 검토하는 데 필요함.,오픈AI의 막대한 AI 투자 비용 및 IPO 재정 리스크,글로벌 AI 기업 동향,,,
2546,경쟁사/해외이슈,경쟁사_해외이슈,구글,"옥타·구글 클라우드, 파트너십 확대…AI 에이전트·브라우저 보안 강화",옥타 구글 클라우드 파트너십 확대 ai 에이전트 브라우저 보안 강화,네이트,네이트,"Wed, 17 Jun 2026 03:26:05 GMT","옥타·구글 클라우드, 파트너십 확대…AI 에이전트·브라우저 보안 강화 네이트",https://news.google.com/rss/articles/CBMiU0FVX3lxTFBTaDktWk1PVnJ5eFdUcDNHU0xWZjdTSUVKRktoelF3REwtdDFJd2hTdTBKVlJYT2JteUtWbkRvYVBqM2Z3VWJNeFRMNkhOZWNJQTFJ?oc=5,google_rss_구글 AI when:2d,199.5,30.5,"ai_agent,ai_infrastructure_security,phishing_security,privacy_security_reliability",security_general,구글,,,,,,,general,24.0,published_today,direct_risk,event:구글:ai_infrastructure_security+phishing_security,general,Y,"industry_basis_pass:actor=True,change=True,bridge=True",3,global_platform_or_overseas_rule,Y,global,199.5,"privacy_security_reliability,ai_infrastructure_security",competitor:security_reliability,,,경쟁사_해외이슈,COMPETITOR_AI_STRATEGY,구글 AI 보안 전략,옥타-구글 클라우드 AI 에이전트·브라우저 보안 파트너십,구글 클라우드가 AI 에이전트 및 브라우저 보안 강화를 위해 파트너십을 확대하는 것은 카카오의 AI 서비스 보안 및 클라우드 전략에 시사점을 제공함.,1,1,1,,,로컬 보조 라벨 / v26.2: overseas structural industry candidate,gemini,,,COMP_OVERSEAS_PLATFORM_AI,overseas,,글로벌 클라우드 기업의 AI 보안 전략과 파트너십 모델을 이해하여 카카오의 AI 보안 강화 방안을 모색하는 데 필요함.,옥타-구글 클라우드 AI 에이전트·브라우저 보안 파트너십,구글 AI 보안 전략,,,
2472,경쟁사/해외이슈,경쟁사_해외이슈,구글,"옥타·구글 클라우드, 파트너십 확대...AI 에이전트·브라우저 보안 강화",옥타 구글 클라우드 파트너십 확대 ai 에이전트 브라우저 보안 강화,디지털투데이,디지털투데이,"Wed, 17 Jun 2026 03:25:10 GMT","옥타·구글 클라우드, 파트너십 확대...AI 에이전트·브라우저 보안 강화 디지털투데이",https://news.google.com/rss/articles/CBMic0FVX3lxTE9ZTzFtNmJrUlpJMUNubVBJbnNIVGsxXzdtemRPOGZzZzlRLXhDdXdHSGNoUDNQXzlQQktDQjJBbXJqRXYtQ0IxTUNmWmM2dkRIekZkOFZKVzhONHVScTREeHQ0a0doYjRiU3dDaVhJOUhvb00?oc=5,google_rss_구글 when:2d,199.5,30.5,"ai_agent,ai_infrastructure_security,phishing_security,privacy_security_reliability",security_general,구글,,,,,,,general,24.0,published_today,direct_risk,event:구글:ai_infrastructure_security+phishing_security,general,Y,"industry_basis_pass:actor=True,change=True,bridge=True",3,global_platform_or_overseas_rule,Y,global,199.5,"privacy_security_reliability,ai_infrastructure_security",competitor:security_reliability,,,경쟁사_해외이슈,COMPETITOR_AI_STRATEGY,구글 AI 보안 전략,옥타-구글 클라우드 AI 에이전트·브라우저 보안 파트너십,구글 클라우드가 AI 에이전트 및 브라우저 보안 강화를 위해 파트너십을 확대하는 것은 카카오의 AI 서비스 보안 및 클라우드 전략에 시사점을 제공함.,1,1,1,,,로컬 보조 라벨 / v26.2: overseas structural industry candidate,gemini,,,COMP_OVERSEAS_PLATFORM_AI,overseas,,글로벌 클라우드 기업의 AI 보안 전략과 파트너십 모델을 이해하여 카카오의 AI 보안 강화 방안을 모색하는 데 필요함.,옥타-구글 클라우드 AI 에이전트·브라우저 보안 파트너십,구글 AI 보안 전략,,,
2542,경쟁사/해외이슈,경쟁사_해외이슈,구글,"구글, 제미나이 기반 보안 플랫폼 서울에 설치…공공·금융 시장 '정조준'",구글 제미나이 기반 보안 플랫폼 서울에 설치 공공 금융 시장 정조준,네이트,네이트,"Wed, 17 Jun 2026 02:05:00 GMT","구글, 제미나이 기반 보안 플랫폼 서울에 설치…공공·금융 시장 '정조준' 네이트",https://news.google.com/rss/articles/CBMieEFVX3lxTE9kWGprQ2RfelJET2pid0xLaThYdzZWSV9PeHlVbGt5cmhWMHYxR2h0eFBqbVBMT0FsQ21aR2FUX2gxaWFwMWhBVHhmMlZSUndZRnhPdkFPUTVhdGxlYkw2VVJKNFpFVDJfMTJLeXlCaG80bml4QTlEMA?oc=5,"google_rss_""구글"" when:2d",199.5,30.5,"ai_agent,market_power_platform,phishing_security,privacy_security_reliability",security_general,구글,,,,,,,general,24.0,published_today,direct_risk,global_incident:platform_regulation:google:platform_regulation,general,Y,"industry_basis_pass:actor=True,change=False,bridge=True",2,global_platform_or_overseas_rule,Y,global,199.5,"privacy_security_reliability,market_power_platform",competitor:regulatory_enforcement,global_incident:platform_regulation:google:platform_regulation:general,global_incident:platform_regulation:google:platform_regulation,경쟁사_해외이슈,COMPETITOR_AI_STRATEGY,구글 국내 시장 공략,구글 제미나이 기반 보안 플랫폼 국내 출시 (공공·금융 시장 타겟),구글이 AI 기반 보안 플랫폼을 서울에 출시하며 공공 및 금융 시장을 공략하는 것은 카카오의 클라우드 및 금융 사업에 경쟁 심화 요인으로 작용할 수 있음.,1,1,1,,,로컬 보조 라벨 / v26.2: overseas structural industry candidate,gemini,,,COMP_OVERSEAS_PLATFORM_AI,overseas,,글로벌 빅테크의 국내 AI/클라우드 시장 침투 전략과 공공/금융 시장 공략 방안을 파악하여 카카오의 경쟁 전략을 수립하는 데 중요함.,구글 제미나이 기반 보안 플랫폼 국내 출시 (공공·금융 시장 타겟),구글 국내 시장 공략,,,
1867,경쟁사/해외이슈,경쟁사_해외이슈,네이버,"공정위, 증권사에 ’네이버파이낸셜·두나무’ 합병 관련 의견 수렴",공정위 증권사에 네이버파이낸셜 두나무 합병 관련 의견 수렴,연합뉴스TV,연합뉴스TV,"Tue, 16 Jun 2026 23:23:37 GMT","공정위, 증권사에 ’네이버파이낸셜·두나무’ 합병 관련 의견 수렴 연합뉴스TV",https://news.google.com/rss/articles/CBMiZ0FVX3lxTE9xSFpWd0dRa2kta2JldmpseV9adlVLd2dGUGxBaExWLXMtNHNHamU0UFhVWUtCM0RMdkg5VkJBVkRLM3Q3aS1SSjFIMTVGR0NERWVCXzNPeFFWa3VTbU55SFNOczlfVlE?oc=5,google_rss_네이버 when:2d,199.0,58.0,"antitrust_platform,digital_asset_stablecoin,dunamu_stake,strategy_mna_governance",dunamu_merger_exchange,"공정위,네이버,두나무",v43_not_true_competitor,,,,,,general,24.0,published_today,direct_risk,global_incident:platform_regulation:naver:platform_regulation,general,Y,"industry_basis_pass:actor=True,change=True,bridge=True",3,naver_telco_strategy_or_infra,Y,naver,199.0,"strategy_mna_governance,digital_asset_stablecoin",government:digital_asset,global_incident:platform_regulation:naver:platform_regulation:general,global_incident:platform_regulation:naver:platform_regulation,정부_국회,GOV_PLATFORM_REGULATION,공정위 플랫폼 M&A 심사,공정위의 네이버파이낸셜-두나무 합병 관련 의견 수렴,"공정위가 네이버파이낸셜과 두나무의 합병에 대해 의견을 수렴하는 것은 국내 플랫폼 기업의 M&A에 대한 규제 당국의 심사 방향을 보여주며, 카카오의 자회사 전략 및 잠재적 M&A에 영향을 미칠 수 있음.",1,1,1,,Y,로컬 보조 라벨 / v26.2: overseas structural industry candidate / v23_guardrail_fail:v26_2_government_without_central_public_actor_action:no_public_actor_action_domain,gemini,,GOV_REGULATORY_ENFORCEMENT,COMP_DOMESTIC_FINANCE_COMMERCE,domestic,공정위의 플랫폼/금융 기업 M&A 심사 기준 및 시장 지배력 평가 방안을 파악하여 카카오의 사업 확장 및 규제 대응 전략을 수립하는 데 중요함.,경쟁사의 주요 M&A 시도와 이에 대한 공정위의 심사 동향을 주시하여 카카오의 사업 전략 및 규제 대응에 참고할 필요가 있음.,공정위의 네이버파이낸셜-두나무 합병 관련 의견 수렴,공정위 플랫폼 M&A 심사,,,
