카테고리,카테고리명,검색어,기사제목,언론사,정규언론사,게시일,RSS게시일,RSS요약,본문전문,본문글자수,본문추출방식,본문품질점수,본문품질사유,중요도점수,본문사용가능,본문정제적용,원래RSS링크,링크,랭킹점수,사건태그,사건단계,원문날짜,원문날짜출처,날짜검증결과,날짜후보수,대표선택점수,개인정보보안사건키,개인정보보안대표보너스,전역사건키,전역사건기본키,전역사건대표보너스,이슈패밀리,정책규제의무,자사홍보성,제외단계,v20_issue_id,v20_issue_group,수집검색어,수집원카테고리,수집JSON카테고리,Gemini판단카테고리,최종카테고리,최종카테고리명,링크상태,링크검증사유,본문정합성,본문상태,v20_issue_family,v20_internal_category,v20_issue_score,v21_self_tier,v21_gov_tier,v21_competitor_tier,v21_competitor_scope,Gemini카테고리,Gemini내부카테고리,Gemini이슈유형,Gemini이슈그룹,Gemini중복그룹,Gemini관련성,Gemini중요도,Gemini대외협력중요도,Gemini관련도,Gemini판단사유,Gemini선정사유,선정단계,선정순서,최종카테고리검증결과,v25한국정부국회근거,최종카테고리재배치,v24대표기사정합성
자사_및_계열사_이슈,자사 및 계열사 이슈,금융위원회,"금감원, ‘전산 관리 미흡’ 쿠팡페이 제재 수순… 정보유출 이어 추가 제재 가능성 - 조선비즈",Chosunbiz,Chosunbiz,"Fri, 12 Jun 2026 02:03:00 GMT","Fri, 12 Jun 2026 02:03:00 GMT","금감원, ‘전산 관리 미흡’ 쿠팡페이 제재 수순… 정보유출 이어 추가 제재 가능성 - 조선비즈 Chosunbiz","입력 2026.06.12. 11:00 | 업데이트 2026.06.12. 11:03 금융감독원이 2022년 파악된 쿠팡페이의 전산 관리 미비 사안에 대한 제재심의위원회 절차를 준비 중인 것으로 나타났다. 현재 금감원은 지난해 쿠팡 개인정보 유출 건과 관련해 쿠팡페이 제재 여부를 결정하기 위한 법률 검토도 진행 중이다. 금감원의 제재가 겹칠 가능성이 생긴 만큼, 쿠팡페이의 부담도 가중될 것으로 보인다. 12일 금융 당국에 따르면 금감원은 2022년 쿠팡페이를 대상으로 한 수시 검사 결과 확인된 전자금융거래법, 신용정보법(신용정보의 이용 및 보호에 관한 법률) 등 관련 법 위반 사항을 정리해 제재심의국에 인계한 것으로 알려졌다. 제재심의국은 조만간 쿠팡페이 측의 의견을 수렴한 뒤 제재 수위를 결정할 방침이다. 제재심의국의 검토가 마무리되면 안건은 제재심의위원회에 상정된다. 금감원은 당시 쿠팡페이가 전자금융거래법에 따른 가입 약관 관리나 전산실에 대한 통제 등이 미비했다고 파악했다. 또 금융사는 외부망으로 업무를 하고자 할 때 금융 당국에 망 분리 예외 승인 절차를 밟아야 하지만 이를 제대로 준수하지 않았고, 개인신용정보를 취급하는 직원에 대한 내부 교육도 제대로 이뤄지지 않았다고 금감원은 판단했다. 금감원은 지난해 쿠팡 개인정보 유출 사태와 관련한 제재 여부도 검토하고 있다. 쿠팡에서는 지난해 11월 3370만개의 고객 계정 정보가 유출됐다. 유출된 정보에는 고객 이름, 이메일 주소, 배송지 주소록, 일부 주문 정보가 포함됐다. 금감원은 지난 1월 쿠팡과 '원-아이디(one-ID·여러 서비스를 한 ID로 관리)' 구조로 연결된 자회사 쿠팡페이에서 개인정보가 유출됐는지 확인하기 위해 검사를 진행한 바 있다. 최근 쿠팡에 대한 유관 기관의 제재 결과가 나오며, 계열사 전반에 대한 압박도 가중되고 있다. 개인정보보호위원회는 전날 쿠팡의 개인정보 유출에 약 4236억원, 1000만명이 넘는 회원의 온라인 활동 기록을 무단 수집한 위반 행위 등에는 2011억원의 과징금 처분을 각각 내렸다. 단일 개인정보 유출 사고에 내린 과징금 규모로는 역대 최대치로, 한 기업의 여러 위반 행위에 부과한 과징금 규모로도 가장 많다. 오늘의 핫뉴스 보증금 8억, 月 480만원… 고급 실버타운도 못 피한 '적자' 韓, 반도체 잘 하는데… 대만엔 없는 이례적 '고용 쇼크' ""대~한민국!"" 응원 어디로 … 대목에 못 웃는 치킨집 사장님 국민들 사생활 다 볼 수 있다, 與 밀어붙이는 부동산 법안 스페이스X 담아야 하는데… 불안한 서학개미 위한 투자법 보증금 8억, 月 480만원… 고급 실버타운도 못 피한 '적자' 韓, 반도체 잘 하는데… 대만엔 없는 이례적 '고용 쇼크' ""대~한민국!"" 응원 어디로 … 대목에 못 웃는 치킨집 사장님 국민들 사생활 다 볼 수 있다, 與 밀어붙이는 부동산 법안 스페이스X 담아야 하는데… 불안한 서학개미 위한 투자법 보증금 8억, 月 480만원… 고급 실버타운도 못 피한 '적자' 韓, 반도체 잘 하는데… 대만엔 없는 이례적 '고용 쇼크' ""대~한민국!"" 응원 어디로 … 대목에 못 웃는 치킨집 사장님 국민들 사생활 다 볼 수 있다, 與 밀어붙이는 부동산 법안 스페이스X 담아야 하는데… 불안한 서학개미 위한 투자법 증권",1596,bs4_selector,-35.0,private_kakaotalk_or_entertainment_noise,-63.5,False,False,https://news.google.com/rss/articles/CBMigAFBVV95cUxQVVVrNDVQVWl6OV8tZk1BY3pmS2M2QXRMR3hRWlVqWUtVY2MxdHpzdDZYUTB6RW1DOEo4VDBKbWVLZWhjMEVBOEZOSkgtUUE1TW5vZGtzRVI5RmM2ZjY2VmFNb3liaEM3NnRGbXNZc2gxLU9tRk40UzRWRFhfUHlFNNIBlAFBVV95cUxOQTRNbUZuZXZLT3Z1dWJITGxkbGdRaVJEb29zYmh0NnRZeWtHTU95TTR3UEtvLTQ3UXZVcEdnejZBelRVTmhFa0drMlF1bmpyNnRMUmEyM1pWbUZUekN5eGxDb2U1UGlRNE1ob3FYdDNwTzE4SVpIbHQ2WjRrRnMtZlFNcmhjRjU4VG5QOVVBUUFqejBi?oc=5,https://biz.chosun.com/stock/finance/2026/06/12/CIEMAV2QP5F5PK2HI7IQVMHTVE?outputType=amp,217.6,"antitrust_platform,earnings,financial_performance,legal_regulatory_enforcement,phishing_security,platform_obligation,policy_legislation,privacy_security_reliability,strategy_mna_governance",antitrust_general,2026-06-12,url_date,original_date_recent,11.0,-25.95,privacy_security:coupang:data_leak:sanction_or_penalty,16.0,global_incident:platform_enforcement:coupang:privacy_data_violation:sanction_penalty,global_incident:platform_enforcement:coupang:privacy_data_violation,56.0,government:platform_obligation,Y,,issue_representative_attempt,I019,금감원 쿠팡페이 전산 관리 미흡 제재,금융위원회,정부/국회,정부_국회,정부_국회,자사_및_계열사_이슈,자사 및 계열사 이슈,,,,,,,,,,,,,,,,,,,,,,,,,,,,
산업동향,산업동향,카카오,다음 인수한 업스테이지… 'AI 포털' 승부수 통할까,프레스맨,프레스맨,"Thu, 11 Jun 2026 23:57:36 GMT","Thu, 11 Jun 2026 23:57:36 GMT",다음 인수한 업스테이지… 'AI 포털' 승부수 통할까 프레스맨,"국내 AI 스타트업 업스테이지가 ‘다음’의 운영사 AXZ 인수를 확정지었다. 5월 7일 최종 인수 계약 이후, 공정거래위원회 기업결합 심사 승인까지 거치며 인수 절차를 마무리했다. 업스테이지의 다음 인수는 기업 간 지분 구조 변경을 넘어, AI 스타트업이 거대 포털이라는 플랫폼을 획득했다는 이례적인 장면이다. 다음 이어 타임리도 인수... 업스테이지의 ‘영토 확장’ 업스테이지의 다음 인수는 제법 오랜 시간 진행된 것으로 전해진다. 지난 1월 카카오와 AXZ 양해각서를 체결한 업스테이지는 4개월 간 심층 실사를 거친 후 5월 7일 본계약을 체결했다. 다만 업계에서는 실제 인수 논의가 공식 발표 시점보다 훨씬 이전부터 진행됐을 가능성에 주목하고 있다. 통상 수천억 원 규모의 인수합병(M&A)은 매각 의사 검토와 예비 접촉, 가치평가, 거래 구조 설계, 주요 주주 협의 등의 절차를 거치는 만큼 수개월에서 1년 이상 물밑 협상이 이어지는 경우가 적지 않기 때문이다. 특히 이번 거래는 단순 현금 인수가 아닌 AXZ 지분과 업스테이지 신주를 맞교환하는 방식으로 추진됐다. 이 같은 구조는 양사 기업가치 산정은 물론 지분 희석 효과, 업스테이지의 향후 기업공개(IPO) 계획, 카카오의 투자수익 실현 전략 등이 복합적으로 얽혀 있어 일반적인 M&A보다 설계 과정이 훨씬 복잡하다는 평가가 나온다. 이에 따라 업계에서는 이번 거래가 단기간에 성사된 것이 아니라 상당 기간 전략적 검토와 협의를 거쳐 추진됐을 가능성이 높다고 보고 있다. 일각에서는 업스테이지가 하반기 IPO를 앞두고, ‘몸집 불리기’에 나서고 있다고 보고 있다. 업스테이지가 다음 인수에 이어 AI 에이전트 플랫폼 스타트업 '타임리'를 인수하는 등 공격적인 사업 확장에 나서고 있기 때문이다. 업스테이지 측은 이번 인수의 핵심 목적이 외형 확대보다는 AI 서비스 경쟁력 강화에 있다는 입장이다. 업스테이지는 “양사가 서로 간의 시너지를 낼 수 있을 것이라 판단했다”며 “다음이 갖고 있는 검색엔진으로서의 강점과 콘텐츠 역량을 업스테이지의 ‘솔라’와 결합해 최종적으로 AI 포털로 고도화해 나갈 것”이라 밝혔다. 다음 인수로 데이터 확보·외연확장... 새로운 '다음' 될 수 있을까 업계는 업스테이지의 다음 인수를 데이터 확보와 B2C 플랫폼 채널의 확대의 가능성에 주목하고 있다. 다음이 보유하고 있는 이용자층과 뉴스·카페 등 데이터를 기반으로 소비자 대상의 서비스 출범도 가능하다는 관점이다. AI 기업에게 있어, 가장 필수적이면서도 부족한 것은 결국 데이터다. 특히 한국어 기반 데이터의 경우 영어·중국어 등 다른 언어에 비해 화자 수가 적은 편이라, 해외 데이터를 수집해 한국어로 번역을 하는 등 어려움도 존재했다. 이 같은 이유로 포털은 AI 기업 입장에서 고객 대상 서비스의 실험장이자 AI 검색·추천·요약 서비스 고도화를 위한 핵심 데이터 접점으로 평가된다. 특히 20년 이상 축적된 다음 카페와 뉴스 콘텐츠, 다양한 이용자 기반은 B2B 솔루션을 넘어 B2C 서비스로 확장하려는 업스테이지의 전략과 맞닿아 있다는 평가가 나온다. 한편 일각에서는 다음 서비스의 개선 여부나 기존 구성원의 이탈 가능성에 대한 우려도 존재한다. 당초 카카오가 AXZ의 계열분리 배경을 ‘독자적 경영구조를 기반으로 한 사업 경쟁력 강화’로 설명했지만, 업스테이지로 매각이 되면서 향후 다음의 사업 방향도 미지수가 됐다는 것이다. 업스테이지는 이에 대해 “양사는 기본적으로 독립법인으로 운영될 예정”이라며, “두 회사의 사업적 결합이 다음의 서비스 고도화와 업스테이지의 ‘독자 AI 파운데이션 모델’ 프로젝트에도 시너지를 만들 수 있을 것으로 기대된다”고 전했다. 업계는 업스테이지가 제시한 AI 포털 전략이 실제 성과로 이어질 수 있을지 주목하고 있다. 포털 시장에서 네이버의 지배력이 여전히 강한 데다, 생성형 AI 서비스 경쟁도 빠르게 심화되고 있기 때문이다. 업스테이지가 다음의 기존 이용자 기반과 자사 AI 기술을 얼마나 효과적으로 결합하느냐가 향후 성패를 가를 것으로 전망된다. [프레스맨] 임한묵 기자 gksanr0103@pressman.kr Tag 키워드 #다음 #카카오 #업스테이지 #AI #솔라 #LLM #독자 #파운데이션 #모델 #AXZ #포털 #검색 #카페 #티스토리 #콘텐츠 #이용자층",2105,bs4_selector,86.0,category_guardrail_failed:v27_industry_without_two_of_three_basis:roundup,120.5,True,False,https://news.google.com/rss/articles/CBMiakFVX3lxTE1EdmM2Q2hiUE5JM0NLbUVnM3VCXzRidU1LZ1ZDRmhhRW5TS3VhXzFUV1p6MXd3X0tHNTJDOEpnajZFWTVnVzI1cFJyMXo4dzNqZDNxc241TS1pY21CckYwUG5oNUF0QXozdXc?oc=5,https://www.pressman.kr/news/articleView.html?idxno=102219,20.8,"ai_agent,ai_infrastructure_security,antitrust_platform,market_power_platform,platform_obligation,policy_legislation,search_ads,strategy_mna_governance",antitrust_general,2026-06-12,meta:article:published_time,original_date_recent,2.0,211.75,,0.0,global_incident:platform_regulation:kakao:platform_content_moderation_obligation:policy_change,global_incident:platform_regulation:kakao:platform_content_moderation_obligation,56.0,self:platform_obligation,Y,,issue_representative_attempt,I028,self_governance_mna:다음 인수한 업스테이지 ai 포털 승부수 통할까,카카오,자사 및 계열사 이슈,자사_및_계열사_이슈,산업동향,산업동향,산업동향,ok,http_200,body_valid,본문추출성공,self_governance_mna,SELF_DIRECT_RISK,386.2,DIRECT_RISK,,,other,산업동향,SELF_DIRECT_RISK,self_governance_mna,self_governance_mna:다음 인수한 업스테이지 ai 포털 승부수 통할까,self_governance_mna:다음 인수한 업스테이지 ai 포털 승부수 통할까,카카오 또는 계열사에 직접 발생한 외부 대응 필요 이슈,5.0,5.0,5.0,로컬 보조 라벨 / v26: 오늘 새 직접 사건·진전,로컬 보조 라벨 / v26: 오늘 새 직접 사건·진전,issue_selected,19.0,fail:v27_industry_without_two_of_three_basis:roundup,,,
경쟁사_해외이슈,경쟁사/해외이슈,쿠팡,쿠팡 개인정보 유출 집단분쟁조정 재개…26일까지 추가 접수,TBS 서울,TBS 서울,"Fri, 12 Jun 2026 01:21:00 GMT","Fri, 12 Jun 2026 01:21:00 GMT",쿠팡 개인정보 유출 집단분쟁조정 재개…26일까지 추가 접수 TBS 서울,"경제 김종민 기자 kjm9416@tbs.seoul.kr 2026-06-12 10:21 오세훈 서울시장 당선, 시의회·구청장 민주당 압승 14시 현재 투표율 48.9％..8.2％P↑ ""일꾼이 공약 ... 서울 재생에너지 자립률 전국 꼴찌, 정책 지속 필요성 제기 정원오 31년전 폭행 진실공방",162,trafilatura,-14.0,too_short,53.0,False,False,https://news.google.com/rss/articles/CBMihwFBVV95cUxNNjM3RVFYd3BldVBWUDRDaFVLeHZvOFdRNXpRd3k5dUl6NENTNENzVTlfSFgtVDlqSU4tRGtoOGE3QVdEakpQSnYtOEhKeENadmVZTHNCcEJIeGhpY05WYzdyRDlRWmVUNV84MTRCOHBsaW5Ob2tXRGp2N3BWM25pd2NpZVRhV3c?oc=5,https://tbs.seoul.kr/news/newsView.do?typ_800=1&idx_800=3536854&seq_800=20529735,181.5,"labor_dispute,phishing_security,policy_legislation,privacy_security_reliability",labor_general,2026-06-12,meta:article:published_time,original_date_recent,2.0,21.5,privacy_security:coupang:data_leak:initial_investigation_response,0.0,global_incident:financial_regulation:coupang:financial_product_case:general,global_incident:financial_regulation:coupang:financial_product_case,22.0,,,,issue_representative_attempt,I031,쿠팡 역대 최대 과징금 (개인정보 유출 분쟁조정),쿠팡,경쟁사/해외이슈,경쟁사_해외이슈,경쟁사_해외이슈,경쟁사_해외이슈,경쟁사/해외이슈,,,,,,,,,,,,,,,,,,,,,,,,,,,,
경쟁사_해외이슈,경쟁사/해외이슈,네이버,"에임인텔리전스, LG전자·현대차·네이버 D2SF 전략적 투자 유치",헬로티,,"Fri, 12 Jun 2026 07:33:50 GMT",,"에임인텔리전스, LG전자·현대차·네이버 D2SF 전략적 투자 유치 헬로티",,0,v24_pre_body_guardrail,-100.0,never_allow_title_only_low_value_or_caption,,False,,https://news.google.com/rss/articles/CBMiX0FVX3lxTE1GSGtXQURUUXY4dWhWNDZpUlMtSGtPU1B4SXpHMlpJZ3NlX054SG05VzdjOWtUcGdWb2IwTjJFMGlKUmJUdk50TzlBU1VBLU5RMktibzI0eE1hUkc5Ry1V?oc=5,https://news.google.com/rss/articles/CBMiX0FVX3lxTE1GSGtXQURUUXY4dWhWNDZpUlMtSGtPU1B4SXpHMlpJZ3NlX054SG05VzdjOWtUcGdWb2IwTjJFMGlKUmJUdk50TzlBU1VBLU5RMktibzI0eE1hUkc5Ry1V?oc=5,,,,,,,,,,,,,,,,,issue_representative_attempt,I034,네이버 D2SF 에임인텔리전스 투자,네이버,경쟁사/해외이슈,경쟁사_해외이슈,경쟁사_해외이슈,경쟁사_해외이슈,경쟁사/해외이슈,,,,최종금지_대체필요,,,,,,,,,,,,,,,,,,,,,fail:never_allow_title_only,,,
자사_및_계열사_이슈,자사 및 계열사 이슈,카카오,샘 올트먼 방한 돌연 연기… 삼성·네이버·카카오 AI 협력 논의 미뤄져,IT조선,IT조선,"Fri, 12 Jun 2026 10:16:24 GMT","Fri, 12 Jun 2026 10:16:24 GMT",샘 올트먼 방한 돌연 연기… 삼성·네이버·카카오 AI 협력 논의 미뤄져 IT조선,"한국을 찾을 예정이던 샘 올트먼 오픈AI 최고경영자(CEO)의 방한 일정이 개인 사정으로 연기됐다. 이에 따라 삼성전자, 네이버, 카카오 등 국내 주요 기업들과 예정됐던 인공지능(AI) 협력 논의도 미뤄질 전망이다. 샘 올트먼 오픈AI CEO. / 뉴스1 12일 관련 업계에 따르면 올트먼 CEO는 당초 14일부터 1박 2일 일정으로 한국을 방문할 예정이었다. 이번 방한 기간에는 삼성전자에서 임직원을 대상으로 AI 활용과 업무 혁신 관련 사내 강연을 진행하고, 네이버와 카카오 등 국내 주요 플랫폼 기업 관계자들과 만나 AI 서비스 및 인프라 협력 방안을 논의할 계획이었던 것으로 알려졌다. 하지만 오픈AI는 이날 “샘 올트먼 오픈AI CEO의 불가피한 개인 사정으로 한국을 비롯한 아시아 방문 일정을 연기하게 됐다”고 말했다. 구체적인 방한 연기 사유와 향후 재방한 일정은 공개되지 않았다. 이번 일정 연기는 국내 테크 업계의 기대가 컸던 만큼 아쉬움을 남긴다. 국내 주요 기업들은 생성형 AI 확산에 맞춰 업무 생산성 향상, AI 서비스 고도화, 데이터센터·반도체 등 인프라 협력 가능성을 넓히고 있다. 특히 삼성전자는 전사 차원의 AI 활용 확대를 추진하고 있고, 네이버와 카카오는 자체 AI 모델과 플랫폼 경쟁력을 강화하는 동시에 글로벌 AI 기업과의 협력 가능성을 모색해왔다. 올트먼 CEO의 방한은 단순한 기업 방문을 넘어 한국 AI 생태계와 오픈AI 간 협력의 상징적 계기가 될 것으로 관측됐다. 한국은 반도체, 클라우드 인프라, 인터넷 플랫폼, 콘텐츠 서비스 등 AI 산업 확장에 필요한 핵심 기반을 두루 갖춘 시장으로 평가받는다. 오픈AI 입장에서도 한국 기업들과의 협력은 AI 서비스 확산뿐 아니라 글로벌 인프라 전략 측면에서도 의미가 크다는 분석이 나온다. 오픈AI코리아 측은 예정된 일정을 소화하지 못하게 된 데 대해 아쉬움을 표하면서도 국내 파트너들과의 협력은 흔들림 없이 이어가겠다는 입장을 밝혔다. 오픈AI 측은 “올트먼 역시 이번 방한을 기대하고 있었던 만큼 예정된 일정을 소화하지 못하게 된 점을 매우 안타깝게 생각하고 있다”며 “한국은 오픈AI에 매우 중요한 나라이자 전략적 파트너이며, 국내 파트너들과 진행 중인 협력은 예정대로 계속 이어질 예정”이라고 설명했다. 업계는 이번 방한 연기가 협력 자체의 무산을 의미하는 것은 아니라고 보고 있다. 이미 국내 주요 기업들이 AI 도입과 인프라 확대를 주요 경영 과제로 삼고 있는 만큼 오픈AI와의 협력 논의는 실무 차원에서 계속 이어질 가능성이 크다는 것이다. 다만 올트먼 CEO가 직접 방한해 주요 기업 경영진과 만나는 일정이 미뤄지면서, 구체적인 협력 방향이나 공개 메시지가 나오는 시점도 다소 늦춰질 전망이다. 김동명 기자 simalo@chosunbiz.com",1380,newspaper3k,-10.0,date_failed:original_date_too_old>52h:2023-09-21,86.3,False,False,https://news.google.com/rss/articles/CBMicEFVX3lxTE5BWHdDVmM1OHpWNk5fWVdaRExWajIyckhvdnJVcUpmZVJDRUdMX3Y3TW96X3hjbmR5RTRPRF96OVYzWHNSTG1oZkdIR29lVmY3eVJyZzV6aEJvT1R2Z0NWWV9ObzJQd0hCZ1JidXU3enTSAXRBVV95cUxOcU1hTFZIT2R2X0hMRnNxX1pwNTgzUUxQYVZvdnNHcnpPLUNrYmVaZDhPTUVORTdySW8wcTFGMDRJVmhaZmhYN3FSOWZLYzFIY1ZJNnpBR3lZdjVVd0VGS2tzcXZxWlgtTDNueWpVLUJjaVZteA?oc=5,https://it.chosun.com/news/articleView.html?idxno=2023092163833,68.8,"ai_infrastructure_security,market_power_platform,platform_obligation,policy_legislation",ai_infrastructure_security,2023-09-21,url_date,original_date_too_old>52h,4.0,31.41,,7.0,global_incident:platform_regulation:kakao:platform_content_moderation_obligation:announcement,global_incident:platform_regulation:kakao:platform_content_moderation_obligation,24.0,self:platform_obligation,Y,,issue_representative_attempt,I043,self_strategic_reference:샘 올트먼 방한 돌연 연기 삼성 네이버 카카오 ai 협력 논의 미뤄져,카카오,자사 및 계열사 이슈,자사_및_계열사_이슈,자사_및_계열사_이슈,자사_및_계열사_이슈,자사 및 계열사 이슈,,,,,,,,,,,,,,,,,,,,,,,,,,,,
자사_및_계열사_이슈,자사 및 계열사 이슈,카카오,"임시 주총여는 카카오게임즈, 이사회 전면 개편",인벤,인벤,"Fri, 12 Jun 2026 09:10:41 GMT","Fri, 12 Jun 2026 09:10:41 GMT","임시 주총여는 카카오게임즈, 이사회 전면 개편 인벤","RSS https://www.inven.co.kr/webzine/news/?news=317119 https://www.inven.co.kr/webzine/news/?news=317119 날짜 : 2026-06-04 16:45 댓글 : 0 임시 주총여는 카카오게임즈, 이사회 전면 개편 이두현 기자 ( Biit@inven.co.kr ) 카카오게임즈가 오는 22일 임시 주주총회를 열고 신규 이사진을 선임한다. 이번 이사회 개편은 지난 3월 카카오게임즈가 글로벌 시장 공략을 위해 발표한 3천억 원 규모의 전략적 투자 유치 및 지분구조 재편의 연장선에 있다. 당시 카카오게임즈는 LY 주식회사(라인야후)가 출자한 엘트리플에이 인베스트먼트를 상대로 신주 및 전환사채 발행을 진행한다고 밝혔다. 투자가 완료되면 엘트리플에이 인베스트먼트가 카카오게임즈의 새로운 최대주주가 되며, 기존 최대주주였던 카카오는 구주 매각 대금 일부를 재투자해 2대 주주로서 협력을 이어간다. 신규 사내이사 후보로는 김태환 전 라인게임즈 부사장과 이시우 현 카카오게임즈 CBO가 추천됐다. 김태환 후보는 넥슨코리아 부사장, 넥슨재팬 CBDO, 넥슨아메리카 부사장, 라인게임즈 부사장을 역임했다. 이시우 후보는 NHN 사업팀장, 위메이드 사업팀장, 카카오게임즈 모바일 사업본부장을 거쳐 현재 카카오게임즈 CBO로 재직 중이다. 사외이사에는 임태섭 성균관대학교 GSB 교수가 후보에 올랐다. 임 후보는 골드만삭스증권 한국공동대표, 한국맥쿼리증권 대표 등을 지냈으며 현재 SK텔레콤 사외이사를 겸임하고 있다. 기타비상무이사로는 GS 미래사업팀 매니저를 거쳐 현재 페트리코파트너스 상무이사로 몸담고 있는 서석호 후보가 합류한다. 카카오게임즈 측은 지난 3월 투자 유치 발표 당시 ""이번 지분구조 재편은 글로벌 경쟁력을 한 단계 높이고 지속 가능한 성장 기반을 다지는 중요한 전환점""이라며 ""카카오와 LY 주식회사를 비롯한 파트너들과의 협력을 바탕으로 글로벌 시장에서 새로운 성장 기회를 확대해 나가겠다""고 설명한 바 있다. TAGS: #김태환 #라인게임즈 #라인야후 #이시우 #카카오게임즈 #김태환 #라인게임즈 #라인야후 #이시우 #카카오게임즈 댓글 등록순 | 최신순 | 주사위만 새로고침 새로고침 인벤",1099,bs4_selector,-10.0,date_failed:original_date_too_old>52h:2026-06-04,156.0,False,False,https://news.google.com/rss/articles/CBMiXkFVX3lxTE9HTzlPVk94Vk5mWWtDNExGWHlNTUFZQUR1YXlycWZ6N3RZd2pYaGxmbWgydTZQbXNydGJnOW9xQXRnSlRiMkUzNllwdEhnYUV3a2FIXzVYdkVBbEdiYXc?oc=5,https://www.inven.co.kr/webzine/news?news=317119,46.8,"financial_performance,kakao_games_management,platform_obligation,policy_legislation,strategy_mna_governance",kakao_games_ceo_appointment,2026-06-04,json_ld:datePublished,original_date_too_old>52h,5.0,81.2,,7.0,global_incident:platform_regulation:kakao:platform_algorithm_ad_obligation:executive_or_org_change,global_incident:platform_regulation:kakao:platform_algorithm_ad_obligation,24.0,self:platform_obligation,Y,,issue_representative_attempt,I035,카카오게임즈 최대주주 변경 및 공동대표 체제,카카오,자사 및 계열사 이슈,자사_및_계열사_이슈,자사_및_계열사_이슈,자사_및_계열사_이슈,자사 및 계열사 이슈,,,,,,,,,,,,,,,,,,,,,,,,,,,,
