카테고리,카테고리명,검색어,기사제목,언론사,정규언론사,게시일,RSS게시일,RSS요약,본문전문,본문글자수,본문추출방식,본문품질점수,본문품질사유,중요도점수,본문사용가능,본문정제적용,원래RSS링크,링크,랭킹점수,사건태그,사건단계,원문날짜,원문날짜출처,날짜검증결과,날짜후보수,대표선택점수,개인정보보안사건키,개인정보보안대표보너스,전역사건키,전역사건기본키,전역사건대표보너스,이슈패밀리,정책규제의무,자사홍보성,제외단계,v20_issue_id,v20_issue_group,수집검색어,수집원카테고리,수집JSON카테고리,Gemini판단카테고리,최종카테고리,최종카테고리명,링크상태,링크검증사유,본문정합성,본문상태,v20_issue_family,v20_internal_category,v20_issue_score,v21_self_tier,v21_gov_tier,v21_competitor_tier,v21_competitor_scope,Gemini카테고리,Gemini내부카테고리,Gemini이슈유형,Gemini이슈그룹,Gemini중복그룹,Gemini관련성,Gemini중요도,Gemini대외협력중요도,Gemini관련도,Gemini판단사유,Gemini선정사유,선정단계,선정순서,최종카테고리검증결과,v25한국정부국회근거,최종카테고리재배치,v24대표기사정합성
정부_국회,정부/국회,과학기술정보통신부,"과기정통부, AI-네이티브 자율실험실 구축 착수…신약개발 혁신 시동",데일리안,데일리안,"Fri, 12 Jun 2026 01:01:00 GMT","Fri, 12 Jun 2026 01:01:00 GMT","과기정통부, AI-네이티브 자율실험실 구축 착수…신약개발 혁신 시동 데일리안","AI가 실험을 설계하고 로봇이 이를 수행한 뒤 결과를 다시 학습하는 연구환경을 구현해 바이오 연구개발의 병목 구간을 해소하겠다는 구상이다. 과기정통부는 12일 가톨릭대학교 서울성모병원 옴니버스파크에서 사업 착수보고회를 열고 연구수행 기관과 추진계획을 공유했다. 정부는 오는 2028년까지 총 495억원을 투입해 범용 자율실험실 1개와 특화 자율실험실 5개를 구축할 계획이다. 이번 사업은 AI와 로보틱스를 활용해 연구실 단위의 AI 전환(AX)을 촉진하고, 바이오 연구개발 과정에서 발생하는 비효율을 줄이는 데 초점을 맞췄다. 과기정통부는 “최근 첨단바이오 연구는 대규모 반복 실험과 데이터 기반 AI 학습의 중요성이 커지고 있지만 상당수 실험이 여전히 연구자의 수작업에 의존하고 있다”며“이로 인해 재현성이 낮고 비용 부담이 크며 연구 기간이 길어지는 한계가 지속돼 왔다”고 사업 배경을 설명했다. 사업 핵심은 AI가 실험을 설계하고 로봇이 수행하며 결과를 학습해 다음 실험에 반영하는 ‘폐쇄루프(Closed-loop)’ 형태의 연구환경 구축이다. 이를 통해 첨단바이오 실험의 병목 프로세스를 자동화·고속화·표준화하고 연구 생산성과 재현성을 높인다는 목표다. 범용 분야에서는 가톨릭대학교가 ‘첨단바이오 AI 전환(AX)을 위한 K-Cell 범용 자율실험실 플랫폼 구축’을 맡는다. 연구진은 바이오 실험 공정을 세분화해 병목 구간을 정의하고, AI 기반 가상화실험실(Virtual Lab)과 로보틱스 자동화 기술을 결합한 자율실험실 플랫폼을 개발할 예정이다. 또한 실시간 공정 모니터링과 강화학습 기반 AI 모델을 통해 실험 조건을 최적화하는 기술도 추진한다. 특화 분야에서는 5개 연구과제가 선정됐다. DGIST는 액체생검 자율실험실을 구축해 혈액 속 암세포 탐지와 분석 자동화 기술을 개발한다. KAIST는 미래 감염병 대응 후보물질 발굴과 백신·항체 개발을 위한 자율실험실 구축에 나선다. 고려대학교는 유전자 전달체 개발을 위한 AI 주도형 자율실험실과 휴머노이드 로봇 기술을 개발하며, POSTECH은 AI 기반 효소개량 자율실험실을 구축한다. UNIST는 오가노이드 기반 약물 효능 검증 플랫폼 개발을 추진한다. 과기정통부는 이번 사업이 단순한 실험 자동화를 넘어 AI 기반 가상화실험실, 실험 자동제어 기술, 데이터 기반 실험 최적화 기술을 결합해 신약개발 기간과 비용을 줄이는 역할을 할 것으로 기대했다. 오대현 과기정통부 미래전략기술정책관은 “AI와 로보틱스가 결합한 자율실험실은 바이오 연구개발 패러다임을 근본적으로 바꾸는 게임체인저가 될 것”이라며 “AI 바이오 혁신연구거점, 국가바이오데이터 플랫폼(K-BDS) 등과 연계를 강화해 AI 기반 바이오 연구 혁신 생태계를 조성해 나가겠다”고 말했다. 과학기술정보통신부가 인공지능(AI)과 로보틱스를 활용해 신약개발 생산성을 높이는 ‘AI-네이티브 첨단바이오 자율실험실’ 구축 사업에 본격 착수했다. AI가 실험을 설계하고 로봇이 이를 수행한 뒤 결과를 다시 학습하는 연구환경을 구현해 바이오 연구개발의 병목 구간을 해소하겠다는 구상이다. 과기정통부는 12일 가톨릭대학교 서울성모병원 옴니버스파크에서 사업 착수보고회를 열고 연구수행 기관과 추진계획을 공유했다. 정부는 오는 2028년까지 총 495억원을 투입해 범용 자율실험실 1개와 특화 자율실험실 5개를 구축할 계획이다. 이번 사업은 AI와 로보틱스를 활용해 연구실 단위의 AI 전환(AX)을 촉진하고, 바이오 연구개발 과정에서 발생하는 비효율을 줄이는 데 초점을 맞췄다. 과기정통부는 “최근 첨단바이오 연구는 대규모 반복 실험과 데이터 기반 AI 학습의 중요성이 커지고 있지만 상당수 실험이 여전히 연구자의 수작업에 의존하고 있다”며“이로 인해 재현성이 낮고 비용 부담이 크며 연구 기간이 길어지는 한계가 지속돼 왔다”고 사업 배경을 설명했다. 사업 핵심은 AI가 실험을 설계하고 로봇이 수행하며 결과를 학습해 다음 실험에 반영하는 ‘폐쇄루프(Closed-loop)’ 형태의 연구환경 구축이다. 이를 통해 첨단바이오 실험의 병목 프로세스를 자동화·고속화·표준화하고 연구 생산성과 재현성을 높인다는 목표다. 범용 분야에서는 가톨릭대학교가 ‘첨단바이오 AI 전환(AX)을 위한 K-Cell 범용 자율실험실 플랫폼 구축’을 맡는다. 연구진은 바이오 실험 공정을 세분화해 병목 구간을 정의하고, AI 기반 가상화실험실(Virtual Lab)과 로보틱스 자동화 기술을 결합한 자율실험실 플랫폼을 개발할 예정이다. 또한 실시간 공정 모니터링과 강화학습 기반 AI 모델을 통해 실험 조건을 최적화하는 기술도 추진한다. 특화 분야에서는 5개 연구과제가 선정됐다. DGIST는 액체생검 자율실험실을 구축해 혈액 속 암세포 탐지와 분석 자동화 기술을 개발한다. KAIST는 미래 감염병 대응 후보물질 발굴과 백신·항체 개발을 위한 자율실험실 구축에 나선다. 고려대학교는 유전자 전달체 개발을 위한 AI 주도형 자율실험실과 휴머노이드 로봇 기술을 개발하며, POSTECH은 AI 기반 효소개량 자율실험실을 구축한다. UNIST는 오가노이드 기반 약물 효능 검증 플랫폼 개발을 추진한다. 과기정통부는 이번 사업이 단순한 실험 자동화를 넘어 AI 기반 가상화실험실, 실험 자동제어 기술, 데이터 기반 실험 최적화 기술을 결합해 신약개발 기간과 비용을 줄이는 역할을 할 것으로 기대했다. 오대현 과기정통부 미래전략기술정책관은 “AI와 로보틱스가 결합한 자율실험실은 바이오 연구개발 패러다임을 근본적으로 바꾸는 게임체인저가 될 것”이라며 “AI 바이오 혁신연구거점, 국가바이오데이터 플랫폼(K-BDS) 등과 연계를 강화해 AI 기반 바이오 연구 혁신 생태계를 조성해 나가겠다”고 말했다. #과기정통부 #과학기술정보통신부 #네이티브첨단바이오자율실험실 #신약 #인공지능 #자율실험실 장정욱 기자 (cju@dailian.co.kr) 기사 모아 보기 > 장정욱 기자 (cju@dailian.co.kr) 적도 우방도 없다…해운·조선·항만 강한 한국의 선택은 조달청-ITC, 한국 기업 글로벌 공공조달 협력 확대 논의 수산자원공단, 환경재단 등과 거제 다대마을 잘피 6000주 이식 중앙전파관리소, 13일 완주서 ‘여우사냥’ 전파 축제 개최 과기정통부, 온라인으로 영재교육 기회 제공…선교육 수강생 모집 적도 우방도 없다…해운·조선·항만 강한 한국의 선택은 조달청-ITC, 한국 기업 글로벌 공공조달 협력 확대 논의 수산자원공단, 환경재단 등과 거제 다대마을 잘피 6000주 이식 중앙전파관리소, 13일 완주서 ‘여우사냥’ 전파 축제 개최 과기정통부, 온라인으로 영재교육 기회 제공…선교육 수강생 모집",3238,bs4_selector,0.0,self_pr_promo_low_ceo_priority,134.5,False,True,https://news.google.com/rss/articles/CBMijAJBVV95cUxNUXp4cmdTQnpjRTZSZkVNWHNSdE4zUlU3c0lnUllucmJtMk1kdFVIYUhBWWtwRkMxaDU1bElnZ1R2THFNUEtSS0hCNVN5MmRJZld4LXNNY01GWFdqckdKbFZSZW5sWnJFTHp1U3JXVHVtSlF6Q29sSVZnSWk5eVI5TzVzc1hxMmthQlpxdzJtam4tOU5DemtnSGVqbFRSNUpuOHpRRTNST1djUEM1eFlCMFIwc1hydl9VMm55SWluX2xleVBENWJ2SHI4anlwXzM4RFJqQXBiSlRrWGR3YVlDeXRLdkdkdFdzSU9mWGY5SjZJMkp6QmI5YVdaVW9oRFg1bE5NTC1Qbk9ZdEd00gGPAkFVX3lxTE1JV2JmOGZmMWpFY01LYWV3OHdKc0NyTGpHYzdGNlY0OFdST091Y0U1RENtT3FjQUZZamU3cW9wS2h2LTBKYTVCQjJ1dGFTeGdvZElXRjJvc1JVOHFUZFA2TUpPUS11ZEJwQjE4cURjaXA0bFNwcE40VVlyYUxVdXNOTG1YX01qX1BnVXR4TGRWTDFMdTI1Zl8xQUp6N01NNkk2NE1zNk1ZX0RNRmV0TU84aUlWQmR5SGY2N3VKUG5jOGFRNm5mSFM3djlNQnI0al9vY0RWbnpUX3ZSbDBVM04zS1hmendkSVRtMzNyZGN4NTFPNTBMREt6YlhKWUhzY0xDZjcyNjZkV3pZcWxYQ1E?oc=5,https://www.dailian.co.kr/news/view/1655073/%EA%B3%BC%EA%B8%B0%EC%A0%95%ED%86%B5%EB%B6%80-AI-%EB%84%A4%EC%9D%B4%ED%8B%B0%EB%B8%8C-%EC%9E%90%EC%9C%A8%EC%8B%A4%ED%97%98%EC%8B%A4-2026,96.6,"ai_infrastructure_security,copyright_ai,market_power_platform,platform_obligation,policy_legislation",ai_infrastructure_security,2026-06-12,json_ld:datePublished,original_date_recent,5.0,144.15,,61.0,global_incident:platform_regulation:science_ict_ministry:platform_data_protection_obligation:announcement,global_incident:platform_regulation:science_ict_ministry:platform_data_protection_obligation,32.0,self:platform_obligation,Y,,issue_representative_attempt,I055,government_ai_core_policy:과기정통부 ai 네이티브 자율실험실 구축 착수 신약개발 혁신 시동,과학기술정보통신부,정부/국회,정부_국회,정부_국회,정부_국회,정부/국회,,,,,,,,,,,,,,,,,,,,,,,,,,,,
경쟁사_해외이슈,경쟁사/해외이슈,네이버,"네이버 CRO, '지상파 3사-네이버 소송' 증인 채택…8월 신문 전망",이데일리,이데일리,"Fri, 12 Jun 2026 06:23:18 GMT","Fri, 12 Jun 2026 06:23:18 GMT","네이버 CRO, '지상파 3사-네이버 소송' 증인 채택…8월 신문 전망 이데일리","[이데일리 한광범 기자] 지상파 3사와 네이버 간의 뉴스 콘텐츠 AI 무단 학습 관련 소송에서 당시 계약 책임자들에 대한 증인신문이 오는 8월 중 진행될 전망이다.12일 한국방송협회에 따르면, 서울중앙지방법원 민사합의63부(재판장 이규영)는 지상파 3사가 네이버를 상대로 제기한 민사소송에서 지상파 3사의 증인 신청을 받아들였다.앞서 지상파 3사는 지난 10일, 지상파와 네이버 간 체결된 ‘2018년도 클로바 스피커 특약’ 및 ‘2020년도 뉴스제휴약관’의 체결 경위와 당시 협상 내용을 확인하기 위해 계약 협상을 총괄했던 유봉석 네이버 최고경영책임자(CRO)에 대한 증인신문이 필수적이라며 증인 신청서를 제출한 바 있다.네이버 측은 이번 사건의 핵심 쟁점이 2020년도 뉴스제휴약관의 해석에 있다는 점을 들어, 유 CRO가 2019년 직책을 옮겨 2020년 약관 체결 당시 책임자가 아니었다며 이의를 제기했다.하지만 지상파 3사 측은 2018년도 클로바 스피커 특약에 관한 주장을 먼저 제기한 쪽이 네이버라는 점을 짚으며 즉각 반박했다. 아울러 2020년 초 체결된 뉴스제휴약관 협의가 그 전부터 이루어졌고 유 CRO가 체결 과정 전반에 관여했음을 강조했다.양측의 입장을 청취한 재판부는 증인신문을 진행하기로 방침을 정했다. 재판부는 지상파 3사가 신청한 유 CRO와 네이버 측이 주장하는 2020년도 뉴스제휴약관 책임자를 모두 신문하거나, 혹은 둘 중 한 명은 반드시 신문하겠다는 구상이다. 재판부는 오는 7월 중 증인을 최종 채택하고, 8월 18일 또는 25일로 예정된 6차 변론기일에 본격적인 증인신문을 진행할 계획이다.지상파 3사를 회원사로 두고 있는 한국방송협회는 재판부 결정에 대해 협의 과정의 실체적 진실을 밝힐 중요한 계기가 될 것이라며 환영의 뜻을 전했다. 방송협회 관계자는 “그동안 네이버는 뉴스제휴약관 등에 따라 언론사의 뉴스 콘텐츠를 AI 학습에 정당하게 이용했다고 주장하며, 과거 특약 삽입 및 약관 제·개정 과정에서 지상파 3사와 충분한 협의가 있었다고 강변해왔으나 이는 전혀 사실이 아니다”라고 지적했다.그러면서 “이번 뉴스 콘텐츠 제휴 업무 책임자에 대한 증인신문을 통해 당시 협의 과정의 진실이 명백히 밝힐 것”이라며 “실제 계약 및 약관 개정 과정에서 양 당사자가 뉴스 콘텐츠의 AI 학습 이용을 정말로 예정하고 있었는지, 아니면 네이버의 자의적 해석에 불과했는지 여부를 확인할 수 있을 것”이라고 덧붙였다.",1200,newspaper3k,6.0,individual_case_not_policy,-41.5,False,False,https://news.google.com/rss/articles/CBMigAFBVV95cUxNeFdnT1FfYUwtX2JOMHFTWFZZbGdqa2Q3THRhc3ZRb1BQcTBYb04wdXlfb0dqWXR3ZGdMMUhJYXQ3WURCRHd2Z3VBR3NobGVzUlM4SlhhZFZkbVRqZWpVZi1NQnJlczlxdDFOSlZ4a0tIaXUtM20yOXZydHMwUHpCNQ?oc=5,https://www.edaily.co.kr/News/Read?newsId=04408326645481064&mediaCodeNo=257,205.0,"ai_infrastructure_security,copyright_ai",ai_infrastructure_security,2026-06-12,json_ld:datePublished,original_date_recent,4.0,27.35,,0.0,global_incident:leadership_service:naver:executive_change:executive_or_org_change,global_incident:leadership_service:naver:executive_change,0.0,,,,issue_representative_attempt,I006,네이버-지상파 3사 소송 (저작권/뉴스 콘텐츠 관련),네이버,경쟁사/해외이슈,경쟁사_해외이슈,경쟁사_해외이슈,경쟁사_해외이슈,경쟁사/해외이슈,,,,,,,,,,,,,,,,,,,,,,,,,,,,
경쟁사_해외이슈,경쟁사/해외이슈,네이버,오픈AI 샘 올트먼 방한 연기…삼성·네이버 등과 회동 취소,gukjenews.com,gukjenews.com,"Sat, 13 Jun 2026 01:07:04 GMT","Sat, 13 Jun 2026 01:07:04 GMT",오픈AI 샘 올트먼 방한 연기…삼성·네이버 등과 회동 취소 gukjenews.com,"샘 올트먼 오픈AI 최고경영자(CEO)의 한국 방문 일정이 연기됐다. 12일 오픈AI는 ""샘 올트먼 오픈AI CEO의 불가피한 개인 사정으로 한국을 비롯한 아시아 방문 일정을 연기하게 됐다""고 밝혔다. 올트먼 CEO는 14일 1박 2일 일정으로 방한해, 삼성전자에서 AI 활용법 사내 강의를 하고 카카오와 네이버 등과 회동을 가질 예정이었다. 방한이 미뤄지면서 당초 계획된 전영현 대표이사 부회장(DS부문장), 노태문 대표이사 사장(DX부문장) 등 삼성전자 경영진과의 회동도 다음을 기약하게 됐다. 올트먼 CEO의 구체적 방한 취소 사유와 추가 방한 계획은 알려지지 않았다. 제헌절 18년 만에 공휴일 부활… 올해 7월 첫 '3일 황금연휴' 열린다 AI 융합형 교육실, 118개교 선정…167억 투입해 하반기 운영 시작 '스페이스X 상장일 확정' 한국시간 언제? 관련주 미리 '숙지' ""속이 뻥 뚫리네"" '참교육' 시즌2 공개일에 쏠리는 시선 분노 유발 학폭에 '참교육' 1위...원작과 몇부작 궁금증 '스페이스X 상장일' 거래 시작 한국시간은? 공모가 135달러 베일 벗은 넷플릭스 '참교육' 원작 논란 이겨낼까...몇부작 결말 궁금증 제헌절 18년 만에 공휴일 부활… 올해 7월 첫 '3일 황금연휴' 열린다 제헌절 18년 만에 공휴일 부활… 올해 7월 첫 '3일 황금연휴' 열린다 AI 융합형 교육실, 118개교 선정…167억 투입해 하반기 운영 시작 '스페이스X 상장일 확정' 한국시간 언제? 관련주 미리 '숙지' ""속이 뻥 뚫리네"" '참교육' 시즌2 공개일에 쏠리는 시선 분노 유발 학폭에 '참교육' 1위...원작과 몇부작 궁금증 '스페이스X 상장일' 거래 시작 한국시간은? 공모가 135달러 베일 벗은 넷플릭스 '참교육' 원작 논란 이겨낼까...몇부작 결말 궁금증 제헌절 18년 만에 공휴일 부활… 올해 7월 첫 '3일 황금연휴' 열린다 AI 융합형 교육실, 118개교 선정…167억 투입해 하반기 운영 시작 '스페이스X 상장일 확정' 한국시간 언제? 관련주 미리 '숙지' ""속이 뻥 뚫리네"" '참교육' 시즌2 공개일에 쏠리는 시선 분노 유발 학폭에 '참교육' 1위...원작과 몇부작 궁금증 '스페이스X 상장일' 거래 시작 한국시간은? 공모가 135달러 베일 벗은 넷플릭스 '참교육' 원작 논란 이겨낼까...몇부작 결말 궁금증 북 ""한미 무기거래, 군사 균형 파괴…억제력 강화할 것"" '나혼산' 전현무, 犬 입양→고강용 이사...최고 시청률 6.5% '오십프로' 신하균·허성태 공조로 통쾌한 반격...최고 6.4% 서울 자양동 단독주택서 화재...70대 여성 사망 오픈AI 샘 올트먼 방한 연기…삼성·네이버 등과 회동 취소 [속보] 용인 원삼면 공장서 화재...다량 연기 확산 중 북 ""한미 무기거래, 군사 균형 파괴…억제력 강화할 것"" '나혼산' 전현무, 犬 입양→고강용 이사...최고 시청률 6.5% '오십프로' 신하균·허성태 공조로 통쾌한 반격...최고 6.4% 서울 자양동 단독주택서 화재...70대 여성 사망 오픈AI 샘 올트먼 방한 연기…삼성·네이버 등과 회동 취소 [속보] 용인 원삼면 공장서 화재...다량 연기 확산 중",1535,bs4_selector,13.0,individual_case_not_policy,-51.5,False,False,https://news.google.com/rss/articles/CBMibkFVX3lxTE5zaVQ4cHF3QnpKcFNPanJ1dzlqTG1xMmdqaDFOT0lXZUdxTnVKNFZSSk1udjdjNkI0VU01ZzNta0YyTjNFM1BUaUJWVW9XS0pTSFM1b2s2ck1zQW00U240TnhMMWxfQnpqVmNUVVJB?oc=5,https://www.gukjenews.com/news/articleView.html?idxno=3607461,317.0,"ai_infrastructure_security,strategy_mna_governance",ai_infrastructure_security,2026-06-13,meta:article:published_time,original_date_recent,1.0,22.65,,7.0,global_incident:ai_security_policy:kakao:openai_security_access:policy_change,global_incident:ai_security_policy:kakao:openai_security_access,0.0,,,,issue_representative_attempt,I009,오픈AI 샘 올트먼 방한 연기,네이버,경쟁사/해외이슈,경쟁사_해외이슈,경쟁사_해외이슈,경쟁사_해외이슈,경쟁사/해외이슈,,,,,,,,,,,,,,,,,,,,,,,,,,,,
