id,원카테고리,JSON카테고리,검색어,기사제목,기사제목_정규화,언론사,정규언론사,게시일,본문요약,링크,수집채널,랭킹점수,중요도점수,사건태그,사건단계,주요주체,랭킹감점사유,정책규제의무,강제검토,강제검토사유,자사홍보성,이슈패밀리,코드힌트,오늘성점수,오늘성사유,기사유형,v26이벤트키,v26진행단계,v27_industry_ok,v27_industry_reason,v27_industry_score,v32_competitor_portfolio,v32_actor_group,랭킹원점수,편집신호,스토리버킷,전역사건키,전역사건기본키,Gemini카테고리,Gemini내부카테고리,Gemini이슈패밀리,Gemini이슈그룹,Gemini관련성,Gemini중요도,Gemini대외협력중요도,Gemini관련도,GeminiPR성,Gemini제외,Gemini판단사유,Gemini라벨소스,Gemini자사티어,Gemini정부티어,Gemini경쟁사티어,Gemini경쟁사범위,Gemini정책영향경로,Gemini경쟁시사점,Gemini중복그룹,Gemini이슈유형,v27_event_key,v26_2_profile_reason,v26가드레일사유,v36_competitor_block_reason
1685,경쟁사/해외이슈,경쟁사_해외이슈,SKT,"[금주의 IT 톡톡] SKT·엔비디아 ‘AI 인프라’ 동맹... LG유플러스, ‘유쓰 쇼츠 페스티벌’ 개최",금주의 it 톡톡 skt 엔비디아 ai 인프라 동맹 lg유플러스 유쓰 쇼츠 페스티벌 개최,미디어워치,미디어워치,"Fri, 12 Jun 2026 12:19:28 GMT","[금주의 IT 톡톡] SKT·엔비디아 ‘AI 인프라’ 동맹... LG유플러스, ‘유쓰 쇼츠 페스티벌’ 개최 미디어워치",https://news.google.com/rss/articles/CBMiY0FVX3lxTE9zckV1d25iaHd2djdzQ25oWWpDa3RHempvOXYwZUxzSEpIUjlPRGlXeUxvNWhyMFNkd2pPVXlycm4yQmlrVXFZa3lxRG56SWtvZzgtcDlnMDJmMEJQMjJCUzFwSQ?oc=5,google_rss_SKT when:2d,348.5,14.0,"ai_infrastructure_security,self_pr_promo",ai_infrastructure_security,"LGU+,SKT",,,,,,,general,14.0,published_yesterday,business_change,event:LGU++SKT:ai_infrastructure_security,general,Y,"industry_basis_pass:actor=True,change=True,bridge=False",2,Y,telco,348.5,ai_infrastructure_security,competitor:ai_strategy,,,경쟁사_해외이슈,COMPETITOR_AI_STRATEGY,국내 AI 경쟁,국가 AI 인프라/AIDC/GPU 정책,국내 통신 경쟁사의 AI 인프라 구축 및 엔비디아와의 협력 강화는 카카오 AI 사업의 인프라 전략 및 경쟁 구도에 영향을 미칠 수 있다.,2,2,2,,,SKT의 AI 인프라 전략은 국내 AI 시장 경쟁 구도에 직접적인 영향을 미치므로 중요함.,gemini,,,COMP_DOMESTIC_AI_PLATFORM,domestic,,SKT의 AI 인프라 투자와 글로벌 빅테크(엔비디아)와의 협력은 카카오의 AI 인프라 구축 및 기술 제휴 전략 수립에 중요한 참고 자료가 된다.,국가 AI 인프라/AIDC/GPU 정책,국내 AI 경쟁,,,,
1553,경쟁사/해외이슈,경쟁사_해외이슈,네이버,엔비디아 이어 오픈AI도 네이버 찾는다…AI 거물들 몰리는 이유는,엔비디아 이어 오픈ai도 네이버 찾는다 ai 거물들 몰리는 이유는,아시아투데이,아시아투데이,"Fri, 12 Jun 2026 06:13:09 GMT",엔비디아 이어 오픈AI도 네이버 찾는다…AI 거물들 몰리는 이유는 아시아투데이,https://news.google.com/rss/articles/CBMibkFVX3lxTE1ubVh5cHloQ0dwc0o0VHdERGpPbFdjVVh4T2xyUWRZUXlxT1BnTUU2S1dDUVBONmhCQ0lKT0RmRTJMQ2lnOHg3RE1scEQ0OUZYd0dpNFNJRU4wS1JSSk1LaUdHUVBQZGtJTnhrUGtB?oc=5,google_rss_네이버 when:2d,347.5,16.0,ai_infrastructure_security,ai_infrastructure_security,"네이버,오픈AI",,,,,,,general,14.0,published_yesterday,business_change,global_incident:ai_security_policy:naver:openai_security_access,general,Y,"industry_basis_pass:actor=True,change=False,bridge=True",2,Y,naver,347.5,ai_infrastructure_security,competitor:ai_strategy,global_incident:ai_security_policy:naver:openai_security_access:general,global_incident:ai_security_policy:naver:openai_security_access,경쟁사_해외이슈,COMPETITOR_AI_STRATEGY,국내 AI 경쟁,네이버 AI 거물 기업 협력 강화,"네이버가 글로벌 AI 빅테크(엔비디아, 오픈AI)와의 협력을 강화하여 AI 인프라 역량을 집중하는 것은 국내 AI 시장 경쟁 구도에서 카카오에 전략적 압박으로 작용할 수 있다.",1,1,1,,,네이버가 글로벌 AI 핵심 기업들과의 협력을 강화하는 것은 국내 AI 시장의 경쟁 구도에 큰 변화를 줄 수 있어 매우 중요함.,gemini,,,COMP_DOMESTIC_AI_PLATFORM,domestic,,"네이버의 AI 생태계 확장 전략은 카카오의 AI 기술 및 서비스 경쟁력 확보 방안을 재고하게 하며, 글로벌 AI 파트너십 전략에도 시사점을 제공한다.",네이버 AI 거물 기업 협력 강화,국내 AI 경쟁,,,,
1599,경쟁사/해외이슈,경쟁사_해외이슈,네이버,"엔비디아, 네이버와 AI 인프라 확장... 차세대 AI 인프라 확장 개시",엔비디아 네이버와 ai 인프라 확장 차세대 ai 인프라 확장 개시,인벤,인벤,"Fri, 12 Jun 2026 09:11:04 GMT","엔비디아, 네이버와 AI 인프라 확장... 차세대 AI 인프라 확장 개시 인벤",https://news.google.com/rss/articles/CBMiaEFVX3lxTE1XTWlnVnQ1TFowWmRLY0NkeFprWGR5UWpCUktlNEQ0azY1ck1RNmpQTHJqZElzVVRSZVhEMkdBWFcwUzNSd200Y09BWUxfT2llM2I4czZ4VkdJZXRlWktBSzFadnVieW1M?oc=5,google_rss_네이버 규제 when:2d,345.0,13.5,ai_infrastructure_security,ai_infrastructure_security,네이버,,,,,,,general,14.0,published_yesterday,business_change,event:네이버:ai_infrastructure_security,action_started,Y,"industry_basis_pass:actor=True,change=True,bridge=True",3,Y,naver,345.0,ai_infrastructure_security,competitor:ai_strategy,,,경쟁사_해외이슈,COMPETITOR_AI_STRATEGY,국내 AI 경쟁,국가 AI 인프라/AIDC/GPU 정책,네이버가 글로벌 AI 빅테크(엔비디아)와의 협력을 강화하여 AI 인프라 역량을 집중하는 것은 국내 AI 시장 경쟁 구도에서 카카오에 전략적 압박으로 작용할 수 있다.,1,1,1,,,네이버가 글로벌 AI 핵심 기업들과의 협력을 강화하는 것은 국내 AI 시장의 경쟁 구도에 큰 변화를 줄 수 있어 매우 중요함.,gemini,,,COMP_DOMESTIC_AI_PLATFORM,domestic,,"네이버의 AI 인프라 확장 전략은 카카오의 AI 기술 투자 및 인프라 구축 방향성을 재고하게 하며, 국내 AI 경쟁력 확보에 영향을 미친다.",국가 AI 인프라/AIDC/GPU 정책,국내 AI 경쟁,,,,
1578,경쟁사/해외이슈,경쟁사_해외이슈,네이버,"[젠슨 황 이펙트⑨] 베일 벗은 엔비디아와 네이버 동맹, 이해진 젠슨 황 손잡고 AI 인프라 영토 확장",젠슨 황 이펙트 베일 벗은 엔비디아와 네이버 동맹 이해진 젠슨 황 손잡고 ai 인프라 영토 확장,비즈니스포스트,비즈니스포스트,"Fri, 12 Jun 2026 07:45:12 GMT","[젠슨 황 이펙트⑨] 베일 벗은 엔비디아와 네이버 동맹, 이해진 젠슨 황 손잡고 AI 인프라 영토 확장 비즈니스포스트",https://news.google.com/rss/articles/CBMic0FVX3lxTFAwUVBkM0hJMlllNzJ6dFlJS0o0VnlJaDlvcnp0ZEFDYjlabXRMeWZyMVlfWVY3YWk0enV5OHpjLVBMaEotMnpBVFVIdng2X2IxYWZVNzk4MTFLRkxqalFEanMzQkpsaDRDU290alJ0SXhwR3M?oc=5,google_rss_네이버 AI when:2d,345.0,13.5,ai_infrastructure_security,ai_infrastructure_security,네이버,,,,,,,general,14.0,published_yesterday,business_change,event:네이버:ai_infrastructure_security,general,Y,"industry_basis_pass:actor=True,change=True,bridge=True",3,Y,naver,345.0,ai_infrastructure_security,competitor:ai_strategy,,,경쟁사_해외이슈,COMPETITOR_AI_STRATEGY,국내 AI 경쟁,국가 AI 인프라/AIDC/GPU 정책,네이버가 글로벌 AI 빅테크(엔비디아)와의 협력을 강화하여 AI 인프라 역량을 집중하는 것은 국내 AI 시장 경쟁 구도에서 카카오에 전략적 압박으로 작용할 수 있다.,1,1,1,,,네이버가 글로벌 AI 핵심 기업들과의 협력을 강화하는 것은 국내 AI 시장의 경쟁 구도에 큰 변화를 줄 수 있어 매우 중요함.,gemini,,,COMP_DOMESTIC_AI_PLATFORM,domestic,,네이버 경영진이 직접 나서 엔비디아와 AI 인프라 확장을 모색하는 것은 카카오의 AI 사업 방향 및 리더십의 전략적 판단에 영향을 미칠 수 있다.,국가 AI 인프라/AIDC/GPU 정책,국내 AI 경쟁,,,,
1530,경쟁사/해외이슈,경쟁사_해외이슈,네이버,앤트로픽도 네이버 1784로... 'AI 3대장' 모두 찾은 K-인프라 저력,앤트로픽도 네이버 1784로 ai 3대장 모두 찾은 k 인프라 저력,마켓잉크,마켓잉크,"Fri, 12 Jun 2026 05:54:33 GMT",앤트로픽도 네이버 1784로... 'AI 3대장' 모두 찾은 K-인프라 저력 마켓잉크,https://news.google.com/rss/articles/CBMibkFVX3lxTE1qWW02azRmRE9WRVA0djNyajZjV0RGQV9RUGV0ck1PYW5oSUlrQ0F2Q2tWODY2RUtxV1otdy1mbEhRbXU3MUV1Wk55Y3B6d2ctWDFEN0szbUt4c1V5OHdmQWF0ZlRmdDZrSlpmdG93?oc=5,google_rss_네이버 when:2d,345.0,13.5,ai_infrastructure_security,ai_infrastructure_security,"네이버,앤트로픽",,,,,,,general,14.0,published_yesterday,business_change,global_incident:ai_security_policy:naver:anthropic_glasswing_security,general,Y,"industry_basis_pass:actor=True,change=True,bridge=True",3,Y,naver,345.0,ai_infrastructure_security,competitor:ai_strategy,global_incident:ai_security_policy:naver:anthropic_glasswing_security:general,global_incident:ai_security_policy:naver:anthropic_glasswing_security,경쟁사_해외이슈,COMPETITOR_AI_STRATEGY,국내 AI 경쟁,네이버 AI 거물 기업 협력 강화,네이버가 글로벌 AI 빅테크(앤트로픽 등)와의 협력을 강화하여 AI 인프라 역량을 집중하는 것은 국내 AI 시장 경쟁 구도에서 카카오에 전략적 압박으로 작용할 수 있다.,1,1,1,,,네이버가 글로벌 AI 핵심 기업들과의 협력을 강화하는 것은 국내 AI 시장의 경쟁 구도에 큰 변화를 줄 수 있어 매우 중요함.,gemini,,,COMP_DOMESTIC_AI_PLATFORM,domestic,,네이버가 'AI 3대장'과의 협력을 통해 AI 인프라 저력을 과시하는 것은 카카오의 AI 생태계 구축 및 파트너십 전략 수립에 중요한 참고 자료가 된다.,네이버 AI 거물 기업 협력 강화,국내 AI 경쟁,,,,
1582,경쟁사/해외이슈,경쟁사_해외이슈,네이버,‘풀스택 인프라’ SKT vs ‘소버린 AI’ 네이버…엔비디아 협력 同床異色,풀스택 인프라 skt vs 소버린 ai 네이버 엔비디아 협력,대한경제,대한경제,"Thu, 11 Jun 2026 20:40:10 GMT",‘풀스택 인프라’ SKT vs ‘소버린 AI’ 네이버…엔비디아 협력 同床異色 대한경제,https://news.google.com/rss/articles/CBMidEFVX3lxTE9KZlZTUEZkSmY2Umc1UERmT282Uy1rTEFuNi1VcWRZMVBjTlZvVWZBTmRqbW9zaHZJdHZSNTdlTnplUGszYU5mazBBckk4bWV3YlhZRi1uOGpjYS1fMmEyd3lLb2RQd09qRlcyN091SWJ5anZB?oc=5,google_rss_네이버 AI when:2d,342.0,13.5,ai_infrastructure_security,ai_infrastructure_security,"SKT,네이버",,,,,,,general,14.0,published_yesterday,business_change,event:SKT+네이버:ai_infrastructure_security,general,Y,"industry_basis_pass:actor=True,change=True,bridge=True",3,Y,naver,342.0,ai_infrastructure_security,competitor:ai_strategy,,,경쟁사_해외이슈,COMPETITOR_AI_STRATEGY,국내 AI 경쟁,국가 AI 인프라/AIDC/GPU 정책,국내 양대 경쟁 플랫폼인 SKT와 네이버가 엔비디아와의 협력을 통해 각기 다른 AI 인프라 전략을 추진하는 양상을 파악하고 카카오의 AI 인프라 구축 방향성을 재고할 필요가 있다.,1,1,1,,,국내 주요 경쟁사들의 AI 인프라 전략을 비교 분석하여 카카오의 AI 사업 전략 수립에 활용할 수 있음.,gemini,,,COMP_DOMESTIC_AI_PLATFORM,mixed,,"경쟁사들의 AI 인프라 구축 및 협력 모델의 차이점을 분석하여 카카오의 AI 기술 투자 및 협력 모델을 고도화하고, 시장에서의 차별화 전략을 모색한다.",국가 AI 인프라/AIDC/GPU 정책,국내 AI 경쟁,,,,
2035,경쟁사/해외이슈,경쟁사_해외이슈,구글,앤트로픽·구글이 매달 3조 원씩 내는 곳 — 멤피스 콜로서스 실체 분석,앤트로픽 구글이 매달 3조 원씩 내는 곳 멤피스 콜로서스 실체 분석,네이버 프리미엄콘텐츠,네이버 프리미엄콘텐츠,"Fri, 12 Jun 2026 09:13:00 GMT",앤트로픽·구글이 매달 3조 원씩 내는 곳 — 멤피스 콜로서스 실체 분석 네이버 프리미엄콘텐츠,https://news.google.com/rss/articles/CBMiggFBVV95cUxPSEFRWEdob3hnWVhpVTBpd3VWbVM1OFJwOGV0VUkxelRZRDhvd0dWd3RBXzBROEFMNkVrNjNyaDRTanhUV1hmVkltVDZvVnh2M3B2VmU1YmJ0YVJnYVpuaHpWcGhDbVpyVVdNOHVTQUFiNUljX1kzTHktQjZKVE10LUJR?oc=5,google_rss_구글 when:2d,334.5,9.0,,,"구글,네이버,앤트로픽",,,,,,,general,2.0,published_yesterday+analysis_without_direct_event,analysis_feature,global_incident:ai_security_policy:naver:anthropic_glasswing_security,rumor_or_report,Y,"industry_basis_pass:actor=True,change=False,bridge=True",2,Y,naver,334.5,,,global_incident:ai_security_policy:naver:anthropic_glasswing_security:general,global_incident:ai_security_policy:naver:anthropic_glasswing_security,경쟁사_해외이슈,COMPETITOR_AI_STRATEGY,글로벌 AI 시장 동향,국가 AI 인프라/AIDC/GPU 정책,"해외 주요 AI 기업의 대규모 인프라 투자 동향은 AI 개발 및 서비스 운영에 필요한 막대한 자본과 기술적 요구사항을 보여주며, 카카오의 AI 투자 계획에 참고할 수 있다.",2,2,2,,,글로벌 AI 시장의 핵심인 인프라 투자 동향을 파악하여 카카오의 AI 전략 수립에 참고할 수 있음.,gemini,,,COMP_OVERSEAS_PLATFORM_AI,overseas,,"글로벌 AI 경쟁사들의 막대한 인프라 투자 규모는 카카오의 AI 사업 추진 시 필요한 자원 규모를 가늠하게 하며, 기술 개발 및 효율성 측면에서 시사하는 바가 크다.",국가 AI 인프라/AIDC/GPU 정책,글로벌 AI 시장 동향,,,,
1693,경쟁사/해외이슈,경쟁사_해외이슈,SKT,[그래픽] 강화되는 SKT-앤트로픽 협력,그래픽 강화되는 skt 앤트로픽 협력,CEO스코어데일리,CEO스코어데일리,"Fri, 12 Jun 2026 01:46:17 GMT",[그래픽] 강화되는 SKT-앤트로픽 협력 CEO스코어데일리,https://news.google.com/rss/articles/CBMia0FVX3lxTE9taHBoYTZCVlhmbW9CcW56SlRWS1hxQnhURDNVYmdsUnRLOW9jb0lZUDdPSldPOUN0a01qaWtXQWV4UkxxWUt6X2ZxakZWYTlQWlpINnNIQ09Sb0hqS19TcHNoN3Q0X1pIdHVF?oc=5,google_rss_SKT when:2d,332.5,4.0,,,"SKT,앤트로픽",,,,,,,general,14.0,published_yesterday,general,global_incident:ai_security_policy:skt:anthropic_glasswing_security,general,Y,"industry_basis_pass:actor=True,change=False,bridge=True",2,Y,telco,332.5,,,global_incident:ai_security_policy:skt:anthropic_glasswing_security:general,global_incident:ai_security_policy:skt:anthropic_glasswing_security,경쟁사_해외이슈,COMPETITOR_AI_STRATEGY,국내 AI 경쟁,국가 AI 인프라/AIDC/GPU 정책,"국내 통신 경쟁사의 AI 핵심 파트너십(앤트로픽) 강화는 카카오의 AI 서비스 개발 및 제휴 전략에 영향을 미칠 수 있으며, 국내 AI 시장의 주요 플레이어 동향을 주시해야 한다.",2,2,2,,,SKT의 AI 파트너십 강화는 국내 AI 시장 경쟁 구도에 직접적인 영향을 미치므로 중요함.,gemini,,,COMP_DOMESTIC_AI_PLATFORM,domestic,,"SKT와 앤트로픽의 협력 강화는 국내 AI 서비스 시장의 경쟁 심화를 예고하며, 카카오의 AI 파트너십 발굴 및 서비스 차별화 전략에 대한 고민을 요구한다.",국가 AI 인프라/AIDC/GPU 정책,국내 AI 경쟁,,,,
1601,경쟁사/해외이슈,경쟁사_해외이슈,네이버,"쿠팡 6,246억 과징금, 단순한 개인정보 유출 사고가 아니다: 플랫폼 기업과 데이터 리스크",쿠팡 6 246억 과징금 단순한 개인정보 유출 사고가 아니다 플랫폼 기업과 데이터 리스크,네이버 프리미엄콘텐츠,네이버 프리미엄콘텐츠,"Thu, 11 Jun 2026 22:19:58 GMT","쿠팡 6,246억 과징금, 단순한 개인정보 유출 사고가 아니다: 플랫폼 기업과 데이터 리스크 네이버 프리미엄콘텐츠",https://news.google.com/rss/articles/CBMihgFBVV95cUxOUEIwZ0xJVU1odUhRSmxncTlmMnF1bmdfbkxZcTVCY0FYd3lYVlo3QzlqcWRkNTRYbVZsckMweFNvNGlRblpzd1AyTDVlajFEMWgtWTZlc1VQX2V1ZVFTV2k2Z0ZFRWtzMUhHOVZNdzdJdl81by0tUW5WQjhRenp3cUQ0V1lGdw?oc=5,google_rss_네이버 과징금 when:2d,324.5,105.5,"antitrust_platform,legal_regulatory_enforcement,market_power_platform,phishing_security,privacy_security_reliability",antitrust_general,"네이버,쿠팡",brand_not_in_title,Y,,,,competitor:platform_obligation,platform_operator_obligation,14.0,published_yesterday,official_action,v27:platform_enforcement:coupang:privacy_data_violation,penalty_or_sanction,Y,"industry_basis_pass:actor=True,change=False,bridge=True",2,Y,naver,324.5,"legal_regulatory_enforcement,privacy_security_reliability,market_power_platform",competitor:platform_obligation,global_incident:platform_enforcement:coupang:privacy_data_violation:sanction_penalty,global_incident:platform_enforcement:coupang:privacy_data_violation,정부_국회,COMPETITOR_PLATFORM_RISK,플랫폼 규제 강화,쿠팡 개인정보 유출 과징금 및 행정소송,국내 플랫폼 사업자에 대한 개인정보보호 규제 강화 및 대규모 과징금 부과 선례는 카카오의 개인정보 관리 및 규제 준수 노력에 대한 경각심을 높인다.,1,1,1,,Y,국내 플랫폼 기업에 대한 역대 최대 과징금 부과는 모든 플랫폼 사업자에게 중요한 규제 리스크 시그널임. / v23_guardrail_fail:v26_2_government_without_central_public_actor_action:no_public_actor_action_domain,gemini,,GOV_REGULATORY_ENFORCEMENT,COMP_DOMESTIC_DIRECT_RISK,domestic,"개인정보보호위원회의 플랫폼 기업에 대한 강도 높은 제재는 카카오의 개인정보 처리 방침 및 정보보호 시스템 점검을 강화하고, 향후 유사 사례 발생 시 대응 전략을 수립하는 데 참고해야 한다.","경쟁 플랫폼의 규제 리스크는 시장 전반의 규제 환경 변화를 반영하며, 카카오 역시 개인정보보호 관련 내부 통제를 강화하고 선제적으로 대응할 필요성을 시사한다.",쿠팡 개인정보 유출 과징금 및 행정소송,플랫폼 규제 강화,platform_enforcement:coupang:privacy_data_violation,,,
1651,경쟁사/해외이슈,경쟁사_해외이슈,네이버,"쿠팡Inc, 개인정보위 과징금에 불복… “서울행정법원에 행정소송”",쿠팡inc 개인정보위 과징금에 불복 서울행정법원에 행정소송,전자신문,전자신문,"Fri, 12 Jun 2026 02:10:54 GMT","쿠팡Inc, 개인정보위 과징금에 불복… “서울행정법원에 행정소송” 전자신문",https://news.google.com/rss/articles/CBMiTkFVX3lxTE8tcGs1ME9VdGdPNlRnYnFFQlBHc1FSS2lBOWVJNEZzZDBnMFBNcTdrRGxZOEYtVXZRSzhQUnhvemRycDV6VVRyVjBPanp6Zw?oc=5,google_rss_네이버 site:etnews.com when:2d,324.5,82.0,"antitrust_platform,legal_regulatory_enforcement",antitrust_general,쿠팡,brand_not_in_title,Y,,,,competitor:platform_obligation,platform_operator_obligation,14.0,published_yesterday,official_action,v27:platform_enforcement:coupang:privacy_data_violation,litigation,Y,"industry_basis_pass:actor=True,change=False,bridge=True",2,Y,naver,324.5,legal_regulatory_enforcement,competitor:platform_obligation,global_incident:platform_enforcement:coupang:privacy_data_violation:sanction_penalty,global_incident:platform_enforcement:coupang:privacy_data_violation,정부_국회,GOV_PLATFORM_REGULATION,플랫폼 규제 강화,쿠팡 개인정보 유출 과징금 및 행정소송,국내 플랫폼 사업자에 대한 개인정보보호 규제 강화 및 대규모 과징금 부과 선례는 카카오의 개인정보 관리 및 규제 준수 노력에 대한 경각심을 높인다.,1,1,1,,,국내 플랫폼 기업에 대한 역대 최대 과징금 부과는 모든 플랫폼 사업자에게 중요한 규제 리스크 시그널임.,gemini,,GOV_REGULATORY_ENFORCEMENT,COMP_DOMESTIC_DIRECT_RISK,domestic,개인정보보호위원회의 플랫폼 기업에 대한 강도 높은 제재와 이에 대한 행정소송 움직임은 규제 준수 및 법적 대응 전략 수립에 중요한 참고가 된다.,"경쟁 플랫폼의 규제 리스크는 시장 전반의 규제 환경 변화를 반영하며, 카카오 역시 개인정보보호 관련 내부 통제를 강화하고 선제적으로 대응할 필요성을 시사한다.",쿠팡 개인정보 유출 과징금 및 행정소송,플랫폼 규제 강화,platform_enforcement:coupang:privacy_data_violation,,,
1605,경쟁사/해외이슈,경쟁사_해외이슈,네이버,"쿠팡 과징금 6247억, 개인정보유출 '역대 최대'",쿠팡 과징금 6247억 개인정보유출 역대 최대,네이트,네이트,"Thu, 11 Jun 2026 19:33:00 GMT","쿠팡 과징금 6247억, 개인정보유출 '역대 최대' 네이트",https://news.google.com/rss/articles/CBMiU0FVX3lxTE15X1JNZjhXR3VSTTVBTWhuVm9CRExSaHBFMWRHak9QVWFfaUdzR216NkcySUphN3ltOXFDYWszUGVRSzdtbnNtRFF5aGVTUHB6cEVZ?oc=5,google_rss_네이버 과징금 when:2d,321.5,96.0,"antitrust_platform,legal_regulatory_enforcement,phishing_security,privacy_security_reliability",antitrust_general,쿠팡,brand_not_in_title,Y,,,,competitor:platform_obligation,platform_operator_obligation,14.0,published_yesterday,official_action,v27:platform_enforcement:coupang:privacy_data_violation,penalty_or_sanction,Y,"industry_basis_pass:actor=True,change=False,bridge=True",2,Y,naver,321.5,"legal_regulatory_enforcement,privacy_security_reliability",competitor:platform_obligation,global_incident:platform_enforcement:coupang:privacy_data_violation:sanction_penalty,global_incident:platform_enforcement:coupang:privacy_data_violation,정부_국회,COMPETITOR_PLATFORM_RISK,플랫폼 규제 강화,쿠팡 개인정보 유출 과징금 및 행정소송,국내 플랫폼 사업자에 대한 개인정보보호 규제 강화 및 대규모 과징금 부과 선례는 카카오의 개인정보 관리 및 규제 준수 노력에 대한 경각심을 높인다.,1,1,1,,Y,국내 플랫폼 기업에 대한 역대 최대 과징금 부과는 모든 플랫폼 사업자에게 중요한 규제 리스크 시그널임. / v23_guardrail_fail:v26_2_government_without_central_public_actor_action:no_public_actor_action_domain,gemini,,GOV_REGULATORY_ENFORCEMENT,COMP_DOMESTIC_DIRECT_RISK,domestic,"개인정보보호위원회의 플랫폼 기업에 대한 강도 높은 제재는 카카오의 개인정보 처리 방침 및 정보보호 시스템 점검을 강화하고, 향후 유사 사례 발생 시 대응 전략을 수립하는 데 참고해야 한다.","경쟁 플랫폼의 규제 리스크는 시장 전반의 규제 환경 변화를 반영하며, 카카오 역시 개인정보보호 관련 내부 통제를 강화하고 선제적으로 대응할 필요성을 시사한다.",쿠팡 개인정보 유출 과징금 및 행정소송,플랫폼 규제 강화,platform_enforcement:coupang:privacy_data_violation,,,
1546,경쟁사/해외이슈,경쟁사_해외이슈,네이버,오픈AI 샘 올트먼 방한 연기…삼성·네이버 등과 회동 취소,오픈ai 샘 올트먼 방한 연기 삼성 네이버 등과 회동 취소,gukjenews.com,gukjenews.com,"Sat, 13 Jun 2026 01:07:04 GMT",오픈AI 샘 올트먼 방한 연기…삼성·네이버 등과 회동 취소 gukjenews.com,https://news.google.com/rss/articles/CBMibkFVX3lxTE5zaVQ4cHF3QnpKcFNPanJ1dzlqTG1xMmdqaDFOT0lXZUdxTnVKNFZSSk1udjdjNkI0VU01ZzNta0YyTjNFM1BUaUJWVW9XS0pTSFM1b2s2ck1zQW00U240TnhMMWxfQnpqVmNUVVJB?oc=5,google_rss_네이버 when:2d,317.0,16.0,ai_infrastructure_security,ai_infrastructure_security,"네이버,오픈AI",,,,,,,general,24.0,published_today,business_change,global_incident:ai_security_policy:naver:openai_security_access,general,Y,"industry_basis_pass:actor=True,change=False,bridge=True",2,Y,naver,317.0,ai_infrastructure_security,competitor:ai_strategy,global_incident:ai_security_policy:naver:openai_security_access:general,global_incident:ai_security_policy:naver:openai_security_access,경쟁사_해외이슈,COMPETITOR_AI_STRATEGY,글로벌 AI 시장 동향,오픈AI 샘 올트먼 방한 연기,"오픈AI 최고 경영자의 방한 연기는 국내 주요 기업들과의 AI 협력 논의 일정에 영향을 미치며, 카카오의 잠재적 글로벌 AI 파트너십 전략에도 간접적인 시사점을 제공한다.",2,2,2,,,글로벌 AI 리더의 국내 주요 기업과의 협력 일정 변화는 카카오의 AI 전략 및 파트너십에 간접적 영향을 미침.,gemini,,,COMP_OVERSEAS_PLATFORM_AI,mixed,,"샘 올트먼의 방한 연기는 글로벌 AI 선두 기업의 국내 시장 진출 및 협력 일정에 변화를 주며, 국내 AI 기업들의 경쟁 및 파트너십 기회에 영향을 미칠 수 있다.",오픈AI 샘 올트먼 방한 연기,글로벌 AI 시장 동향,,,,
