id,원카테고리,JSON카테고리,검색어,기사제목,기사제목_정규화,언론사,정규언론사,게시일,본문요약,링크,수집채널,랭킹점수,중요도점수,사건태그,사건단계,주요주체,랭킹감점사유,정책규제의무,강제검토,강제검토사유,자사홍보성,이슈패밀리,코드힌트,오늘성점수,오늘성사유,기사유형,v26이벤트키,v26진행단계,v27_industry_ok,v27_industry_reason,v27_industry_score,v32_competitor_portfolio,v32_actor_group,랭킹원점수,편집신호,스토리버킷,전역사건키,전역사건기본키,Gemini카테고리,Gemini내부카테고리,Gemini이슈패밀리,Gemini이슈그룹,Gemini관련성,Gemini중요도,Gemini대외협력중요도,Gemini관련도,GeminiPR성,Gemini제외,Gemini판단사유,Gemini라벨소스,Gemini자사티어,Gemini정부티어,Gemini경쟁사티어,Gemini경쟁사범위,Gemini정책영향경로,Gemini경쟁시사점,Gemini중복그룹,Gemini이슈유형,v27_event_key,v26_2_profile_reason,v26가드레일사유,v36_competitor_block_reason
1408,정부/국회,정부_국회,스테이블코인,5억명 털린 메타보다 많다… '개인정보 유출' 쿠팡 6246억 과징금 폭탄,5억명 털린 메타보다 많다 개인정보 유출 쿠팡 6246억 과징금 폭탄,더퍼블릭,더퍼블릭,"Fri, 12 Jun 2026 05:37:39 GMT",5억명 털린 메타보다 많다… '개인정보 유출' 쿠팡 6246억 과징금 폭탄 더퍼블릭,https://news.google.com/rss/articles/CBMia0FVX3lxTFBuQWZUb2tzbElkdkY3SVAzN3pQTUEzck5EUUxPWTQzcVZTbF9UcERHc0RYby1SNl9qOUstcm9EVE5lb2l5bFQ1UF9zNlFRQm9xTzJma3NScW4zOGVTRy05VlFyaDc0UFF3aXU40gFvQVVfeXFMTk1qMnFORU44cmN2YkFSM3V1WXM5RjZpaEEyWVpidzlSbTJndGdOejV3LVNzZWZxbzFGTWhtVXktZkNKdmpCVk10akJJQ0Y3N0ZDaGZOUkZOZHVKS1A1YURYNW9YRTQzOHc1bTQzYzhJ?oc=5,google_rss_스테이블코인 과징금 when:2d,98.0,-24.0,"antitrust_platform,legal_regulatory_enforcement,phishing_security,privacy_security_reliability",antitrust_general,"메타,쿠팡",v26_2_government_without_central_public_actor_action:no_public_actor_action_domain,Y,,,,government:platform_obligation,platform_operator_obligation,14.0,published_yesterday,official_action,v27:platform_enforcement:coupang:privacy_data_violation,penalty_or_sanction,Y,"industry_basis_pass:actor=True,change=False,bridge=True",2,Y,coupang,98.0,"legal_regulatory_enforcement,privacy_security_reliability,digital_asset_stablecoin",government:platform_obligation,global_incident:platform_enforcement:coupang:privacy_data_violation:sanction_penalty,global_incident:platform_enforcement:coupang:privacy_data_violation,정부_국회,GOV_PLATFORM_REGULATION,플랫폼 규제,쿠팡 역대 최대 과징금 (개인정보 유출),국내 주요 플랫폼 경쟁사의 막대한 과징금 부과는 유사 플랫폼 사업자에 대한 규제 강화 및 적용 가능성에 대한 선제적 모니터링 필요성을 시사한다.,1,1,1,,Y,쿠팡 개인정보 유출 과징금은 국내 플랫폼 사업자 개인정보보호 의무 및 규제 환경을 이해하는 데 중요하다. / v23_guardrail_fail:v26_2_government_without_central_public_actor_action:no_public_actor_action_domain,gemini,,GOV_REGULATORY_ENFORCEMENT,COMP_DOMESTIC_DIRECT_RISK,domestic,"국내외 주요 플랫폼의 개인정보 유출 사례와 규제 당국의 제재 강도를 비교함으로써, 카카오의 개인정보보호 의무 준수 및 리스크 관리의 중요성을 인식하고 관련 정책을 점검하는 데 활용할 수 있다.",카카오 플랫폼·AI·대관 대응 경로에 영향을 줄 수 있는 정책/감독 이슈,쿠팡 역대 최대 과징금 (개인정보 유출),플랫폼 규제,platform_enforcement:coupang:privacy_data_violation,weak_gov_basis:no_public_actor_action_domain,,
1790,경쟁사/해외이슈,경쟁사_해외이슈,LGU+,"이통3사 이용자보호 성적표 갈렸다…LGU+ '최우수', SKT는 해킹 여파",이통3사 이용자보호 성적표 갈렸다 lgu+ 최우수 skt는 해킹 여파,네이트,네이트,"Fri, 12 Jun 2026 05:42:00 GMT","이통3사 이용자보호 성적표 갈렸다…LGU+ '최우수', SKT는 해킹 여파 네이트",https://news.google.com/rss/articles/CBMieEFVX3lxTE1YelR6dHVVdFVkTEpLTTdMb2hqSDNaQlg0VFpDYi1LMExTcHVZVGQwdGdRaGR0RVcyYzlSanFQQmJtN3Y4YU10blNpb3dVZVJONi1vazhJaXNFcHRqVFhoMEpwSnUtdW5zRVVHR2xZWHYzeXBEV3JLdw?oc=5,google_rss_LGU+ when:2d,95.5,36.0,"phishing_security,privacy_security_reliability",security_hacking_incident,"LGU+,SKT",,,,,,,general,14.0,published_yesterday,analysis_with_direct_risk,privacy_security:skt:data_leak,general,Y,"industry_basis_pass:actor=True,change=True,bridge=True",3,Y,telco,95.5,privacy_security_reliability,competitor:security_reliability,global_incident:platform_regulation:skt:platform_regulation:general,global_incident:platform_regulation:skt:platform_regulation,경쟁사_해외이슈,COMPETITOR_PLATFORM_RISK,통신사 서비스,이통3사 이용자보호 평가 및 SKT 해킹 여파,"국내 이동통신 3사의 이용자 보호 평가 결과 및 SKT 해킹 사례는 플랫폼 사업자에게 중요한 보안 및 고객 보호 의무를 상기시키며, 카카오의 정보보호 시스템 및 고객 소통 전략 점검에 참고할 수 있다.",1,1,1,,,국내 통신사 이용자 보호 평가 및 해킹 사고는 플랫폼 사업자로서 카카오의 보안 및 고객 보호 의무에 대한 규제 및 사회적 요구를 이해하는 데 중요하다.,gemini,,,COMP_DOMESTIC_DIRECT_RISK,domestic,,"통신사의 이용자 보호 성적표는 플랫폼 사업자의 서비스 안정성 및 신뢰도 관리의 중요성을 보여주며, 카카오도 사용자 보호를 위한 노력을 지속하고 관련 성과를 투명하게 공개하는 전략을 고려할 수 있다.",이통3사 이용자보호 평가 및 SKT 해킹 여파,통신사 서비스,,,,
2641,산업동향,산업동향,인공지능 산업 동향,"삼성 이어 SK까지, 챗GPT 도입 검토...반도체 업계 개방형 AI 도입 속도",삼성 이어 sk까지 챗gpt 도입 검토 반도체 업계 개방형 ai 도입 속도,내외뉴스통신,내외뉴스통신,"Fri, 12 Jun 2026 01:35:28 GMT","삼성 이어 SK까지, 챗GPT 도입 검토...반도체 업계 개방형 AI 도입 속도 내외뉴스통신",https://news.google.com/rss/articles/CBMibEFVX3lxTFBDb3lQaE4zaHBFYV9GUlZwUktLb1haUFR3UzFtcGhfa1hrTXR3ZGlpTzhMNkVTSnJ4eWpJYnBKcnNJMzRBalFhMlN3VzhIWEtNOHY5aDZQWkpkNHk1eWdSeEZNSUI3TmpGenB6WNIBcEFVX3lxTE9VT21ZV2tsTnppN3dxdDdaMTg3Mk5NajhmSmh4aGhUS0cxLVlWV203c3ZrQ2dhcnQ1MlZYR01EVEFnbWZxUFFQVHdneGwzS3RfN0lVbjRnYzhTRm9yT0JvX3lWUUFvZlJlSnNnQzJ4dUk?oc=5,google_rss_인공지능 산업 동향 when:2d,75.0,27.5,ai_infrastructure_security,ai_infrastructure_security,오픈AI,,,,,,,general,14.0,published_yesterday,business_change,event:오픈AI:ai_infrastructure_security,consultation,Y,"industry_basis_pass:actor=True,change=True,bridge=False",2,Y,global,75.0,ai_infrastructure_security,industry:ai_infrastructure,,,산업동향,SELF_AFFILIATE_BUSINESS,AI 산업 동향,국내 대기업의 개방형 AI 도입 가속화,"국내 주요 대기업들의 개방형 AI(ChatGPT) 도입 가속화는 기업 시장에서의 AI 수요 증가와 활용 트렌드를 보여주며, 카카오의 B2B AI 서비스 개발 및 시장 진출 전략 수립에 중요한 인사이트를 제공한다.",1,2,1,,,국내 주요 대기업의 개방형 AI 도입 가속화는 AI 시장의 성장 동향과 카카오 AI 사업의 전략적 기회 요인을 파악하는 데 중요하다.,gemini,STRATEGIC_REFERENCE,OFF_TOPIC,,mixed,카카오 AI agent/AI 서비스 전략과 연결되는 핵심 정책환경,,국내 대기업의 개방형 AI 도입 가속화,AI 산업 동향,,,,
1947,경쟁사/해외이슈,경쟁사_해외이슈,토스,"비스토스 최대주주 씨유메디칼시스템, 비스토스 주식등의 수 634만1399주 감소…총 지분율 34.2%",비스토스 최대주주 씨유메디칼시스템 비스토스 주식등의 수 634만1399주 감소 총 지분율 34 2,디지털투데이,디지털투데이,"Fri, 12 Jun 2026 07:35:02 GMT","비스토스 최대주주 씨유메디칼시스템, 비스토스 주식등의 수 634만1399주 감소…총 지분율 34.2% 디지털투데이",https://news.google.com/rss/articles/CBMic0FVX3lxTE1GR01uM0pyanVOU09lVVkzN0NhWmVQU21ZZlItaUwxYVFPZDNRRTN0Y01RWUlJb2JPdnBnLTNHNnBlRkN1Q0RTQkh0YjBSVHlWNUJNVDNWSy10Q3RBR2VJX3ltRmpCWXZxX0FLWkZEZ1FHd28?oc=5,google_rss_토스 when:2d,67.5,29.0,strategy_mna_governance,strategy_mna_governance,토스,,,,,,,general,14.0,published_yesterday,direct_risk,global_incident:mna_capital:toss:mna_capital,general,Y,"industry_basis_pass:actor=True,change=False,bridge=True",2,Y,toss,67.5,strategy_mna_governance,competitor:strategy_mna,global_incident:mna_capital:toss:mna_capital:general,global_incident:mna_capital:toss:mna_capital,경쟁사_해외이슈,OFF_TOPIC,comp_domestic_finance_commerce,global_incident:mna_capital:toss:mna_capital,카카오가 경쟁사 전략·리스크·AI/플랫폼 대응을 비교 참고할 이슈,4,4,5,,Y,"'토스'와 무관한 비스토스 및 씨유메디칼시스템의 주식 변동 소식으로, 카카오 대외협력팀에 필요한 영향 경로가 없음.",gemini,,,OFF_TOPIC,other,,카카오가 경쟁사 전략·리스크·AI/플랫폼 대응을 비교 참고할 이슈,global_incident:mna_capital:toss:mna_capital,comp_domestic_finance_commerce,,,,
2682,산업동향,산업동향,플랫폼 시장점유율,"[미르의 글로벌 레이더]미래에셋, 인도 자산관리 플랫폼 ‘넥스엣지’ 2500만 달러 투자유치 주도",미르의 글로벌 레이더 미래에셋 인도 자산관리 플랫폼 넥스엣지 2500만 달러 투자유치 주도,미디어펜,미디어펜,"Fri, 12 Jun 2026 00:22:24 GMT","[미르의 글로벌 레이더]미래에셋, 인도 자산관리 플랫폼 ‘넥스엣지’ 2500만 달러 투자유치 주도 미디어펜",https://news.google.com/rss/articles/CBMiVEFVX3lxTE5hYjlfVHN6QUZueWt3VWFVZkcxUWFDMl9oNVJvYWNES0l5RVB0RUcydHRpZUxHa3RFdWppWk5xWFlZU3RNWG53cjE3clpIM2NibkUyRdIBWEFVX3lxTE1aaGNHeGExSlVkT21TX3F5RkpvcDdJTm82VGNUSE5Fa3gyY1I4UVZJd2VxUHBkVTZIaVVBN0IwQXJpbXM1Q2N5X25NbHZXdnYzZ3FRQ1hHbWs?oc=5,google_rss_플랫폼 시장점유율 when:2d,64.5,16.0,"market_power_platform,strategy_mna_governance",market_power_platform,,"v27_industry_without_two_of_three_basis:generic_platform_without_digital_business_context:actor=False,change=True,bridge=False",,,,,,general,14.0,published_yesterday,general,global_incident:platform_regulation:platform_sector:platform_regulation,general,,"generic_platform_without_digital_business_context:actor=False,change=True,bridge=False",1,Y,global,64.5,"market_power_platform,strategy_mna_governance",industry:general,global_incident:platform_regulation:platform_sector:platform_regulation:general,global_incident:platform_regulation:platform_sector:platform_regulation,산업동향,SELF_AFFILIATE_BUSINESS,글로벌 시장 동향,해외 자산관리 플랫폼 투자 동향,"미래에셋의 인도 자산관리 플랫폼 투자는 글로벌 플랫폼 시장의 성장 잠재력과 투자 동향을 보여주며, 카카오가 해외 금융 서비스 확장 전략을 모색할 때 참고할 수 있는 간접적인 시장 신호이다.",3,3,3,,Y,"미래에셋의 인도 자산관리 플랫폼 투자는 카카오의 해외 금융 서비스 전략 수립에 간접적으로 참고할 수 있는 시장 동향이다. / v23_guardrail_fail:v27_industry_without_two_of_three_basis:generic_platform_without_digital_business_context:actor=False,change=True,bridge=False",gemini,FILLER_REFERENCE,,,other,,,해외 자산관리 플랫폼 투자 동향,글로벌 시장 동향,,,,
325,정부/국회,정부_국회,과학기술정보통신부,"3,750만명 개인정보 유출 ‘쿠팡’…총 6,247억원 과징금 ‘철퇴’",3 750만명 개인정보 유출 쿠팡 총 6 247억원 과징금 철퇴,IT비즈뉴스,IT비즈뉴스,"Thu, 11 Jun 2026 23:00:00 GMT","3,750만명 개인정보 유출 ‘쿠팡’…총 6,247억원 과징금 ‘철퇴’ IT비즈뉴스",https://news.google.com/rss/articles/CBMibEFVX3lxTE10UG8xRHFlYk01R2ZzN0NJVEt1TkF1a1V1NFZSRDJpd1o0dHBkZERiSm1JYnZsZlVJbXBTMUV2Q2dmbEdhOS1RVzVSaDgtRVk0YXhXaUkxS2V2RVd0X3RZVmdFTi11bkxycnlRWg?oc=5,google_rss_과학기술정보통신부 과징금 when:2d,62.6,56.0,"antitrust_platform,legal_regulatory_enforcement,phishing_security,privacy_security_reliability",antitrust_general,쿠팡,v26_2_government_without_central_public_actor_action:no_public_actor_action_domain,Y,,,,government:platform_obligation,platform_operator_obligation,14.0,published_yesterday,official_action,v27:platform_enforcement:coupang:privacy_data_violation,penalty_or_sanction,Y,"industry_basis_pass:actor=True,change=False,bridge=True",2,Y,coupang,62.6,"legal_regulatory_enforcement,privacy_security_reliability",government:platform_obligation,global_incident:platform_enforcement:coupang:privacy_data_violation:sanction_penalty,global_incident:platform_enforcement:coupang:privacy_data_violation,정부_국회,GOV_PLATFORM_REGULATION,플랫폼 규제,쿠팡 역대 최대 과징금 (개인정보 유출),국내 주요 플랫폼 경쟁사의 막대한 과징금 부과는 유사 플랫폼 사업자에 대한 규제 강화 및 적용 가능성에 대한 선제적 모니터링 필요성을 시사한다.,1,1,1,,Y,쿠팡 개인정보 유출 과징금은 국내 플랫폼 사업자 개인정보보호 의무 및 규제 환경을 이해하는 데 중요하다. / v23_guardrail_fail:v26_2_government_without_central_public_actor_action:no_public_actor_action_domain,gemini,,GOV_REGULATORY_ENFORCEMENT,COMP_DOMESTIC_DIRECT_RISK,domestic,"공정거래위원회의 대규모 과징금 부과와 이에 대한 쿠팡의 법적 대응은 플랫폼 사업자에 대한 규제 집행 기조를 확인하고, 카카오의 공정거래 관련 정책 대응 및 법적 리스크 관리를 강화하는 데 중요한 자료가 된다.",카카오 플랫폼·AI·대관 대응 경로에 영향을 줄 수 있는 정책/감독 이슈,쿠팡 역대 최대 과징금 (개인정보 유출),플랫폼 규제,platform_enforcement:coupang:privacy_data_violation,weak_gov_basis:no_public_actor_action_domain,,
1789,경쟁사/해외이슈,경쟁사_해외이슈,LGU+,"전기통신사업자, 이용자 보호 수준 하향…LGU+ '매우우수'",전기통신사업자 이용자 보호 수준 하향 lgu+ 매우우수,네이트,네이트,"Fri, 12 Jun 2026 07:12:00 GMT","전기통신사업자, 이용자 보호 수준 하향…LGU+ '매우우수' 네이트",https://news.google.com/rss/articles/CBMiU0FVX3lxTE1TMlkwLUw5LWFJS1JNLVUwZ3JtVDBtWVhVX3RVZVhZcXhUTW9KZDNVUEpfc0tITDNZZVQwQU9vc0tIdXBGLVk0ZWt5NkdMQ21RTjZJ?oc=5,google_rss_LGU+ when:2d,57.5,4.0,,,LGU+,,,,,,,general,14.0,published_yesterday,general,global_incident:platform_regulation:lguplus:platform_regulation,general,Y,"industry_basis_pass:actor=True,change=False,bridge=True",2,Y,telco,57.5,,,global_incident:platform_regulation:lguplus:platform_regulation:general,global_incident:platform_regulation:lguplus:platform_regulation,경쟁사_해외이슈,COMPETITOR_PLATFORM_RISK,통신사 서비스 운영,통신 3사 이용자 보호 평가,국내 주요 통신사업자들의 이용자 보호 업무 평가 결과는 카카오 서비스의 소비자 보호 노력 및 대외 커뮤니케이션 방향 수립에 간접적인 참고 자료가 될 수 있습니다.,2,2,2,,,국내 주요 통신사업자의 이용자 보호 평가 결과는 카카오의 서비스 운영 및 소비자 보호 정책 수립에 간접적인 참고 자료가 될 수 있습니다.,gemini,,,COMP_DOMESTIC_STRATEGY,domestic,,통신 3사의 이용자 보호 수준 평가는 플랫폼 사업자로서 카카오의 고객 서비스 및 규제 대응 전략에 대한 간접적 시사점을 제공합니다.,통신 3사 이용자 보호 평가,통신사 서비스 운영,,,,
1687,경쟁사/해외이슈,경쟁사_해외이슈,SKT,"LG유플러스, 이용자 보호업무 ‘매우 우수’…SKT·KT는 ‘우수’ 등급",lg유플러스 이용자 보호업무 매우 우수 skt kt는 우수 등급,뉴스락,뉴스락,"Fri, 12 Jun 2026 06:41:55 GMT","LG유플러스, 이용자 보호업무 ‘매우 우수’…SKT·KT는 ‘우수’ 등급 뉴스락",https://news.google.com/rss/articles/CBMibEFVX3lxTE9vY1Vhb2U4cGIwY09KcldGdllzcUlrZEl2aGttUUthVHdSOWZHbG5zVFhpV0tkTHJpN2hRV2xIU09nTVdwX19vUm9aOHlOVFRmOF9sWTczaENtWTJtMHpVd3k3TWlEUWx3aFEzUA?oc=5,google_rss_SKT when:2d,57.5,4.0,,,"LGU+,SKT",,,,,,,general,14.0,published_yesterday,general,global_incident:platform_regulation:skt:platform_regulation,general,Y,"industry_basis_pass:actor=True,change=False,bridge=True",2,Y,telco,57.5,,,global_incident:platform_regulation:skt:platform_regulation:general,global_incident:platform_regulation:skt:platform_regulation,경쟁사_해외이슈,COMPETITOR_PLATFORM_RISK,통신사 서비스 운영,통신 3사 이용자 보호 평가,국내 주요 통신사업자들의 이용자 보호 업무 평가 결과는 카카오 서비스의 소비자 보호 노력 및 대외 커뮤니케이션 방향 수립에 간접적인 참고 자료가 될 수 있습니다.,2,2,2,,,국내 주요 통신사업자의 이용자 보호 평가 결과는 카카오의 서비스 운영 및 소비자 보호 정책 수립에 간접적인 참고 자료가 될 수 있습니다.,gemini,,,COMP_DOMESTIC_STRATEGY,domestic,,통신 3사의 이용자 보호 수준 평가는 플랫폼 사업자로서 카카오의 고객 서비스 및 규제 대응 전략에 대한 간접적 시사점을 제공합니다.,통신 3사 이용자 보호 평가,통신사 서비스 운영,,,,
341,정부/국회,정부_국회,과학기술정보통신부,"[이로운체크] 1300만명 정보 털린 티빙, 6247억원 과징금 맞은 쿠팡…반복되는 개인정보 재난 유출 재난",이로운체크 1300만명 정보 털린 티빙 6247억원 과징금 맞은 쿠팡 반복되는 개인정보 재난 유출 재난,이로운넷,이로운넷,"Fri, 12 Jun 2026 06:16:20 GMT","[이로운체크] 1300만명 정보 털린 티빙, 6247억원 과징금 맞은 쿠팡…반복되는 개인정보 재난 유출 재난 이로운넷",https://news.google.com/rss/articles/CBMiZkFVX3lxTE1ITHI5a3ptUTFWRmFOM0dMRFN4TEkyUi1Sb2ViT0pnbHZKSFFYZjhwMEdRbVNXWWYzcDdTd0o5TVozekpBNHpzdVdXaktEdXNobzlqdHB0VWVPZXNqMGItNUhfZFhiUQ?oc=5,google_rss_과학기술정보통신부 해킹 when:2d,56.6,42.0,"antitrust_platform,legal_regulatory_enforcement",antitrust_general,쿠팡,v26_2_government_without_central_public_actor_action:no_public_actor_action_domain,Y,,,,government:platform_obligation,platform_operator_obligation,14.0,published_yesterday,official_action,v27:platform_enforcement:coupang:privacy_data_violation,penalty_or_sanction,Y,"industry_basis_pass:actor=True,change=False,bridge=True",2,Y,coupang,56.6,legal_regulatory_enforcement,government:platform_obligation,global_incident:platform_enforcement:coupang:privacy_data_violation:sanction_penalty,global_incident:platform_enforcement:coupang:privacy_data_violation,정부_국회,COMPETITOR_PLATFORM_RISK,플랫폼 규제/제재,쿠팡/티빙 개인정보 유출 및 공정위 제재,"쿠팡과 티빙에 대한 대규모 과징금 및 개인정보 유출 제재는 카카오를 포함한 국내 플랫폼 사업자들의 개인정보 보호 및 공정거래 준수 의무에 대한 정부의 강력한 의지를 보여주며, 향후 카카오의 서비스 운영 및 정책 수립에 직접적인 영향을 미칠 수 있습니다.",1,1,1,,Y,"국내 주요 플랫폼 사업자(쿠팡, 티빙)에 대한 대규모 개인정보 유출 및 공정거래 위반 제재는 카카오의 개인정보 보호 및 공정거래 리스크 관리와 정책 대응에 중요한 참고 사례입니다. / v23_guardrail_fail:v26_2_government_without_central_public_actor_action:no_public_actor_action_domain",gemini,,GOV_REGULATORY_ENFORCEMENT,COMP_DOMESTIC_DIRECT_RISK,domestic,플랫폼 사업자 개인정보 보호 및 공정거래 위반에 대한 규제 강화 및 집행 엄정화 추세가 명확해지고 있습니다. 카카오도 관련 법규 준수 및 리스크 관리를 더욱 강화해야 합니다.,"국내 대형 플랫폼 사업자에 대한 규제 강화는 시장 전반의 규제 환경 변화를 시사하며, 카카오 역시 유사 리스크에 대한 선제적 대응 및 내부 시스템 점검 필요성을 제고합니다.",쿠팡/티빙 개인정보 유출 및 공정위 제재,플랫폼 규제/제재,platform_enforcement:coupang:privacy_data_violation,weak_gov_basis:no_public_actor_action_domain,,
1977,경쟁사/해외이슈,경쟁사_해외이슈,토스,"'보안이 최고의 경쟁력'...토스페이먼츠, 정보보호 투자 20% 늘리고 전담 인력도 대거 확충",보안이 최고의 경쟁력 토스페이먼츠 정보보호 투자 20 늘리고 전담 인력도 대거 확충,소비자가 만드는 신문,소비자가 만드는 신문,"Thu, 11 Jun 2026 21:10:00 GMT","'보안이 최고의 경쟁력'...토스페이먼츠, 정보보호 투자 20% 늘리고 전담 인력도 대거 확충 소비자가 만드는 신문",https://news.google.com/rss/articles/CBMic0FVX3lxTE5ZQW9xMldMR3c1MzJGUWY2QzFPcktXQ1gwd2ZYX0ZaOTB0VTVHSURDOGxaMTdMVVFvMzg0VFl2VFBaMUFaQmtSVGtOeE5ocWxPZVdiQ3FJblVYMWVuYi1wMzdhNnVWUm5xSExnWWJQNjdjZGM?oc=5,google_rss_토스 해킹 when:2d,56.5,18.0,"phishing_security,privacy_security_reliability",security_general,토스,,,,,,,general,14.0,published_yesterday,direct_risk,event:토스:phishing_security+privacy_security_reliability,general,Y,"industry_basis_pass:actor=True,change=True,bridge=True",3,Y,toss,56.5,privacy_security_reliability,competitor:security_reliability,,,경쟁사_해외이슈,COMPETITOR_PLATFORM_RISK,핀테크/결제 서비스 전략,토스페이먼츠 정보보호 강화,"토스페이먼츠의 정보보호 투자 확대는 핀테크 서비스 경쟁에서 보안의 중요성을 강조하며, 카카오페이의 보안 강화 전략 및 투자 방향 수립에 참고가 될 수 있습니다.",2,2,2,,,카카오페이의 경쟁사인 토스페이먼츠의 정보보호 투자 확대는 금융 플랫폼 시장의 주요 경쟁 동향입니다.,gemini,,,COMP_DOMESTIC_FINANCE_COMMERCE,domestic,,주요 핀테크 경쟁사의 정보보호 강화는 카카오페이의 보안 경쟁력 유지 및 발전을 위한 지속적인 투자의 필요성을 시사합니다.,토스페이먼츠 정보보호 강화,핀테크/결제 서비스 전략,,,,
1342,정부/국회,정부_국회,플랫폼 규제,쿠팡 과징금 쇼크…플랫폼업계 개인정보 관리 '비상',쿠팡 과징금 쇼크 플랫폼업계 개인정보 관리 비상,v.daum.net,v.daum.net,"Fri, 12 Jun 2026 06:01:02 GMT",쿠팡 과징금 쇼크…플랫폼업계 개인정보 관리 '비상' v.daum.net,https://news.google.com/rss/articles/CBMiRkFVX3lxTE5JMDE4eXhCeGJHSzBSM3I3WnVIdFJqZUF6YmZ2aWZkSXZOSGp2YnVZQnZfbmh4M25iMVdNMmNmTlhTT2ZxNHc?oc=5,google_rss_플랫폼 규제 when:2d,49.0,46.0,"antitrust_platform,legal_regulatory_enforcement,market_power_platform",antitrust_general,쿠팡,v26_2_government_without_central_public_actor_action:no_public_actor_action_domain,Y,,,,government:platform_obligation,platform_operator_obligation,14.0,published_yesterday,official_action,v27:platform_enforcement:coupang:privacy_data_violation,penalty_or_sanction,Y,"industry_basis_pass:actor=True,change=False,bridge=True",2,Y,coupang,49.0,"legal_regulatory_enforcement,policy_legislation,market_power_platform",government:platform_obligation,global_incident:platform_enforcement:coupang:privacy_data_violation:sanction_penalty,global_incident:platform_enforcement:coupang:privacy_data_violation,정부_국회,SELF_INCLUDED_REGULATION,플랫폼 규제/제재,쿠팡/티빙 개인정보 유출 및 공정위 제재,"쿠팡과 티빙에 대한 대규모 과징금 및 개인정보 유출 제재는 카카오를 포함한 국내 플랫폼 사업자들의 개인정보 보호 및 공정거래 준수 의무에 대한 정부의 강력한 의지를 보여주며, 향후 카카오의 서비스 운영 및 정책 수립에 직접적인 영향을 미칠 수 있습니다.",1,1,1,,Y,"국내 주요 플랫폼 사업자(쿠팡, 티빙)에 대한 대규모 개인정보 유출 및 공정거래 위반 제재는 카카오의 개인정보 보호 및 공정거래 리스크 관리와 정책 대응에 중요한 참고 사례입니다. / v23_guardrail_fail:v26_2_government_without_central_public_actor_action:no_public_actor_action_domain",gemini,DIRECT_RISK,GOV_REGULATORY_ENFORCEMENT,COMP_DOMESTIC_DIRECT_RISK,domestic,플랫폼 사업자 개인정보 보호 및 공정거래 위반에 대한 규제 강화 및 집행 엄정화 추세가 명확해지고 있습니다. 카카오도 관련 법규 준수 및 리스크 관리를 더욱 강화해야 합니다.,"국내 대형 플랫폼 사업자에 대한 규제 강화는 시장 전반의 규제 환경 변화를 시사하며, 카카오 역시 유사 리스크에 대한 선제적 대응 및 내부 시스템 점검 필요성을 제고합니다.",쿠팡/티빙 개인정보 유출 및 공정위 제재,플랫폼 규제/제재,platform_enforcement:coupang:privacy_data_violation,weak_gov_basis:no_public_actor_action_domain,,
