카테고리,카테고리명,검색어,기사제목,언론사,정규언론사,게시일,RSS게시일,RSS요약,본문전문,본문글자수,본문추출방식,본문품질점수,본문품질사유,중요도점수,본문사용가능,본문정제적용,원래RSS링크,링크,랭킹점수,사건태그,사건단계,원문날짜,원문날짜출처,날짜검증결과,날짜후보수,대표선택점수,개인정보보안사건키,개인정보보안대표보너스,전역사건키,전역사건기본키,전역사건대표보너스,이슈패밀리,정책규제의무,자사홍보성,링크상태,링크검증사유,본문정합성,v20_issue_id,v20_issue_group,v20_issue_family,v20_internal_category,v20_issue_score,v21_self_tier,v21_gov_tier,v21_competitor_tier,v21_competitor_scope,Gemini카테고리,Gemini내부카테고리,Gemini이슈유형,Gemini이슈그룹,Gemini중복그룹,Gemini관련성,Gemini중요도,Gemini대외협력중요도,Gemini관련도,Gemini판단사유,Gemini선정사유,선정단계,수집검색어,수집원카테고리,수집JSON카테고리,Gemini판단카테고리,최종카테고리,최종카테고리명,선정순서,본문상태,최종카테고리검증결과,v24대표기사정합성,v36_category_repair,v26최종수리결과,v26기사유형,v26오늘성점수,v26이벤트키,v26최종우선점수,v29_event_base,v29_event_stage,v29_stage_event_key,v26_2_final_priority,v27_final_priority,v28_final_priority,v29_final_guardrail,v29_bodyless_policy,v29_final_priority,v31_final_cleanup,v31_final_priority,브리핑ID,v25한국정부국회근거,v24중복대표선택,v28_competitor_guardrail,v26_1_refill_source,최종카테고리재배치,v26_2_industry_pivot,v38_portfolio_added_stage
자사_및_계열사_이슈,자사 및 계열사 이슈,카카오,[단독]창사 첫 파업 속 카카오 조직개편…비즈니스 전현수·톡부문 공석 - 머니투데이,머니투데이,머니투데이,"Fri, 12 Jun 2026 03:03:36 GMT","Fri, 12 Jun 2026 03:03:36 GMT",[단독]창사 첫 파업 속 카카오 조직개편…비즈니스 전현수·톡부문 공석 - 머니투데이 머니투데이,"카카오 (41,500원 ▲2,200 +5.6%) 가 조직 개편을 단행했다. 창사 이래 첫 파업에 나서는 등 노사 갈등이 최고조에 달한 상황에서 정신아 대표가 '조직 효율화'에 방점을 찍고 승부수를 던진 것으로 풀이된다. 12일 정보기술(IT)업계에 따르면 카카오는 이날 카카오 서비스의 중추 역할을 해온 '프로덕트 조직'에 대한 '조직개편 및 인사이동' 공지를 했다. '국민 메신저' 카카오톡 등 서비스 전반을 총괄해온 핵심 임원인 홍민택 최고프로덕트책임자(CPO)의 사의 표명에 따라, 관련 조직을 정신아 대표 밑으로 옮기는 게 골자다. 이번 개편으로 기존 프로덕트 조직은 카카오톡과 비즈니스 두개의 축으로 분리된다. 국민 메신저로서의 본질 기능을 다루는 서비스와 수익화를 담당하는 비즈니스 부문을 명확히 나눠 각각의 전문성을 극대화한다는 전략이다. 이 외에 정 대표 산하에 디자인 부문을 두고 그동안 여러 부서에 파편화돼 있던 디자인 조직을 하나로 합친다. 조직개편에서 가장 주목받는 인사는 광고와 수익화를 총괄할 비즈니스 부문이다. 광고를 담당하던 전현수 현 카카오 성과리더가 발탁됐다. 전 성과리더는 그동안 카카오의 광고 사업 및 비즈니스 모델 고도화에 성과를 내며 역량을 인정받았다. 비즈니스 조직은 기존 성장 기반을 유지하면서 새로운 서비스들을 사업 성과로 연결하는 역할에 집중할 전망이다. 광고, 커머스, 카카오 비즈니스, 오프라인 사업을 통합해 성장시킬 조직이 추가로 합류해 방향을 만들고 실행해나갈 예정이다. 카카오는 지난해 톡비즈등 플랫폼 광고를 기반으로 연결 기준 매출액을 역대 최대인 8조991억원으로 끌어올렸다. 플랫폼 부문 핵심 동력 중 하나는 카카오톡을 기반으로 한 '톡비즈' 사업이었다. 이 중 톡비즈 광고 매출액은 3734억원으로 전년 동기 대비 16% 성장했다. 비즈니스 메시지 매출이 전년 동기 대비 19% 늘며 견조한 성장세를 이어갔다. 디스플레이 광고도 전년 동기 대비 18%의 매출 증가율을 거뒀다. 무엇보다 카카오가 파업 등 대내외적 리스크에 직면한 가운데 회사의 핵심 캐시카우인 광고 매출을 안정적으로 견인하기 위해 카카오 광고를 총괄해오던 전 성과리더를 그대로 기용한 것으로 보인다. 하나로 통합된 디자인 조직은 김대년 AI서비스디자인 성과리더가 맡게된다. 지난달 초 임원급으로 승진한 데 이어 총괄 디자인 조직의 장을 맡게됐다. 특히 김 성과리더는 이번 조직개편과 함께 새로 발표한 '유저 퍼스트'(User First) 태스크포스(TF)를 같이 담당한다. 지난해 9월 대규모 서비스 개편 이후 이용자 반발이 이어진 카카오톡 서비스를 이용자 관점에서 다시 점검하고, 소통을 강화해 서비스 완성도를 높이겠다는 취지로 만들었다. 다만 카카오톡 서비스와 고도화를 담당하는 톡부문을 이끌 성과리더는 공석으로 남겨뒀다. 카카오톡 조직은 플랫폼과 콘텐츠 사업으로 구성된다. 여기에 김 성과리더가 겸임하는 유저 퍼스트 TF가 포함돼 있다. 이를 통해 현재 제공 중인 기능들을 사용자 중심으로 고도화하고, AI 플랫폼으로 성장하기 위한 기반 기능을 완성해나갈 방침이다. 카카오 (41,500원 ▲2,200 +5.6%) 가 조직 개편을 단행했다. 창사 이래 첫 파업에 나서는 등 노사 갈등이 최고조에 달한 상황에서 정신아 대표가 '조직 효율화'에 방점을 찍고 승부수를 던진 것으로 풀이된다. 12일 정보기술(IT)업계에 따르면 카카오는 이날 카카오 서비스의 중추 역할을 해온 '프로덕트 조직'에 대한 '조직개편 및 인사이동' 공지를 했다. '국민 메신저' 카카오톡 등 서비스 전반을 총괄해온 핵심 임원인 홍민택 최고프로덕트책임자(CPO)의 사의 표명에 따라, 관련 조직을 정신아 대표 밑으로 옮기는 게 골자다. 이번 개편으로 기존 프로덕트 조직은 카카오톡과 비즈니스 두개의 축으로 분리된다. 국민 메신저로서의 본질 기능을 다루는 서비스와 수익화를 담당하는 비즈니스 부문을 명확히 나눠 각각의 전문성을 극대화한다는 전략이다. 이 외에 정 대표 산하에 디자인 부문을 두고 그동안 여러 부서에 파편화돼 있던 디자인 조직을 하나로 합친다. 조직개편에서 가장 주목받는 인사는 광고와 수익화를 총괄할 비즈니스 부문이다. 광고를 담당하던 전현수 현 카카오 성과리더가 발탁됐다. 전 성과리더는 그동안 카카오의 광고 사업 및 비즈니스 모델 고도화에 성과를 내며 역량을 인정받았다. 비즈니스 조직은 기존 성장 기반을 유지하면서 새로운 서비스들을 사업 성과로 연결하는 역할에 집중할 전망이다. 광고, 커머스, 카카오 비즈니스, 오프라인 사업을 통합해 성장시킬 조직이 추가로 합류해 방향을 만들고 실행해나갈 예정이다. 카카오는 지난해 톡비즈등 플랫폼 광고를 기반으로 연결 기준 매출액을 역대 최대인 8조991억원으로 끌어올렸다. 플랫폼 부문 핵심 동력 중 하나는 카카오톡을 기반으로 한 '톡비즈' 사업이었다. 이 중 톡비즈 광고 매출액은 3734억원으로 전년 동기 대비 16% 성장했다. 비즈니스 메시지 매출이 전년 동기 대비 19% 늘며 견조한 성장세를 이어갔다. 디스플레이 광고도 전년 동기 대비 18%의 매출 증가율을 거뒀다. 무엇보다 카카오가 파업 등 대내외적 리스크에 직면한 가운데 회사의 핵심 캐시카우인 광고 매출을 안정적으로 견인하기 위해 카카오 광고를 총괄해오던 전 성과리더를 그대로 기용한 것으로 보인다. 하나로 통합된 디자인 조직은 김대년 AI서비스디자인 성과리더가 맡게된다. 지난달 초 임원급으로 승진한 데 이어 총괄 디자인 조직의 장을 맡게됐다. 특히 김 성과리더는 이번 조직개편과 함께 새로 발표한 '유저 퍼스트'(User First) 태스크포스(TF)를 같이 담당한다. 지난해 9월 대규모 서비스 개편 이후 이용자 반발이 이어진 카카오톡 서비스를 이용자 관점에서 다시 점검하고, 소통을 강화해 서비스 완성도를 높이겠다는 취지로 만들었다. 다만 카카오톡 서비스와 고도화를 담당하는 톡부문을 이끌 성과리더는 공석으로 남겨뒀다. 카카오톡 조직은 플랫폼과 콘텐츠 사업으로 구성된다. 여기에 김 성과리더가 겸임하는 유저 퍼스트 TF가 포함돼 있다. 이를 통해 현재 제공 중인 기능들을 사용자 중심으로 고도화하고, AI 플랫폼으로 성장하기 위한 기반 기능을 완성해나갈 방침이다. 유효송 기자 [email protected] 안녕하세요. 정보미디어과학부 유효송 기자입니다. 안녕하세요. 정보미디어과학부 유효송 기자입니다.",3102,bs4_selector,86.0,good,265.5,True,False,https://news.google.com/rss/articles/CBMiZ0FVX3lxTE1OY2pyenFSNmNkRXl1Tnh1WDkteEQ4SHFiaUlIMVU4VF9vaXkzNzNpTWJpdXpndm9EYXh6U3lLUXM0WGp5MllMZ05YaHBlSHJhQXlOc2hwYVdWWjBSVzRaUUI2ODdBa0XSAWxBVV95cUxPdDdERnhGWGdRSmxOOVFnNTJNbkxCODN6X3VRemJYTGhKRGp3bmxCcW5BSTlhdFQtUU5HSGdmZlNYTFM3WU4wOUNnM3prMjhmZmRHNllhTXlYZkNSSXVwWEJpak1Kd25nNjlzTWQ?oc=5,https://www.mt.co.kr/tech/2026/06/12/2026061210494253199,122.3,"ai_infrastructure_security,earnings,financial_performance,labor_dispute,labor_negotiation,leadership_change,market_power_platform,platform_obligation,policy_legislation,search_ads,service_reform_backlash",labor_general,2026-06-12,url_date,original_date_recent,6,323.25,,7.0,global_incident:platform_regulation:kakao:platform_content_moderation_obligation:executive_or_org_change,global_incident:platform_regulation:kakao:platform_content_moderation_obligation,24.0,self:platform_obligation,Y,,ok,http_200,body_valid,I024,카카오 노조 임단협/파업 및 내부 갈등,self_labor,SELF_DIRECT_RISK,392.55,DIRECT_RISK,,COMP_DOMESTIC_STRATEGY,other,자사_및_계열사_이슈,SELF_DIRECT_RISK,self_labor,카카오 노조 임단협/파업 및 내부 갈등,카카오 노조 임단협/파업 및 내부 갈등,카카오 또는 계열사에 직접 발생한 외부 대응 필요 이슈,5,5,5,로컬 보조 라벨 / v26: 오늘 새 직접 사건·진전,로컬 보조 라벨 / v26: 오늘 새 직접 사건·진전,issue_selected,카카오,,,자사_및_계열사_이슈,자사_및_계열사_이슈,자사 및 계열사 이슈,1001,본문추출성공,pass:self_guardrail_pass,pass:representative_aligned,v38_process_category_lock:자사_및_계열사_이슈,pass:self_guardrail_pass,analysis_with_direct_risk,19.0,global_incident:platform_regulation:kakao:platform_content_moderation_obligation,657.81,v31_competitor_action:competitor_role:ad_consumer_platform,action_executed,v31_competitor_action:competitor_role:ad_consumer_platform:action_executed,657.81,657.81,657.81,pass:self_material_pass,has_body,794.81,pass:self_material_pass,794.81,1,,,,,,,
자사_및_계열사_이슈,자사 및 계열사 이슈,카카오,티빙 개인정보 탈탈 털렸는데...카카오·네이버 연동 회원들 괜찮나요?,뉴스워커,뉴스워커,"Fri, 12 Jun 2026 18:07:01 GMT","Fri, 12 Jun 2026 18:07:01 GMT",티빙 개인정보 탈탈 털렸는데...카카오·네이버 연동 회원들 괜찮나요? 뉴스워커,"티빙 개인정보 탈탈 털렸는데...카카오·네이버 연동 회원들 괜찮나요? 동일 계정 여러 개 사용하는 회원도 많아 티빙에서 대규모 개인정보 유출 사고가 발생한 가운데 카카오와 네이버 등 간편 로그인을 이용하는 회원들 사이에서도 불안감이 확산됐다. 다양한 플랫폼에서 동일한 간편 로그인 서비스를 사용하는 이용자가 많아 추가 피해 가능성을 우려하는 목소리가 크다. 특히 티빙 회원 가운데 상당수가 CJ ONE과 카카오, 네이버, 페이스북, X 등 외부 계정을 연동하는 만큼 피해가 다른 플랫폼 계정까지 번지는 것 아니냐는 우려도 제기됐다. 티빙은 이달 3일 신원 미상의 해커가 데이터베이스(DB)에 침입해 이용자 개인정보를 유출했다고 공지했다. 회사에 따르면 유출된 정보는 아이디, 이름, 생년월일, 성별, CI(연계정보), DI(중복가입확인정보), 휴대전화 번호 일부, 이메일 일부, 환불 계좌번호, 비밀번호 등이다. 구체적인 피해 규모는 아직 공개되지 않았지만 티빙 유·무료 회원 전체인 약 1300만명이 영향권에 포함될 가능성이 거론됐다. 더 큰 문제는 티빙 이용자 상당수가 자체 회원가입이 아닌 CJ ONE, 네이버, 카카오, 페이스북, X 등 간편 로그인을 통한다는 점이다. 이들 가운데 상당수는 동일한 계정을 여러 온라인 서비스에서 활용해 온라인 커뮤니티를 중심으로 우려가 확산됐다. 실제로 개인정보 관련 사고가 터질 때마다 유출된 정보를 악용한 스미싱이나 피싱 시도가 뒤따르는 경우가 적지 않다. 특히 이름과 연락처, 이메일 등 정보가 함께 유출될 경우 이용자를 속이는 데 악용될 가능성이 있다는 지적이다. 이에 따라 일부 이용자들은 카카오와 네이버 등 연동 계정의 비밀번호를 변경하거나 보안 설정을 점검해야 하는 것 아니냐는 반응을 보였다. 다만 전문가들은 카카오나 네이버의 로그인 인증 정보는 각 플랫폼 사업자가 별도로 관리하는 만큼 티빙에서 유출된 정보만으로 다른 플랫폼 계정이 즉시 탈취되는 것은 아니라고 설명했다. 간편 로그인 이용자의 경우에도 카카오나 네이버 서버 자체가 해킹된 것은 아니라는 의미다. 한편 티빙은 사고 이후 추가 피해 방지를 위해 CJ ONE 계정에 대한 잠금 조치에 나섰다. 이용자는 본인인증 후 비밀번호를 변경하면 서비스를 다시 이용할 수 있다. 업계는 이번 사고로 티빙이 적지 않은 후폭풍에 직면할 것으로 봤다. 최근 개인정보보호위원회가 개인정보 유출 사고와 관련해 쿠팡에 6200억원대, SK텔레콤에 1300억원대 과징금을 부과한 만큼 향후 조사 결과에 따라 티빙 역시 보상과 행정 제재 부담을 안을 가능성이 제기됐다.",1265,trafilatura,80.0,good,236.0,True,False,https://news.google.com/rss/articles/CBMic0FVX3lxTE9Pc20yVEgzTmRoQVUzQzF5OGVRLTJGMEplNHFjWFkxblg4VkY1X0p6ZU5EbGtaM1dkRFZqWTFrQWZEZjd4TU9ta1pfNTU0S3JYT0FkT0dMMFpuamFlSkNqeHhEem10eGF5RVZ4bGMyVVhSM1XSAXNBVV95cUxPT3NtMlRIM05kaEFVM0MxeThlUS0yRjBKZTRxY1hZMW5YOFZGNV9KemVORGxrWjNXZERWalkxa0FmRGY3eE1PbWtaXzU1NEtyWE9BZE9HTDBabmphZUpDanh4RHptdHhheUVWeGxjMlVYUjNV?oc=5,http://www.newsworker.co.kr/news/articleViewAmp.html?idxno=431097,85.8,"antitrust_platform,legal_regulatory_enforcement,market_power_platform,phishing_security,platform_obligation,policy_legislation,privacy_security_reliability",antitrust_general,2026-06-12,json_ld:datePublished,original_date_recent,2,279.2,privacy_security:tving:data_leak:sanction_or_penalty,23.0,global_incident:platform_enforcement:coupang:deceptive_membership_price_ad:sanction_penalty,global_incident:platform_enforcement:coupang:deceptive_membership_price_ad,56.0,self:platform_obligation,Y,,ok,http_200,body_valid,I017,global_incident:platform_regulation:kakao:platform_regulation,self_privacy_security,SELF_AFFILIATE_BUSINESS,433.3,DIRECT_RISK,,COMP_DOMESTIC_DIRECT_RISK,domestic,자사_및_계열사_이슈,SELF_DIRECT_RISK,self_privacy_security,global_incident:platform_regulation:kakao:platform_regulation,global_incident:platform_regulation:kakao:platform_regulation,카카오 또는 계열사에 직접 발생한 외부 대응 필요 이슈,5,5,5,로컬 보조 라벨 / v26: 오늘 새 직접 사건·진전,로컬 보조 라벨 / v26: 오늘 새 직접 사건·진전 / 로컬 보조 라벨,issue_selected,카카오,,,자사_및_계열사_이슈,자사_및_계열사_이슈,자사 및 계열사 이슈,1002,본문추출성공,pass:self_guardrail_pass,pass:representative_aligned,v38_process_category_lock:자사_및_계열사_이슈,pass:self_guardrail_pass,official_action,24.0,v27:platform_enforcement:coupang:deceptive_membership_price_ad,472.8,v32_competitor:coupang:privacy_data_penalty,background_context,v32_competitor:coupang:privacy_data_penalty:background_context,472.8,472.8,472.8,pass:self_material_pass,has_body,542.8,pass:self_material_pass,542.8,2,,,,,,,
정부_국회,정부/국회,과학기술정보통신부,"[조선시대 문헌부터 사투리까지… AI 성능 평가도 'K-스타일'로 바뀐다] 과기정통부·NIA, 연내 한국형 AI 독자 벤치마크 구축… 번역식 평가 벗어나 문맥·추론 능력 정밀 검증",AI넷,AI넷,"Fri, 12 Jun 2026 09:46:42 GMT","Fri, 12 Jun 2026 09:46:42 GMT","[조선시대 문헌부터 사투리까지… AI 성능 평가도 'K-스타일'로 바뀐다] 과기정통부·NIA, 연내 한국형 AI 독자 벤치마크 구축… 번역식 평가 벗어나 문맥·추론 능력 정밀 검증 AI넷","시작페이지로 l 즐겨찾기 l RSS l 편집 2026.06.12 [13:27] 조선시대 문헌부터 사투리까지… AI 성능 평가도 'K-스타일'로 바뀐다 한국 고유의 언어적·문화적 특성을 반영해 인공지능(AI)의 한국어 문맥 이해 능력을 정밀하게 측정할 수 있는 새로운 공공 평가 체계가 구축된다. 글로벌 벤치마크를 단순히 번역해 차용하거나 오래된 기준을 재조합하던 기존 방식에서 벗어나, 고어와 방언까지 아우르는 고도화된 검증 기준이 마련될 전망이다. 이는 최근 실제 업무를 보조하는 AI 에이전트 도입이 확산하면서, AI의 단순한 범용 능력보다는 실제 환경에서의 실용성과 문제해결력이 더 중요해졌기 때문이다. 과학기술정보통신부와 한국지능정보사회진흥원(NIA)은 이러한 변화에 발맞춰 국내 맞춤형 AI 모델 벤치마크 데이터셋 구축 사업을 추진하고 있으며, 최근 개발 사업자 선정을 마치고 검증 과정을 거쳐 올해 안에 프로젝트를 완료할 계획이다. 그동안 국내 AI 성능 평가에 사용된 벤치마크는 해외 유명 데이터셋을 한국어로 번역하거나 상황에 맞게 짜깁기하는 수준에 그쳐, 법률이나 의료 등 전문 분야는 물론 AI의 안전성을 독자적으로 검증할 체계가 턱없이 부족했다. NIA 측은 기존의 글로벌 평가 방식이 한국의 언어·문화·사회적 맥락을 충분히 반영하지 못한다는 한계를 지적하며, 이번 사업을 통해 신뢰할 수 있는 성능 지표를 제공하고 한국형 AI 도입과 생태계 확산을 이끌겠다고 밝혔다. 이에 따라 새롭게 개발되는 독자 벤치마크 데이터셋에는 한국어의 복합적인 의미를 정확히 해석할 수 있도록 중세·근대 고어와 지역별 사투리, 최신 신조어까지 폭넓게 포함된다. 단순히 문법을 아는 수준을 넘어 조선시대 문헌이나 사투리 속에 담긴 맥락까지 파악하는 고도의 추론 능력을 검증하겠다는 취지다. 이처럼 새로운 평가 기준이 시급해진 이유는 전 세계적으로 AI 성능 평가의 패러다임이 바뀌고 있어서이다. 실제로 해외에서는 언어 이해와 지식 활용 등을 폭넓게 측정하던 기존의 범용 벤치마크인 ‘MMLU-프로’ 등이 변별력을 잃었다는 지적이 나오고 있다. 글로벌 AI 전문 평가기관인 아티피셜 애널리시스 역시 올해 평가 체계를 전면 개편하면서 단순 정답률 중심의 MMLU-프로를 제외했는데, 이는 AI가 경제적 가치를 창출하는 실제 업무를 얼마나 잘 수행하는지가 새로운 기준이 되었기 때문이다. 이에 따라 업계에서는 AI 에이전트의 문제해결력을 보는 ‘에이전트벤치’, 환각 현상을 검증하는 ‘트루스풀QA’, 사용자 지시 이행도를 측정하는 ‘IFEval’ 등 실제 환경에서의 유용성을 평가하는 목적 지향형 벤치마크가 대세로 자리 잡고 있으며, 한국 정부의 이번 움직임 역시 이러한 글로벌 흐름에 맞춰 한국형 AI의 글로벌 경쟁력을 다지기 위한 포석으로 풀이된다.(박소연기자+AI) 회원약관 ㅣ 개인정보취급방침 ㅣ 회사소개 ㅣ 청소년보호정책 ㅣ 직원게시판 ㅣ 기사제보 ㅣ 보도자료 ㅣ 기사검색",1440,bs4_selector,86.0,good,145.5,True,False,https://news.google.com/rss/articles/CBMiQEFVX3lxTE0yNHQtOXBHV2k4elpmYTN6blMwNmNpbW1BUnRBb1FaMFBLMXRfbnA0WEJ5R0pBRVVhLWJ6UnlXYlY?oc=5,http://www.ainet.link/27147,99.6,"ai_agent,ai_infrastructure_security,deepfake_youth,platform_obligation,policy_legislation,search_ads",ai_infrastructure_security,2026-06-13,json_ld:datePublished,original_date_recent,6,219.25,,61.0,global_incident:platform_regulation:science_ict_ministry:platform_content_moderation_obligation:announcement,global_incident:platform_regulation:science_ict_ministry:platform_content_moderation_obligation,32.0,government:platform_obligation,Y,,ok,http_200,body_valid,I053,government_ai_core_policy:조선시대 문헌부터 사투리까지 ai 성능 평가도 k 스타일 로 바뀐다 과기정통부 nia 연내 한국형 ai 독자,government_ai_core_policy,GOV_AI_DIGITAL_POLICY,339.5,,GOV_AI_CORE_POLICY,,other,정부_국회,GOV_AI_DIGITAL_POLICY,government_ai_core_policy,government_ai_core_policy:조선시대 문헌부터 사투리까지 ai 성능 평가도 k 스타일 로 바뀐다 과기정통부 nia 연내 한국형 ai 독자,government_ai_core_policy:조선시대 문헌부터 사투리까지 ai 성능 평가도 k 스타일 로 바뀐다 과기정통부 nia 연내 한국형 ai 독자,카카오 AI agent/AI 서비스 전략과 연결되는 핵심 정책환경,5,4,5,로컬 보조 라벨 / v34_domestic_government_policy_forced_to_gov / v34_domestic_government_policy_forced_to_gov,로컬 보조 라벨 / v34_domestic_government_policy_forced_to_gov / v34_domestic_government_policy_forced_to_gov,issue_selected,과학기술정보통신부,,,정부_국회,정부_국회,정부/국회,2001,본문추출성공,pass:v26_2_public_actor_action_pass:public_actor_official_action,pass:representative_aligned,v38_process_category_lock:정부_국회,pass:v26_2_public_actor_action_pass:public_actor_official_action,analysis_with_direct_risk,14.0,global_incident:platform_regulation:science_ict_ministry:platform_content_moderation_obligation,277.81,v32_competitor:global_platform:platform_youth_content_rule,background_context,v32_competitor:global_platform:platform_youth_content_rule:background_context,277.81,277.81,277.81,pass:gov_actor_action_route_pass,has_body,302.81,pass:gov_actor_action_route_pass,302.81,3,Y,,,,,,
