id,원카테고리,JSON카테고리,검색어,기사제목,기사제목_정규화,언론사,정규언론사,게시일,본문요약,링크,수집채널,랭킹점수,중요도점수,사건태그,사건단계,주요주체,랭킹감점사유,정책규제의무,강제검토,강제검토사유,자사홍보성,이슈패밀리,코드힌트,오늘성점수,오늘성사유,기사유형,v26이벤트키,v26진행단계,v27_industry_ok,v27_industry_reason,v27_industry_score,v32_competitor_portfolio,v32_actor_group,랭킹원점수,편집신호,스토리버킷,전역사건키,전역사건기본키,Gemini카테고리,Gemini내부카테고리,Gemini이슈패밀리,Gemini이슈그룹,Gemini관련성,Gemini중요도,Gemini대외협력중요도,Gemini관련도,GeminiPR성,Gemini제외,Gemini판단사유,Gemini라벨소스,Gemini자사티어,Gemini정부티어,Gemini경쟁사티어,Gemini경쟁사범위,Gemini정책영향경로,Gemini경쟁시사점,Gemini중복그룹,Gemini이슈유형,v27_event_key,v26_2_profile_reason,v26가드레일사유,v36_competitor_block_reason
1829,경쟁사/해외이슈,경쟁사_해외이슈,쿠팡,쿠팡 개인정보 유출 후폭풍…과징금 이어 집단소송 부담 커진다,쿠팡 개인정보 유출 후폭풍 과징금 이어 집단소송 부담 커진다,서울뉴스통신,서울뉴스통신,"Fri, 12 Jun 2026 06:48:03 GMT",쿠팡 개인정보 유출 후폭풍…과징금 이어 집단소송 부담 커진다 서울뉴스통신,https://news.google.com/rss/articles/CBMia0FVX3lxTE1rOFZIVjVRLVduZ0p3b3gzS25IUjI4WnFYWGRNSjN6Qlp1QzhoUzd4RElzMk1yNl9JZFp4TTBEalBOSHE3cHhzTVJMZXBhcVg0dmZEaG1iVkVqTWxES1NMR3Jfb3JHUTJKNkUw?oc=5,google_rss_쿠팡 when:2d,191.5,96.0,"antitrust_platform,legal_regulatory_enforcement,phishing_security,privacy_security_reliability",antitrust_general,쿠팡,,Y,,,,competitor:platform_obligation,platform_operator_obligation,14.0,published_yesterday,official_action,v27:platform_enforcement:coupang:privacy_data_violation,litigation,Y,"industry_basis_pass:actor=True,change=False,bridge=True",2,Y,coupang,191.5,"legal_regulatory_enforcement,privacy_security_reliability",competitor:platform_obligation,global_incident:platform_enforcement:coupang:privacy_data_violation:sanction_penalty,global_incident:platform_enforcement:coupang:privacy_data_violation,경쟁사_해외이슈,COMPETITOR_PLATFORM_RISK,플랫폼 개인정보 보호 및 규제,쿠팡 개인정보 유출 과징금 및 법적 대응,"국내 주요 경쟁사의 대규모 개인정보 유출 과징금 부과 및 집단소송 부담 증가는 카카오의 개인정보 보호 관리 및 컴플라이언스 강화 필요성을 강조하며, 향후 유사 리스크 발생 시 카카오에 적용될 수 있는 규제 환경 변화를 예측하게 한다.",1,1,1,,,국내 경쟁사 쿠팡의 역대 최대 규모 개인정보 유출 과징금 사례와 그에 따른 집단소송 부담은 카카오의 개인정보 보호 및 규제 대응 전략에 중요한 시사점을 제공한다.,gemini,,,COMP_DOMESTIC_DIRECT_RISK,domestic,,"경쟁사의 역대급 개인정보 유출 과징금 및 집단소송 부담 증가는 카카오가 더욱 철저한 개인정보 보호 시스템을 구축하고 관련 법규 준수에 만전을 기해야 함을 상기시키는 동시에, 유사 사고 발생 시 기업에 미칠 막대한 재정적 타격 및 평판 리스크 가능성을 보여준다.",쿠팡 개인정보 유출 과징금 및 법적 대응,플랫폼 개인정보 보호 및 규제,platform_enforcement:coupang:privacy_data_violation,,,
1897,경쟁사/해외이슈,경쟁사_해외이슈,쿠팡,"과징금은 역대 최대, 피해 보상은 별도 절차…쿠팡 ‘개인정보 유출’ 남은 숙제",과징금은 역대 최대 피해 보상은 별도 절차 쿠팡 개인정보 유출 남은 숙제,일요신문,일요신문,"Fri, 12 Jun 2026 02:46:35 GMT","과징금은 역대 최대, 피해 보상은 별도 절차…쿠팡 ‘개인정보 유출’ 남은 숙제 일요신문",https://news.google.com/rss/articles/CBMiZkFVX3lxTE1GTlo5WkREU09VNmdjMzJudGx3V2VLY2psV2J0SHJRdngtR1BBTHVqM3ROekJTVHo5NEE3eGxPSHR4MUdLNGpRSlhMb09XZVJZazBCSWxublptQ0ptOGs0dlJ6WEpRdw?oc=5,google_rss_쿠팡 개인정보 when:2d,191.5,96.0,"antitrust_platform,legal_regulatory_enforcement,phishing_security,privacy_security_reliability",antitrust_general,쿠팡,,Y,,,,competitor:platform_obligation,platform_operator_obligation,14.0,published_yesterday,official_action,v27:platform_enforcement:coupang:privacy_data_violation,penalty_or_sanction,Y,"industry_basis_pass:actor=True,change=False,bridge=True",2,Y,coupang,191.5,"legal_regulatory_enforcement,privacy_security_reliability",competitor:platform_obligation,global_incident:platform_enforcement:coupang:privacy_data_violation:sanction_penalty,global_incident:platform_enforcement:coupang:privacy_data_violation,경쟁사_해외이슈,COMPETITOR_PLATFORM_RISK,플랫폼 개인정보 보호 및 규제,쿠팡 개인정보 유출 과징금 및 법적 대응,"국내 주요 경쟁사의 대규모 개인정보 유출 과징금 부과 및 피해 보상 관련 논의는 카카오의 개인정보 보호 관리 및 컴플라이언스 강화 필요성을 강조하며, 향후 유사 리스크 발생 시 카카오에 적용될 수 있는 규제 환경 변화를 예측하게 한다.",1,1,1,,,국내 경쟁사 쿠팡의 역대 최대 규모 개인정보 유출 과징금 사례와 그에 따른 피해 보상 논의는 카카오의 개인정보 보호 및 규제 대응 전략에 중요한 시사점을 제공한다.,gemini,,,COMP_DOMESTIC_DIRECT_RISK,domestic,,"경쟁사의 역대급 개인정보 유출 과징금과 별도 피해 보상 절차는 카카오가 더욱 철저한 개인정보 보호 시스템을 구축하고 관련 법규 준수에 만전을 기해야 함을 상기시키는 동시에, 유사 사고 발생 시 기업에 미칠 막대한 재정적 타격 및 소비자 보상 부담 가능성을 보여준다.",쿠팡 개인정보 유출 과징금 및 법적 대응,플랫폼 개인정보 보호 및 규제,platform_enforcement:coupang:privacy_data_violation,,,
2604,경쟁사/해외이슈,경쟁사_해외이슈,중국 AI,"상장 스페이스X ""중국·홍콩 자본은 투자 금지…'오픈AI'는?",상장 스페이스x 중국 홍콩 자본은 투자 금지 오픈ai 는,네이트,네이트,"Fri, 12 Jun 2026 05:32:00 GMT","상장 스페이스X ""중국·홍콩 자본은 투자 금지…'오픈AI'는? 네이트",https://news.google.com/rss/articles/CBMiU0FVX3lxTFAxNHA4UFNtSExOZF9CNzg5LThMQ25IZER2SW12Q1BJbXFjRGtNNGNRbFRnU0FMaU4xYmpicWFGWUhXWUdieWZQNFN4RGdWRm9LNEE0?oc=5,google_rss_중국 AI when:2d,190.0,30.5,"ai_infrastructure_security,platform_obligation,strategy_mna_governance",ai_infrastructure_security,오픈AI,,,,,,,general,14.0,published_yesterday,direct_risk,global_incident:ai_security_policy:openai:openai_security_access,general,Y,"industry_basis_pass:actor=True,change=True,bridge=True",3,Y,global,190.0,"strategy_mna_governance,ai_infrastructure_security,platform_obligation",competitor:strategy_mna,global_incident:ai_security_policy:openai:openai_security_access:general,global_incident:ai_security_policy:openai:openai_security_access,경쟁사_해외이슈,COMPETITOR_AI_STRATEGY,해외 AI 기업 투자/지분,OpenAI 투자금지 관련 논의,"OpenAI를 둘러싼 특정 국가 자본 투자 금지 논의는 글로벌 AI 시장의 투자 환경과 파트너십 구축에 영향을 미치며, 카카오의 해외 AI 투자 및 협력 전략 수립 시 잠재적 제약 요인을 고려하게 한다.",1,1,1,,,"주요 해외 AI 기업인 OpenAI의 투자 자본 관련 논의는 글로벌 AI 시장의 투자 및 파트너십 환경에 대한 중요한 시그널로, 카카오의 AI 전략 수립에 참고가 된다.",gemini,,,COMP_OVERSEAS_PLATFORM_AI,overseas,,주요 해외 AI 경쟁사인 OpenAI의 자본 조달 환경 변화 가능성은 카카오가 글로벌 AI 생태계에서 경쟁 우위를 확보하고 안정적인 파트너십을 구축하기 위한 전략을 재검토하는 데 영향을 줄 수 있다.,OpenAI 투자금지 관련 논의,해외 AI 기업 투자/지분,,,,
1863,경쟁사/해외이슈,경쟁사_해외이슈,쿠팡,"美정부, 역대 최대 쿠팡 과징금에 ""美기업 차별 韓 규제·법집행 우려""",정부 역대 최대 쿠팡 과징금에 기업 차별 규제 법집행 우려,뉴스1,뉴스1,"Thu, 11 Jun 2026 20:10:49 GMT","美정부, 역대 최대 쿠팡 과징금에 ""美기업 차별 韓 규제·법집행 우려"" 뉴스1",https://news.google.com/rss/articles/CBMiWEFVX3lxTE1CQ05iWGk1aDV1NENObzNCTzE0WlAwZGwtWkp0dHVMbmpkT01hOWZKazZiTzhhVzJUU1RWVWhTWW1Mb3FnVnFyYkc1TTdWakVpbHZ1UFBudWE?oc=5,google_rss_쿠팡 규제 when:2d,189.5,105.0,"antitrust_platform,legal_regulatory_enforcement,policy_legislation",antitrust_general,쿠팡,,Y,,,,government:platform_obligation,platform_operator_obligation,14.0,published_yesterday,official_action,global_incident:platform_regulation:coupang:platform_operator_obligation,penalty_or_sanction,Y,"industry_basis_pass:actor=True,change=True,bridge=True",3,Y,coupang,189.5,"legal_regulatory_enforcement,policy_legislation",government:platform_obligation,global_incident:platform_regulation:coupang:platform_operator_obligation:sanction_penalty,global_incident:platform_regulation:coupang:platform_operator_obligation,정부_국회,GOV_PLATFORM_REGULATION,플랫폼 개인정보 보호 및 규제,쿠팡 개인정보 유출 과징금 및 법적 대응 관련 규제 환경 변화,"미국 정부가 쿠팡 과징금에 대해 '미국 기업 차별' 우려를 표명하는 것은 국내 플랫폼 규제가 국제 통상 문제로 비화될 수 있음을 시사하며, 카카오를 포함한 국내 기업의 대외협력 및 통상 리스크 관리에 영향을 미칠 수 있다.",1,1,1,,,국내 주요 플랫폼의 개인정보 유출 사건 관련 미국 정부의 우려 표명은 통상 마찰 가능성 및 국내 규제 환경의 대외적 파급 효과를 시사하여 중요도가 높다.,gemini,,GOV_REGULATORY_ENFORCEMENT,COMP_DOMESTIC_DIRECT_RISK,domestic,"미국 정부의 우려 표명은 향후 국내 플랫폼 규제 수립 시 대외적인 고려 사항을 추가할 수 있으며, 규제 당국이 해외 기업에 대한 규제 집행에 있어 더욱 신중한 접근을 요구하게 할 수 있다.",카카오가 경쟁사 전략·리스크·AI/플랫폼 대응을 비교 참고할 이슈,쿠팡 개인정보 유출 과징금 및 법적 대응 관련 규제 환경 변화,플랫폼 개인정보 보호 및 규제,,,,
1918,경쟁사/해외이슈,경쟁사_해외이슈,쿠팡,"정보유출 사태 쿠팡, 역대급 과징금…후발 제재 기업들 '초긴장' - 머니투데이",정보유출 사태 쿠팡 역대급 과징금 후발 제재 기업들 초긴장,머니투데이,머니투데이,"Thu, 11 Jun 2026 22:30:00 GMT","정보유출 사태 쿠팡, 역대급 과징금…후발 제재 기업들 '초긴장' - 머니투데이 머니투데이",https://news.google.com/rss/articles/CBMiakFVX3lxTE1HUTQ5NlpkUXA1OWx6Qld1V0xLcHRDWVV5bXZkS1hZZ0RxVjlySXBudTFvd1lRcXpFWlltdXRLTTBuV25SOG5NUldQdkZwUVgtTkVnZmh2bXFpUjlnVjVSXzFhRTQ1YVNCSXfSAW9BVV95cUxPdXNfeDdxSmlaTWJOaU02cHRpMFhNNDlHTVhfR0dTb2sxSE9qWU9BSHo3SmZYekJxaU5NN3dPTW9Dc0RJQ2Z1NGNhQmlZb0M1bkhnNnpGN3BaNEp1NXB3Q1VWTXIwSXUycF90OG9IbkU?oc=5,google_rss_쿠팡 site:mt.co.kr when:2d,189.5,89.0,"antitrust_platform,legal_regulatory_enforcement,privacy_security_reliability",antitrust_general,쿠팡,,Y,,,,competitor:platform_obligation,platform_operator_obligation,14.0,published_yesterday,official_action,v27:platform_enforcement:coupang:privacy_data_violation,penalty_or_sanction,Y,"industry_basis_pass:actor=True,change=False,bridge=True",2,Y,coupang,189.5,"legal_regulatory_enforcement,privacy_security_reliability",competitor:platform_obligation,global_incident:platform_enforcement:coupang:privacy_data_violation:sanction_penalty,global_incident:platform_enforcement:coupang:privacy_data_violation,정부_국회,GOV_PLATFORM_REGULATION,플랫폼 개인정보 보호 및 규제,쿠팡 개인정보 유출 과징금 및 법적 대응 관련 규제 환경 변화,"쿠팡의 역대급 과징금 부과 및 '후발 제재 기업들 초긴장' 분위기는 카카오를 포함한 모든 플랫폼 사업자가 개인정보 보호 의무 위반 시 강력한 규제에 직면할 수 있음을 보여주며, 선제적인 리스크 관리를 촉구한다.",1,1,1,,Y,"국내 주요 플랫폼의 개인정보 유출 사건이 규제 강화의 분수령이 됨으로써, 카카오의 개인정보 보호 정책 및 규제 대응에 직접적인 영향을 미칠 수 있다. / v23_guardrail_fail:v26_2_government_without_central_public_actor_action:no_public_actor_action_domain",gemini,,GOV_REGULATORY_ENFORCEMENT,COMP_DOMESTIC_DIRECT_RISK,domestic,"이번 쿠팡 제재는 국내 개인정보 보호 규제의 강도를 한층 높이는 중요한 선례가 되어, 향후 카카오를 포함한 플랫폼 기업들의 개인정보 보호 법규 준수 부담을 가중시키고 규제 당국의 감시 강화로 이어질 수 있다.",카카오가 경쟁사 전략·리스크·AI/플랫폼 대응을 비교 참고할 이슈,쿠팡 개인정보 유출 과징금 및 법적 대응 관련 규제 환경 변화,플랫폼 개인정보 보호 및 규제,platform_enforcement:coupang:privacy_data_violation,,,
1920,경쟁사/해외이슈,경쟁사_해외이슈,쿠팡,"'6246억원' 쿠팡 정보유출 제재, 전세계 최대 과징금 - 머니투데이",6246억원 쿠팡 정보유출 제재 전세계 최대 과징금,머니투데이,머니투데이,"Thu, 11 Jun 2026 19:24:00 GMT","'6246억원' 쿠팡 정보유출 제재, 전세계 최대 과징금 - 머니투데이 머니투데이",https://news.google.com/rss/articles/CBMib0FVX3lxTE0tZk10eXNSMzlneGFDVE5EUm8za3MzTFJwaUwwZG5fS0pVZXlpd0twMzdvaHNlMVR6blQtMTVISnljbloyOTAwRkFhRzk3Y2VPYWFWbkpXdXZIV0FnWTZZajhHRHozV1pqWUNaRDh6SdIBb0FVX3lxTE0tZk10eXNSMzlneGFDVE5EUm8za3MzTFJwaUwwZG5fS0pVZXlpd0twMzdvaHNlMVR6blQtMTVISnljbloyOTAwRkFhRzk3Y2VPYWFWbkpXdXZIV0FnWTZZajhHRHozV1pqWUNaRDh6SQ?oc=5,google_rss_쿠팡 site:mt.co.kr when:2d,189.5,89.0,"antitrust_platform,legal_regulatory_enforcement,privacy_security_reliability",antitrust_general,쿠팡,,Y,,,,competitor:platform_obligation,platform_operator_obligation,14.0,published_yesterday,official_action,v27:platform_enforcement:coupang:privacy_data_violation,penalty_or_sanction,Y,"industry_basis_pass:actor=True,change=False,bridge=True",2,Y,coupang,189.5,"legal_regulatory_enforcement,privacy_security_reliability",competitor:platform_obligation,global_incident:platform_enforcement:coupang:privacy_data_violation:sanction_penalty,global_incident:platform_enforcement:coupang:privacy_data_violation,정부_국회,GOV_PLATFORM_REGULATION,플랫폼 개인정보 보호 및 규제,쿠팡 개인정보 유출 과징금 및 법적 대응 관련 규제 환경 변화,"쿠팡에 대한 '전세계 최대 과징금' 제재는 카카오를 포함한 국내 플랫폼 기업들이 개인정보 보호 의무를 소홀히 할 경우 전례 없는 수준의 강력한 규제에 직면할 수 있음을 경고하며, 글로벌 스탠더드에 부합하는 개인정보 보호 체계 구축의 중요성을 강조한다.",1,1,1,,Y,"국내 주요 플랫폼의 개인정보 유출 사건이 규제 강화의 분수령이 됨으로써, 카카오의 개인정보 보호 정책 및 규제 대응에 직접적인 영향을 미칠 수 있다. / v23_guardrail_fail:v26_2_government_without_central_public_actor_action:no_public_actor_action_domain",gemini,,GOV_REGULATORY_ENFORCEMENT,COMP_DOMESTIC_DIRECT_RISK,domestic,"이번 쿠팡 제재는 국내 개인정보 보호 규제의 강도를 한층 높이는 중요한 선례가 되어, 향후 카카오를 포함한 플랫폼 기업들의 개인정보 보호 법규 준수 부담을 가중시키고 규제 당국의 감시 강화로 이어질 수 있다.",카카오가 경쟁사 전략·리스크·AI/플랫폼 대응을 비교 참고할 이슈,쿠팡 개인정보 유출 과징금 및 법적 대응 관련 규제 환경 변화,플랫폼 개인정보 보호 및 규제,platform_enforcement:coupang:privacy_data_violation,,,
1916,경쟁사/해외이슈,경쟁사_해외이슈,쿠팡,쿠팡 美 SEC에도 ‘과징금’ 공시…“법적 절차 밟을 것”,쿠팡 sec에도 과징금 공시 법적 절차 밟을 것,서울경제,서울경제,"Thu, 11 Jun 2026 23:37:38 GMT",쿠팡 美 SEC에도 ‘과징금’ 공시…“법적 절차 밟을 것” 서울경제,https://news.google.com/rss/articles/CBMiU0FVX3lxTFBHU2ZNMEYxYVpYSXdzNXQ1TmVhZU80SExQRlI0RUpQU1VpZm9PdUQxcGxEUk5kWFRTaHRlZ3RkR2s4MVpUMWZ1Z042VUZTeTBqd0hz0gFTQVVfeXFMUEdTZk0wRjFhWlhJd3M1dDVOZWFlTzRITFBGUjRFSlBTVWlmb091RDFwbERSTmRYVFNodGVndGRHazgxWlQxZnVnTjZVRlN5MGp3SHM?oc=5,google_rss_쿠팡 site:sedaily.com when:2d,189.5,50.0,"antitrust_platform,financial_performance,legal_regulatory_enforcement,platform_obligation",antitrust_general,쿠팡,,,,,,,general,14.0,published_yesterday,official_action,global_incident:platform_regulation:coupang:coupang_designation_disclosure,penalty_or_sanction,Y,"industry_basis_pass:actor=True,change=False,bridge=True",2,Y,coupang,189.5,"legal_regulatory_enforcement,financial_performance,platform_obligation",competitor:regulatory_enforcement,global_incident:platform_regulation:coupang:coupang_designation_disclosure:sanction_penalty,global_incident:platform_regulation:coupang:coupang_designation_disclosure,경쟁사_해외이슈,COMPETITOR_PLATFORM_RISK,플랫폼 개인정보 보호 및 규제,쿠팡 개인정보 유출 과징금 및 법적 대응,"쿠팡이 美 SEC에 과징금을 공시하고 법적 절차를 밟을 것이라는 발표는 규제 당국과의 분쟁이 해외 투자자들에게도 중요한 정보로 인식됨을 보여주며, 카카오의 준법 경영 및 대외 커뮤니케이션 전략에 시사하는 바가 크다.",1,1,1,,,국내 경쟁사 쿠팡의 역대 최대 규모 개인정보 유출 과징금 사례와 그에 따른 미국 SEC 공시 및 법적 대응은 카카오의 개인정보 보호 및 규제 대응 전략에 중요한 시사점을 제공한다.,gemini,,,COMP_DOMESTIC_DIRECT_RISK,domestic,,경쟁사의 과징금 불복 및 해외 공시 대응은 카카오가 유사한 규제 리스크에 직면했을 때 법적 절차와 대외 투자자 소통 방안을 고려하는 데 참고가 된다.,쿠팡 개인정보 유출 과징금 및 법적 대응,플랫폼 개인정보 보호 및 규제,,,,
1800,경쟁사/해외이슈,경쟁사_해외이슈,쿠팡,"‘역대급 과징금’ 쿠팡 ""행정법원에 구제 신청"" 미 증권거래위에 즉시 공시",역대급 과징금 쿠팡 행정법원에 구제 신청 미 증권거래위에 즉시 공시,JTBC,JTBC,"Fri, 12 Jun 2026 03:07:00 GMT","‘역대급 과징금’ 쿠팡 ""행정법원에 구제 신청"" 미 증권거래위에 즉시 공시 JTBC",https://news.google.com/rss/articles/CBMiVEFVX3lxTE1XZFEyMXNMUVlrbVd5a1NWTGtFWWZ5NUc2Q1d4Y1BEQ3Y1ODdxSkpNaTAwRHVJcEdMUUdaeWw1aHBkbmJWd1BNZ2wzM09SZFhITFFISQ?oc=5,google_rss_쿠팡 when:2d,189.5,50.0,"antitrust_platform,financial_performance,legal_regulatory_enforcement,platform_obligation",antitrust_general,쿠팡,,,,,,,general,14.0,published_yesterday,official_action,global_incident:platform_regulation:coupang:coupang_designation_disclosure,penalty_or_sanction,Y,"industry_basis_pass:actor=True,change=False,bridge=True",2,Y,coupang,189.5,"legal_regulatory_enforcement,financial_performance,platform_obligation",competitor:regulatory_enforcement,global_incident:platform_regulation:coupang:coupang_designation_disclosure:sanction_penalty,global_incident:platform_regulation:coupang:coupang_designation_disclosure,경쟁사_해외이슈,COMPETITOR_PLATFORM_RISK,플랫폼 개인정보 보호 및 규제,쿠팡 개인정보 유출 과징금 및 법적 대응,"쿠팡이 행정법원에 구제 신청을 하고 미 증권거래위에 즉시 공시하는 것은 규제 당국과의 분쟁이 해외 투자자들에게도 중요한 정보로 인식됨을 보여주며, 카카오의 준법 경영 및 대외 커뮤니케이션 전략에 시사하는 바가 크다.",1,1,1,,,국내 경쟁사 쿠팡의 역대 최대 규모 개인정보 유출 과징금 사례와 그에 따른 미국 SEC 공시 및 법적 대응은 카카오의 개인정보 보호 및 규제 대응 전략에 중요한 시사점을 제공한다.,gemini,,,COMP_DOMESTIC_DIRECT_RISK,domestic,,경쟁사의 과징금 불복 및 해외 공시 대응은 카카오가 유사한 규제 리스크에 직면했을 때 법적 절차와 대외 투자자 소통 방안을 고려하는 데 참고가 된다.,쿠팡 개인정보 유출 과징금 및 법적 대응,플랫폼 개인정보 보호 및 규제,,,,
2385,경쟁사/해외이슈,경쟁사_해외이슈,애플,"[AI세계속으로]개인정보 보호 강조하는 애플표 AI…""이용자 정보 학습 X""",ai세계속으로 개인정보 보호 강조하는 애플표 ai 이용자 정보 학습 x,네이트,네이트,"Fri, 12 Jun 2026 22:00:00 GMT","[AI세계속으로]개인정보 보호 강조하는 애플표 AI…""이용자 정보 학습 X"" 네이트",https://news.google.com/rss/articles/CBMiU0FVX3lxTFAzdnN6WS0zQ0xxS29tTXhqREtFYUlYdm8yRmhYSUZ0MGJ6SHdYUGFLSkFlYmFDS2w4OENGMExkQk9zNnQ3OHVBMzlGSUZuQU1DY19j?oc=5,google_rss_애플 when:2d,189.0,29.0,ai_infrastructure_security,ai_infrastructure_security,애플,,,,,,,general,24.0,published_today,direct_risk,privacy_security:apple:data_leak,general,Y,"industry_basis_pass:actor=True,change=False,bridge=True",2,Y,global,189.0,ai_infrastructure_security,competitor:ai_strategy,global_incident:platform_regulation:apple:platform_regulation:general,global_incident:platform_regulation:apple:platform_regulation,경쟁사_해외이슈,COMPETITOR_AI_STRATEGY,해외 AI 개인정보 보호 전략,애플 AI 개인정보 보호 강조,"애플의 이용자 정보 학습을 제한하는 AI 개인정보 보호 전략은 카카오의 AI 서비스 개발 시 개인정보 활용 범위, 데이터 학습 방식, 그리고 사용자 신뢰 확보 방안에 대한 기준점 및 중요한 시사점을 제공한다.",1,1,1,,,주요 해외 경쟁사 애플의 AI 개인정보 보호 정책은 카카오 AI 서비스의 개인정보 활용 전략 및 사용자 신뢰 구축에 중요한 벤치마킹 대상이 된다.,gemini,,,COMP_OVERSEAS_PLATFORM_AI,overseas,,애플의 엄격한 AI 개인정보 보호 정책은 카카오가 사용자 신뢰를 높이고 차별화된 AI 서비스를 제공하기 위해 개인정보 보호를 핵심 경쟁력으로 삼는 전략을 고려하는 데 참고가 된다.,애플 AI 개인정보 보호 강조,해외 AI 개인정보 보호 전략,,,,
1875,경쟁사/해외이슈,경쟁사_해외이슈,쿠팡,"쿠팡 과징금 6247억, 개인정보유출 ‘역대 최대’",쿠팡 과징금 6247억 개인정보유출 역대 최대,동아일보,동아일보,"Thu, 11 Jun 2026 19:30:00 GMT","쿠팡 과징금 6247억, 개인정보유출 ‘역대 최대’ 동아일보",https://news.google.com/rss/articles/CBMib0FVX3lxTE83cm9OOGpqeWhnM2xBTTFtWjJWZzVYRmdqaHNhV0gzNmlQcDY5bzJLOG81c3ktRFc3czJvNS1nNWRsMVdaOHJ5dEFYdXpRSC1na2o2Z2s0YVVkOVE3NFJXN1FpLXdnbGpkdVNCMHlhd9IBZkFVX3lxTE5sa184VVNTVXNKZUFkS1IxNlZyVDhmV2FFMzhscDI2MXZ1azZTQzBtRUc4UGZ2R29JSzdVUDNGWUlTY3hwVU5MSktZR245YUN4UG5TcDhlY0xRd1pmbXYzZ2hCQmR0Zw?oc=5,google_rss_쿠팡 과징금 when:2d,188.5,96.0,"antitrust_platform,legal_regulatory_enforcement,phishing_security,privacy_security_reliability",antitrust_general,쿠팡,,Y,,,,competitor:platform_obligation,platform_operator_obligation,14.0,published_yesterday,official_action,v27:platform_enforcement:coupang:privacy_data_violation,penalty_or_sanction,Y,"industry_basis_pass:actor=True,change=False,bridge=True",2,Y,coupang,188.5,"legal_regulatory_enforcement,privacy_security_reliability",competitor:platform_obligation,global_incident:platform_enforcement:coupang:privacy_data_violation:sanction_penalty,global_incident:platform_enforcement:coupang:privacy_data_violation,경쟁사_해외이슈,COMPETITOR_PLATFORM_RISK,플랫폼 개인정보 보호 및 규제,쿠팡 개인정보 유출 과징금 및 법적 대응,"국내 주요 경쟁사의 대규모 개인정보 유출 과징금 부과는 카카오의 개인정보 보호 관리 및 컴플라이언스 강화 필요성을 강조하며, 향후 유사 리스크 발생 시 카카오에 적용될 수 있는 규제 환경 변화를 예측하게 한다.",1,1,1,,,"국내 경쟁사 쿠팡의 역대 최대 규모 개인정보 유출 과징금 사례로, 카카오의 개인정보 보호 및 규제 대응 전략에 중요한 시사점을 제공한다.",gemini,,,COMP_DOMESTIC_DIRECT_RISK,domestic,,"경쟁사의 역대급 개인정보 유출 과징금은 카카오가 더욱 철저한 개인정보 보호 시스템을 구축하고 관련 법규 준수에 만전을 기해야 함을 상기시키는 동시에, 유사 사고 발생 시 기업에 미칠 막대한 재정적 타격 가능성을 보여준다.",쿠팡 개인정보 유출 과징금 및 법적 대응,플랫폼 개인정보 보호 및 규제,platform_enforcement:coupang:privacy_data_violation,,,
