카테고리,카테고리명,검색어,기사제목,언론사,정규언론사,게시일,RSS게시일,RSS요약,본문전문,본문글자수,본문추출방식,본문품질점수,본문품질사유,중요도점수,본문사용가능,본문정제적용,원래RSS링크,링크,랭킹점수,사건태그,사건단계,원문날짜,원문날짜출처,날짜검증결과,날짜후보수,대표선택점수,개인정보보안사건키,개인정보보안대표보너스,전역사건키,전역사건기본키,전역사건대표보너스,이슈패밀리,정책규제의무,자사홍보성,링크상태,링크검증사유,본문정합성,v20_issue_id,v20_issue_group,v20_issue_family,v20_internal_category,v20_issue_score,v21_self_tier,v21_gov_tier,v21_competitor_tier,v21_competitor_scope,Gemini카테고리,Gemini내부카테고리,Gemini이슈유형,Gemini이슈그룹,Gemini중복그룹,Gemini관련성,Gemini중요도,Gemini대외협력중요도,Gemini관련도,Gemini판단사유,Gemini선정사유,선정단계,수집검색어,수집원카테고리,수집JSON카테고리,Gemini판단카테고리,최종카테고리,최종카테고리명,선정순서,본문상태,최종카테고리검증결과,v24대표기사정합성,브리핑ID,v31_final_cleanup,v31_final_priority,v25한국정부국회근거,v42_rescue_source,최종카테고리재배치
자사_및_계열사_이슈,자사 및 계열사 이슈,카카오,"총파업 앞둔 카카오, 조직개편…노사 긴장 속 수익화 방점",서울경제TV,서울경제TV,"Mon, 15 Jun 2026 09:18:02 GMT","Mon, 15 Jun 2026 09:18:02 GMT","총파업 앞둔 카카오, 조직개편…노사 긴장 속 수익화 방점 서울경제TV","총파업 앞둔 카카오, 조직개편…노사 긴장 속 수익화 방점 경제·산업 입력 2026-06-15 18:18:02 수정 2026-06-15 18:18:02 최연두 기자 0개 [앵커] 카카오 노동조합이 오는 29일 총파업을 예고한 가운데, 사측이 핵심인 ‘프로덕트’ 조직을 전격 개편했습니다. 카카오톡(카톡)과 수익화 조직을 분리한 이번 개편을 두고 노사 갈등이 고조된 상황에서 광고·커머스 사업 강화에 방점이 찍힌 것 아니냐는 해석이 나옵니다. 최연두 기자입니다. [기자] 오는 29일 총파업을 예고한 카카오 노동조합. 인력 운용과 처우를 둘러싼 노사 갈등이 좀처럼 좁혀지지 않는 상황입니다. 이런 가운데 사측이 단행한 ‘프로덕트’ 조직개편에 관심이 쏠립니다. 프로덕트 조직은 카카오톡 서비스와 광고·커머스 등 사업적 기능까지 함께 맡아왔는데, 이 조직을 정신아 대표 직속으로 옮긴 겁니다. 또 각 부문의 전문성을 높이기 위해 ‘카카오톡’과 ‘비즈니스’ 두 개로 세부 조직을 분리했습니다. 지난해 카카오톡 개편을 주도했던 홍민택 최고프로덕트책임자(CPO)가 퇴사한 데 따른 후속 조치 성격도 있습니다. 홍 CPO는 당시 카카오톡 첫 화면인 ‘친구’ 탭을 인스타그램과 비슷한 피드 형식으로 바꾸는 업데이트를 이끌었습니다. 하지만 지인 소식과 콘텐츠 노출이 전면 배치되면서 메신저 본연의 기능이 약해졌다는 이용자 반발이 거셌습니다. 카카오는 이번 개편으로 그간 광고 사업을 고도화한 전현수 성과리더를 비즈니스 총괄 자리에 앉혔습니다. 카카오톡을 기반으로 한 광고와 커머스 사업을 더 강화하겠다는 의도로 풀이됩니다. 카카오톡 기반 수익화 전략은 이미 실적 개선으로 이어지고 있습니다. 올해 1분기 톡비즈 광고 매출은 3384억 원으로 전년 동기보다 16% 늘었습니다. 비즈니스 메시지 매출은 27%, 디스플레이 광고 매출은 10% 증가했습니다. 카카오는 이번 개편과 함께 이용자 편의를 최우선 고려하는 ‘유저 퍼스트 태스크포스(TF)’를 신설해 운영할 예정입니다. 하지만 광고·커머스 등 수익화 조직을 따로 분리한 만큼, 카카오톡이 이용자 경험보다 사업 성과에 더 무게를 두는 것 아니냐는 우려의 시선도 있습니다. 노사 갈등까지 겹친 상황에서 카카오가 수익성 개선과 이용자 편의 사이 균형을 맞출 수 있을지 주목됩니다. 서울경제TV 최연두입니다. /yondu@sedaily.com [영상편집 김양희] [ⓒ 서울경제TV(www.sentv.co.kr), 무단 전재 및",1205,trafilatura,88.0,good,252.5,True,False,https://news.google.com/rss/articles/CBMiZEFVX3lxTE4tZXpzLUltVW1oYVBwbTA5RXZpS2t6TEtPQnpMVkI0enFEcVgxM0lkdXJacVFTUzhDNVAyZEVDTS16Q2UzTVBkLUp0YjRXR0dRbTZ4RzIydEk0RENyNVUyRTBuOGs?oc=5,https://www.sentv.co.kr/article/view/sentv202606150045,116.8,"ai_infrastructure_security,earnings,financial_performance,labor_dispute,labor_negotiation,leadership_change,platform_obligation,policy_legislation,search_ads,service_reform_backlash",labor_general,2026-06-15,json_ld:datePublished,original_date_recent,7,305.45,privacy_security:kakao:data_leak:initial_investigation_response,7.0,global_incident:platform_regulation:kakao:platform_content_moderation_obligation:conflict_escalation,global_incident:platform_regulation:kakao:platform_content_moderation_obligation,24.0,self:platform_obligation,Y,,ok,http_200,body_valid,I120,카카오 노조 임단협/파업 및 내부 갈등,카카오 조직개편/노조,SELF_DIRECT_RISK,162.8,DIRECT_RISK,,,other,자사_및_계열사_이슈,SELF_DIRECT_RISK,조직/인사/노조,카카오 노조 임단협/파업 및 내부 갈등,카카오 노조 임단협/파업 및 내부 갈등,"조직개편은 카카오의 사업 효율성과 전략 방향에 영향을 미치며, 노사 갈등 상황과 연결되어 경영진의 전략적 판단이 요구된다.",1,1,1,카카오의 조직개편과 총파업 예고는 회사 운영 및 대외 관계에 직접적인 영향을 미치는 주요 리스크이다.,"창사 첫 파업과 맞물린 핵심 서비스 조직 개편으로, 카카오의 지배구조, 노사관계, 그리고 향후 사업 전략에 중대한 영향을 미치는 직접적 리스크입니다.",issue_selected,카카오,자사 및 계열사 이슈,자사_및_계열사_이슈,자사_및_계열사_이슈,자사_및_계열사_이슈,자사 및 계열사 이슈,1001,본문추출성공,pass:self_guardrail_pass,pass:representative_aligned,1,pass:self_material_pass,733.36,,,
정부_국회,정부/국회,금융위원회,"금융위 ""법인 가상자산 시장 참여 올해 꼭 추진""",블루밍비트,블루밍비트,"Tue, 16 Jun 2026 08:24:37 GMT","Tue, 16 Jun 2026 08:24:37 GMT","금융위 ""법인 가상자산 시장 참여 올해 꼭 추진"" 블루밍비트","PiCK 뉴스 금융위 ""법인 가상자산 시장 참여 올해 꼭 추진"" 기사출처 강민승 기자 간단 요약 금융위원회가 법인 가상자산 시장 참여 를 올해 주요 과제로 추진한다고 밝혔다. 정부는 현금화 목적 거래를 우선 허용한 뒤 투자·재무 목적 거래 와 일반 법인 참여로 확대할 방침이라고 전했다. 금융당국은 상장사 참여 시 자금세탁방지 , 이해상충 관리 , 거래 내역 법정 공시 확대 등 장치를 마련할 예정이라고 밝혔다. 금융위원회가 법인 가상자산 시장 참여 를 올해 주요 과제로 추진한다고 밝혔다. 정부는 현금화 목적 거래를 우선 허용한 뒤 투자·재무 목적 거래 와 일반 법인 참여로 확대할 방침이라고 전했다. 금융당국은 상장사 참여 시 자금세탁방지 , 이해상충 관리 , 거래 내역 법정 공시 확대 등 장치를 마련할 예정이라고 밝혔다. 금융위원회가 법인의 가상자산(암호화폐) 시장 참여를 올해 주요 과제로 추진한다. 개인 투자자 중심으로 형성된 국내 시장 구조를 개선하고, 디지털자산 2단계 입법의 기반을 마련하기 위한 조치로 풀이된다. 16일 헤럴드경제에 따르면 심원태 금융위원회 디지털금융정책부 가상자산과 사무관은 전날 서울남부지방법원에서 열린 '전문재판역량강화 프로그램'에서 법인 시장 참여를 올해 추진 과제 중 하나로 언급했다. 심 사무관은 법인의 시장 참여가 디지털자산 2단계 입법의 선결 과제라는 취지로 설명했다. 스테이블코인과 가상자산사업자 영업 규제 등을 논의하기에 앞서 개인 중심 시장 구조를 개선할 필요가 있다는 판단이다. 국내 가상자산 시장은 2017년 정부의 가상통화 투기근절 특별대책과 2018년 실명확인 입출금계정 제도 시행 이후 개인 투자자 중심으로 형성됐다. 관련 가이드라인은 종료됐지만 법인 실명계좌 발급이 관행적으로 제한되면서 원화거래소를 통한 법인 거래는 사실상 어려운 구조가 이어졌다. 금융위는 개인 중심 시장 구조가 국내 가상자산 거래의 알트코인 편중을 키운 요인으로 보고 있다. 글로벌 시장에서는 비트코인(BTC)과 이더리움(ETH) 비중이 70% 수준인 반면, 국내 시장에서는 이 비중이 40% 수준에 그친다는 설명이다. 정부는 법인 시장 참여를 단계적으로 허용할 방침이다. 현금화 목적 거래를 우선 허용하고, 이후 투자·재무 목적 거래와 일반 법인 참여로 확대하는 방식이다. 상장사의 시장 참여가 허용될 경우 자금세탁방지와 이해상충 관리 장치도 함께 마련될 전망이다. 금융당국은 은행의 거래 목적과 자금 원천 확인을 강화하고, 제3의 가상자산 보관·관리기관 활용을 권고하는 방안을 검토해왔다. 거래 내역에 대한 법정 공시 확대도 검토 대상이다. 디지털자산거래소 공동협의체(DAXA)의 역할을 보완하기 위한 법정협회 설립도 추진된다. 현재 닥사가 자율규제 영역에서 역할을 하고 있지만, 강제력과 이행력 확보에는 한계가 있다는 판단에서다. 외국환거래법 개정에 따른 제도 변화도 이어진다. 지난 2일 공포된 외국환거래법 개정안에 따라 오는 12월부터 가상자산이전업자는 국경 간 가상자산 이전 내역을 한국은행 외환전산망에 보고해야 한다. 수집된 정보는 국세청, 관세청, 금감원, 금융정보분석원(FIU) 등 관계기관과 공유돼 불법 외환거래와 탈세 의심 거래 모니터링에 활용될 예정이다. 금융위원회가 법인의 가상자산(암호화폐) 시장 참여를 올해 주요 과제로 추진한다. 개인 투자자 중심으로 형성된 국내 시장 구조를 개선하고, 디지털자산 2단계 입법의 기반을 마련하기 위한 조치로 풀이된다. 16일 헤럴드경제에 따르면 심원태 금융위원회 디지털금융정책부 가상자산과 사무관은 전날 서울남부지방법원에서 열린 '전문재판역량강화 프로그램'에서 법인 시장 참여를 올해 추진 과제 중 하나로 언급했다. 심 사무관은 법인의 시장 참여가 디지털자산 2단계 입법의 선결 과제라는 취지로 설명했다. 스테이블코인과 가상자산사업자 영업 규제 등을 논의하기에 앞서 개인 중심 시장 구조를 개선할 필요가 있다는 판단이다. 국내 가상자산 시장은 2017년 정부의 가상통화 투기근절 특별대책과 2018년 실명확인 입출금계정 제도 시행 이후 개인 투자자 중심으로 형성됐다. 관련 가이드라인은 종료됐지만 법인 실명계좌 발급이 관행적으로 제한되면서 원화거래소를 통한 법인 거래는 사실상 어려운 구조가 이어졌다. 금융위는 개인 중심 시장 구조가 국내 가상자산 거래의 알트코인 편중을 키운 요인으로 보고 있다. 글로벌 시장에서는 비트코인(BTC)과 이더리움(ETH) 비중이 70% 수준인 반면, 국내 시장에서는 이 비중이 40% 수준에 그친다는 설명이다. 정부는 법인 시장 참여를 단계적으로 허용할 방침이다. 현금화 목적 거래를 우선 허용하고, 이후 투자·재무 목적 거래와 일반 법인 참여로 확대하는 방식이다. 상장사의 시장 참여가 허용될 경우 자금세탁방지와 이해상충 관리 장치도 함께 마련될 전망이다. 금융당국은 은행의 거래 목적과 자금 원천 확인을 강화하고, 제3의 가상자산 보관·관리기관 활용을 권고하는 방안을 검토해왔다. 거래 내역에 대한 법정 공시 확대도 검토 대상이다. 디지털자산거래소 공동협의체(DAXA)의 역할을 보완하기 위한 법정협회 설립도 추진된다. 현재 닥사가 자율규제 영역에서 역할을 하고 있지만, 강제력과 이행력 확보에는 한계가 있다는 판단에서다. 외국환거래법 개정에 따른 제도 변화도 이어진다. 지난 2일 공포된 외국환거래법 개정안에 따라 오는 12월부터 가상자산이전업자는 국경 간 가상자산 이전 내역을 한국은행 외환전산망에 보고해야 한다. 수집된 정보는 국세청, 관세청, 금감원, 금융정보분석원(FIU) 등 관계기관과 공유돼 불법 외환거래와 탈세 의심 거래 모니터링에 활용될 예정이다. 강민승 기자 minriver@bloomingbit.io 여러분의 웹3 투자 인사이트를 더해줄 강민승 기자입니다. 트레이드나우·알트코인나우와 함께하세요! 📊🚀 여러분의 웹3 투자 인사이트를 더해줄 강민승 기자입니다. 트레이드나우·알트코인나우와 함께하세요! 📊🚀",2886,bs4_selector,86.0,good,239.0,True,False,https://news.google.com/rss/articles/CBMiUEFVX3lxTFBrU0kxMHN1bWlrYmRQbmpybHZ0ZWZpeXZzRjMtd1dZbUdPcEYtbEdzV21YVk5oSWdoNTdqRkVpV3k1LTVqcHFaaHVuV2FqR3Vl?oc=5,https://bloomingbit.io/feed/news/114339,110.6,"digital_asset_stablecoin,financial_performance,platform_obligation,policy_legislation,stablecoin,strategy_mna_governance",stablecoin_forum_aml,2026-06-16,json_ld:datePublished,original_date_recent,10,294.7,,0.0,global_incident:platform_regulation:financial_authority:platform_operator_obligation:policy_change,global_incident:platform_regulation:financial_authority:platform_operator_obligation,32.0,government:platform_obligation,Y,,ok,http_200,body_valid,I140,금융위 법인 디지털자산 시장 참여 추진,디지털자산 정책,GOV_FINANCIAL_DIGITAL_POLICY,127.0,,GOV_DIGITAL_FINANCE_POLICY,,other,정부_국회,GOV_FINANCIAL_DIGITAL_POLICY,디지털자산 정책,금융위 법인 디지털자산 시장 참여 추진,금융위 법인 디지털자산 시장 참여 추진,금융위의 법인 디지털자산 시장 참여 추진은 카카오의 디지털자산 관련 사업(클레이튼 등)의 성장 및 제도권 진입에 긍정적인 영향을 미칠 수 있음.,1,1,1,"금융위가 법인 가상자산 시장 참여를 추진한다는 소식으로, 카카오의 디지털자산 사업에 직접적인 정책 환경 변화를 가져올 수 있음.",v43_hard_min:산업동향: daily-safe portfolio rescue,issue_selected,금융위원회,정부/국회,정부_국회,정부_국회,정부_국회,정부/국회,2001,본문추출성공,pass:v26_2_public_actor_action_pass:public_actor_official_action,pass:representative_aligned,8,pass:gov_actor_action_route_pass,488.68,Y,v43_hard_min:산업동향,
