카테고리,카테고리명,검색어,기사제목,언론사,정규언론사,게시일,RSS게시일,RSS요약,본문전문,본문글자수,본문추출방식,본문품질점수,본문품질사유,중요도점수,본문사용가능,본문정제적용,원래RSS링크,링크,랭킹점수,사건태그,사건단계,원문날짜,원문날짜출처,날짜검증결과,날짜후보수,대표선택점수,개인정보보안사건키,개인정보보안대표보너스,전역사건키,전역사건기본키,전역사건대표보너스,이슈패밀리,정책규제의무,자사홍보성,제외단계,v20_issue_id,v20_issue_group,수집검색어,수집원카테고리,수집JSON카테고리,Gemini판단카테고리,최종카테고리,최종카테고리명,본문상태,최종카테고리검증결과,링크상태,링크검증사유,본문정합성,v20_issue_family,v20_internal_category,v20_issue_score,v21_self_tier,v21_gov_tier,v21_competitor_tier,v21_competitor_scope,Gemini카테고리,Gemini내부카테고리,Gemini이슈유형,Gemini이슈그룹,Gemini중복그룹,Gemini관련성,Gemini중요도,Gemini대외협력중요도,Gemini관련도,Gemini판단사유,Gemini선정사유,선정단계,선정순서
경쟁사_해외이슈,경쟁사/해외이슈,애플,"애플, 규제 준수 문제로 EU에 새로운 Siri AI 출시 안 해 - 대변인",Investing.com 한국어,Investing.com 한국어,"Tue, 09 Jun 2026 10:45:00 GMT","Tue, 09 Jun 2026 10:45:00 GMT","애플, 규제 준수 문제로 EU에 새로운 Siri AI 출시 안 해 - 대변인 Investing.com 한국어",,0,failed,0.0,empty,79.0,False,False,https://news.google.com/rss/articles/CBMid0FVX3lxTE9jZ0FwWk52Nk1qYzNLUG1kdXplRkh0a2NYZW9oWUpHaTIwaWZ3NmgzNEdtRjdCTlIwRFhfNWpzeVZOTmhJSkQ0ZFF6c0QwM0lTbmdfbWl3YkJFeTN0amlYZktFbXd4aW1jclNHbEpJTU05bE04cVpR?oc=5,https://kr.investing.com/news/stock-market-news/article-93CH-1977029,91.5,"ai_infrastructure_security,platform_obligation,policy_legislation",ai_infrastructure_security,,no_original_date_found,no_original_date_found_kept,0.0,19.3,,0.0,global_incident:platform_regulation:apple:platform_operator_obligation:general,global_incident:platform_regulation:apple:platform_operator_obligation,24.0,competitor:platform_obligation,Y,,issue_representative_attempt,I045,애플 Siri AI 유럽 출시 지연,애플,경쟁사/해외이슈,경쟁사_해외이슈,경쟁사_해외이슈,경쟁사_해외이슈,경쟁사/해외이슈,,,,,,,,,,,,,,,,,,,,,,,,,
정부_국회,정부/국회,과학기술정보통신부,"과기정통부, 'AI 미래 유니콘 기업'에 리벨리온 등 15개사 선정",뉴시스,뉴시스,"Wed, 10 Jun 2026 05:00:00 GMT","Wed, 10 Jun 2026 05:00:00 GMT","과기정통부, 'AI 미래 유니콘 기업'에 리벨리온 등 15개사 선정 뉴시스","등록 2026.06.10 14:00:00 수정 2026.06.10 14:16:24 카카오 노조, 창사 이래 첫 부분파업… 회사 성과 보상 문제 비판 2026 북중미 월드컵 A조 경기 일정 ""李 ""반도체 발전 혜택 나누자"" 벨기에 총리 ""양국 협력 유익"" 유럽 순방 중인 이재명 대통령은 10일(현지시간) 벨기에 바르트 드 웨브흐 총리와 정상회담을 갖고 양국 간 경제·통상·첨단산업·교육 협력 방안과 안보 현안 등을 폭넓게 논의했다. 이 대통령은 이날 오전 벨기에 브뤼셀에서 드 웨브흐 총리와 만나 이같이 의견을 교환했다고 강유정 청와대 수석대변인이 브리핑을 통해 전했다. 경제와 통상 분야에선 올 李 ""AI 초과이익 국민에 돌려줄 매커니즘 필요"" MBK ""홈플러스 회생 1000억 추가 연대보증"" 카카오 노조 ""29일 로그오프""…추가 파업 예고 철책 너머 금강산, 지뢰밭 위 두루미…DMZ 사진전 손흥민, 야후스포츠 선정 북중미 월드컵 주목할 26인 린, 이혼 후 화장실 생활 왜 ""좁은 공간이라 마음 편해"" 14년 열애 끝 결별…정경호, 수영 언급 발언 재조명 삼성전자, 美 '엘리먼트 바이오사이언스' 투자…1대 주주 지위 확보 '14년 연인' 수영·정경호 결별에 효연 발언 재조명 中, 450조원 들여 전국 AI 데이터센터망 구축…美 추월 노린다 린, 이혼 후 화장실 생활 해명…""좁은 공간이라 마음 편해"" ""전자발찌 차고 디스코팡팡 DJ""…여고생 집단 성폭행에 '공분' 국회 의원회관서 50대 남성 추락…심정지 상태 병원이송 ""이란-미국 협상, 흐릿하지만 윤곽 잡혔다""-NYT 이 대통령, 지지율 하락 기사 공유하며 ""국민 평가 겸허히 받아들여"" 李 ""영구 도입?"" 농어촌기본소득, 추가 10곳 압축…발표평가 마무리 송파는 51% 옹진은 100%…선관위, 지역마다 제각각 투표용지 인쇄 법원 증거보전 결정 난 '투표용지' 보관상자 사라져 민주당 이지은 대변인 '李, 尹에 빗댄 발언' 논란에 사퇴…""제 역량 부족"" 이 대통령 ""AI 초과이익 국민에게 나누기 위해 기본소득 같은 새로운 메커니즘 필요"" 김도읍·정점식, 국민의힘 원내대표 선거 결선 진출 이란, 美 공습에 반격…""美 목표물에 미사일·드론 발사"" 스페이스X IPO에 2500억 달러 몰려…청약 목표액 4배 흥행 5월 중국 소비자물가 1.2%↑ 생산자물가 3.9%↑ 트럼프, 고농축우라늄 전량반출 대신 '이란 내 희석' 추진하나 이란 혁명수비대 ""美 목표물 향해 미사일·드론 발사"" 노동자 추락사에 포스코이앤씨 사과…""재발 방지 책임 다할 것"" 팬심 이용한 K팝 멤버십 '갑질 약관'…공정위 ""안 고치면 고발"" '규제 사각지대' 사내 주택대출 연 5조…1인당 평균 7400만원 5월 소비자물가 1.2%↑…유가 충격에 생산자물가 3.9% 급등 사상최대 '빚투' 직격탄…변동성 장세에 1조 반대매매 한은 뉴욕사무소 ""美 투자은행, 매파적 6월 FOMC 예상"" '사이드카가 일상' 롤러코스피에 공포지수도 '역대 최고' 세미티에스, 코스닥 상장…""반도체 공장 자동화 시장 공략 확대"" ""기관 너마저""…外人 동반 3.6조 '팔자'에 코스피 6% 급락 ""美 승인여부 결정""…하반기 K바이오 모멘텀 촉각 금융위 '동남권투자공사' 골격 윤곽…지역 투자 본격화 신호탄 ""KF-21 성공 뒤엔 美 스파이 있었다?""…KAI가 밝힌 진실은 ""반도체 인기 못지 않네"" 삼성전기, MLCC 앞세워 내년 영업익 3조 시대 여나 삼성전자·SK하이닉스, 호남 반도체 공장 세울까…현재까진 ""모르는 일"" 일축 폴스타코리아, '2027년형 폴스타4' 판매 시작…""가격 최대 200만원 인하"" ""푸바오 여동생 생겼어요"" 에버랜드, 판다보전 연구 10주년 '경사' 확산하는 전남·충청 반도체 新공장 추진說…삼성전자·SK하이닉스 ""모르는 일"" 견지 ""엔비디아 칩만 사면 뭐 하나…통신망 멈추면 한국 AI도 올스톱"" 창밖 너머 쓰러진 시민 보이자 카페 박차고 나간 간호사들 ""AI 의사였어?""…81억 챙긴 업체, 식약처가 잡았다 카카오 노조, 창사 첫 본사 부분파업 돌입…계열사 4곳 동참 카카오 노조, 첫 본사 파업 집회 개시…카톡·페이 정상 운영 중 ""붙이고 누르면 끝""…간편한 최초 항암제 유럽 허가 ""연구원 두 달 치 일을 단 하루 만에""…베일 벗은 '클로드 5' '참교육' 글로벌 1위 빛났지만…교권침해 현실은 그늘 17년간 900차례 비행한 기장이 '무면허'…에어캐나다 '발칵' 과천시, K패스·기후동행카드 이용자 '월 3만원' 환급지원 푸바오 여동생 또 생겼다…에버랜드, 국내 세번째 자연번식 성공 서소문 고가차도 교각 철거 임박…신설 공사도 준비 이화영 국민참여재판 3일차, 대북 지원 직권남용 혐의 심리 시작 서울야외도서관, 전자책 도입…서울광장·광화문 등 운영 선거법 위반 이갑준 사하구청장, 2심 벌금 500만원 건천산단 열분해유 제조공장서 '화재'…작업자 전신 화상(종합) 결혼 앞두고 숨진 소방관…노조 ""직장 갑질·악습 탓"" 광주 도심 종합병원서 불…환자·의료진 100여명 대피 '주사기 작가' 윤종석의 변신…색면추상으로 건너간 풍경 베난티 신부 ""AI 시대는 하나의 문턱…최대 위협은 초지능 아닌 초조작"" 예비 학예사 모여라…월정사서 문화유산 무료 교육 상실과 이해 사이에서 기록한 애도…'호피무늬 모자' 아이비, 뮤지컬 '시카고'로 브로드웨이 입성…""소중한 기회"" ""붉은 중심의 숨""…이화의료원 홍보맨, 개인전 진주시, 채색화를 넘어 현대미술로…김기라×'이미지의 미래들' 교도소 같았던 홍명보호 훈련장…기관총 든 군경 속 '철통 보안' 추신수·김하성 넘은 이정후, 한국인 빅리거 최장 17경기 연속 안타 신기록 이정후, 韓 빅리거 최장 17G 연속 안타 신기록…타율 0.335 단독 2위(종합) 이정후, 17경기 연속 안타…한국인 빅리거 최장 신기록 '체코전 D-2' 홍명보호, 완전 비공개로 '공격·수비·세트피스' 훈련 '옵타' 선택은 홍명보호…북중미 월드컵 체코전 예상 승률 42.9% 아시안게임 태극마크 영광 누구에게…김도영·허인서 발탁될까 멕시코 vs 남아공 맞대결로 월드컵 개막…영광의 첫 골은 누구 수영·정경호 결별에 무속인 점사 화제…""조만간 헤어져"" 14년 사랑 끝낸 최수영, 일본서 전한 근황…환한 표정 눈길 황정음 ""둘째 생겨서 재결합 아냐…많은 사람이 오해"" 존 시나, '참교육' 시청했나…김무열 사진 SNS 박제 박미선, 암 투병 후 달라진 식습관…""숯불고기 못 먹어"" 1 ""엔비디아 칩만 사면 뭐 하나…통신망 멈추면 한국 AI도 올스톱"" 2 창밖 너머 쓰러진 시민 보이자 카페 박차고 나간 간호사들 3 ""AI 의사였어?""…81억 챙긴 업체, 식약처가 잡았다 4 카카오 노조, 창사 첫 본사 부분파업 돌입…계열사 4곳 동참 5 ""美 승인여부 결정""…하반기 K바이오 모멘텀 촉각 6 카카오 노조, 첫 본사 파업 집회 개시…카톡·페이 정상 운영 중 7 ""붙이고 누르면 끝""…간편한 최초 항암제 유럽 허가 1 14년 열애 끝 결별…정경호, 수영 언급 발언 재조명 2 [속보]삼성전자, 美 '엘리먼트 바이오사이언스' 투자…1대 주주 지위 확보 3 '14년 연인' 수영·정경호 결별에 효연 발언 재조명 4 中, 450조원 들여 전국 AI 데이터센터망 구축…美 추월 노린다 5 린, 이혼 후 화장실 생활 해명…""좁은 공간이라 마음 편해"" 6 ""전자발찌 차고 디스코팡팡 DJ""…여고생 집단 성폭행에 '공분' 7 국회 의원회관서 50대 남성 추락…심정지 상태 병원이송 尹 재판 기피 등 절차 지연에…법원도 피로 누적 이윤석 WSI 대표 ""'유봇' 연내 식약처 품목허가 목표"" '거제, 야호!' 리센느 ""저희 음악에 대한 자부심이 커요"" ""이렇게까지 버틴다고?""…부산 쇼핑몰서 또 '주차장 자리 맡기' 대표이사 : 염영남 주소 : 서울 중구 퇴계로 173 남산스퀘어빌딩 (구 극동빌딩) 12층 사업자등록번호 : 102-81-36588 발행인 : 염영남 편집인 : 염영남 고충처리인 : 김경원 통신판매업신고 : 서울중구 0398호 문의 02-721-7400 [email protected]",3905,bs4_selector,6.0,government_individual_case_not_policy,132.0,False,False,https://news.google.com/rss/articles/CBMiYEFVX3lxTFB5UXBrd0U0ZVhrdXQyWXNvRmlYM0JuYzNmOXVKOHJkUVk3TTBNZ0RfQkM3ckNTQmZfS04zYnBmdVdGT29ITi1CME8tQWJVbXNRTGxxZzBuUkk5SFRjVFBFZdIBeEFVX3lxTE50WFo5Nk9MTndLLTBfaE5qdzNWazZ2dERpNEM2NHFQbHRyakZqYzMzRnBFb1c2SHZlTjNwSUcyQWZsUXF5NzNUTGx4eGFzaUtVS1ptMlRMY2NDYTl6RHh5Yk5TdGFMRi1OQkZCZS1ETkRUam9SU0tfZg?oc=5,https://www.newsis.com/view/NISX20260610_0003663376,111.6,"ai_infrastructure_security,aidc_datacenter,antitrust_platform,labor_dispute,labor_negotiation,legal_regulatory_enforcement,platform_obligation,policy_legislation,self_pr_promo,strategy_mna_governance",labor_strike_action,2026-06-10,url_date,original_date_recent,8.0,161.8,,61.0,global_incident:platform_enforcement:kakao:deceptive_membership_price_ad:investigation_review,global_incident:platform_enforcement:kakao:deceptive_membership_price_ad,56.0,self:platform_obligation,Y,,issue_representative_attempt,I004,government_ai_core_policy:과기정통부 ai 미래 유니콘 기업 에 리벨리온 등 15개사 선정,과학기술정보통신부,정부/국회,정부_국회,정부_국회,정부_국회,정부/국회,,,,,,,,,,,,,,,,,,,,,,,,,
산업동향,산업동향,인공지능 산업 동향,"슈나이더일렉트릭, 에노바와 MOU… AI 데이터센터 구축 협력",FA저널,,"Tue, 09 Jun 2026 06:14:16 GMT",,"슈나이더일렉트릭, 에노바와 MOU… AI 데이터센터 구축 협력 FA저널",,0,v24_pre_body_guardrail,-100.0,never_allow_title_only_low_value_or_caption,,False,,https://news.google.com/rss/articles/CBMia0FVX3lxTFBTdzhxVGliWDBuUGw1WXp4UjhEUmIzdkx0OUsxTnJpVkd3YjN3Zlo4SU5rLW9fRFp5RzRoN2JCZUUzbUZaSlBwQ3duRkN1MGpDY25MYUFGa3NkM0xYWFpmVGs4RWttemNmd2hj?oc=5,https://news.google.com/rss/articles/CBMia0FVX3lxTFBTdzhxVGliWDBuUGw1WXp4UjhEUmIzdkx0OUsxTnJpVkd3YjN3Zlo4SU5rLW9fRFp5RzRoN2JCZUUzbUZaSlBwQ3duRkN1MGpDY25MYUFGa3NkM0xYWFpmVGs4RWttemNmd2hj?oc=5,,,,,,,,,,,,,,,,,issue_representative_attempt,I012,국가 AI 인프라/AIDC/GPU 정책,인공지능 산업 동향,산업동향,산업동향,산업동향,산업동향,산업동향,최종금지_대체필요,fail:never_allow_title_only,,,,,,,,,,,,,,,,,,,,,,,
정부_국회,정부/국회,금융위원회,"""AI 보안 위협, AI로 맞선다""…금융위·5대 금융지주, 디지털 방어벽 구축",네이트,네이트,"Wed, 10 Jun 2026 06:10:00 GMT","Wed, 10 Jun 2026 06:10:00 GMT","""AI 보안 위협, AI로 맞선다""…금융위·5대 금융지주, 디지털 방어벽 구축 네이트","AI 요약 기사 제목과 본문 내용을 자동 요약한 내용입니다. 전체 내용을 이해하기 위해서는 기사 본문 전체를 확인하는 것이 더 좋습니다. AI챗이 열심히 분석 중입니다. 잠시만 기다려주세요. 기사 제목과 본문 내용을 자동 요약한 내용입니다. 전체 내용을 이해하기 위해서는 기사 본문 전체를 확인하는 것이 더 좋습니다. AI챗이 열심히 분석 중입니다. 잠시만 기다려주세요. [서울=뉴스핌] 채송무 기자 = 인공지능 대전환(AX) 시대를 맞아 해킹과 보이스피싱 등 신종 디지털 위협이 현실화되면서 정부와 금융권이 강력한 합동 방어망 구축에 나섰다. 이억원 금융위원장은 10일 은행연합회에서 5대 금융지주(KB·신한·하나·우리·농협) 회장단 및 금융 보안 전문가들과 'AX 시대 해킹·보이스피싱 대응 간담회'를 개최했다. 이번 간담회는 현존 최고 수준의 성능을 갖춘 '프론티어 AI' 모델의 보안 침해 위협과 최신 AI 기술을 악용한 지능형 피싱 범죄에 공동 대응하기 위해 마련됐다. ◆'AI 보안은 AI로 방어'… 망분리 규제 빗장 푼다 이억원 위원장은 ""AI 대전환은 새로운 도약의 기회이자 과거에 없던 모험""이라며, 정부의 대응 원칙으로 'AI 공격은 AI로 방어한다'는 기조를 제시했다. 정부는 금융회사가 보안 목적의 AI를 활용해 취약점을 점검할 수 있도록 망분리 규제를 긴급 완화하고 있다. 나아가 고도의 AI·보안 역량을 갖춘 금융사를 선별해 연내 망분리 규제를 전면 해제하는 방안도 속도감 있게 추진할 계획이다. 이는 금융사가 AI 기반의 체질 개선을 통해 혁신을 주도할 수 있도록 제도적 기반을 닦아주기 위함이다. 최근 더욱 교묘해지는 AI 기반 보이스피싱에 맞서 대응 시스템도 고도화된다. 금융권은 작년 10월 출범한 AI 플랫폼 'ASAP(에이샙)'에 통신·수사 정보를 확대 연계하고, 범죄 유형별 패턴 분석을 강화하기로 했다. 또한 신종 피싱 범죄 발생 시 즉시 계좌가 정지되도록 가이드라인을 마련하고, 금융권 이상거래 탐지시스템(FDS)에 이를 실시간 반영할 예정이다. 특히 금융사의 책임을 강화하고 피해자를 실효성 있게 보호하기 위해 '무과실책임' 제도를 도입하는 방안도 신속히 추진할 방침이다. ◆5대 금융지주, ""전사적 차원의 보안 역량 확충"" 이날 참석한 5대 금융지주 회장들은 지주사 차원에서 AI 기반 보안관제 솔루션을 도입하고, 보안 전담 조직(레드팀)을 신설하는 등 전사적 대응에 나서고 있다고 밝혔다. 이들은 자회사 간 의심 거래 정보 공유, AI 지능형 FDS 구축, 피싱 피해 보상 보험 출시 등 고객 보호를 위한 구체적인 성과를 공유하며 정부 정책에 긴밀히 협력하겠다는 뜻을 모았다. 이억원 위원장은 ""항구에 배를 세워두는 것은 안전하지만, 그것이 배의 존재 이유가 아니다""라며 ""금융이 본연의 역할을 다하기 위해서는 과감히 출항해야 한다""고 강조했다. 높은 보안 역량을 갖춘 금융사들이 기존의 방식을 탈피해 성공 사례를 선도적으로 만들어주면, 중소 금융사들이 이를 길잡이 삼아 안심하고 혁신에 뛰어들 수 있다는 설명이다. 금융위는 이번 간담회에서 논의된 현장의 목소리를 적극 수용해 금융권의 AI 대전환을 뒷받침할 다양한 후속 방안을 마련할 계획이다. 정부와 금융권의 이러한 공조는 AI 시대의 새로운 디지털 위협을 현명하게 극복하고, 국내 금융 산업의 신뢰와 경쟁력을 동시에 강화하는 초석이 될 것으로 기대된다. 네이트온쪽지 카카오톡 페이스북 엑스 URL 복사 댓글 운영 원칙 네이트 뉴스 댓글은 기사에 대한 자신의 생각을 말하고 남의 생각을 들으며 서로 다양한 의견을 나누는 공간입니다. 건전한 인터넷 문화 정착을 위해 아래와 같은 댓글 운영원칙을 적용합니다. 1. 댓글 삭제 아래에 해당하는 내용이 포함된 댓글은 이용자 신고 등에 의해 별도의 예고 없이 삭제·노출 제한될 수 있습니다. 타인에 대한 욕설 또는 비방 인신공격 또는 명예훼손 개인정보 유출 또는 사생활 침해 음란성 내용 또는 음란물 링크 상업적 광고 또는 사이트/홈페이지 홍보 불법정보 유출 같은 내용의 반복 (도배) 지역감정 조장 폭력 또는 사행심 조장 언론보도 형식의 허위 게시물 자살유발정보 혐오표현 또는 특정 속성을 이유로 특정 집단이나 그 구성원에 대한 비하·조롱 표현(이와 관련한 사항은 한국인터넷자율정책기구의 관련 가이드라인을 준수합니다) 기타 기사 내용과 관계없거나 부적절한 내용 2. 권한 제한 불건전한 댓글이 발견되는 경우 별도의 통보 없이 즉시 삭제하며, 상습적이거나 위반 정도가 심한 댓글을 게시하는 분에 대해서는 일정 기간 댓글 작성에 대한 권한을 제한할 수 있습니다. 또한 비정상적인 패턴으로 댓글 작성, 추천, 반대 등이 발생하는 것으로 관리자 또는 시스템이 판단하는 경우 부정 클릭여부를 확인하여 해당 IP나 ID를 제재할 수 있습니다. 댓글에 비속어 및 상대방의 불쾌감을 주는 단어를 사용하거나, 유명인이나 특정 일반인 또는 단체나 기관을 사칭하는 경우 제재될 수 있습니다. 명예훼손, 개인정보 유출, 욕설 등 법률에 위반되는 댓글은 관계 법령에 의거 민형사상의 불이익을 받을 수 있으니 이용에 주의를 부탁드립니다. 네이트 뉴스 댓글은 기사에 대한 자신의 생각을 말하고 남의 생각을 들으며 서로 다양한 의견을 나누는 공간입니다. 건전한 인터넷 문화 정착을 위해 아래와 같은 댓글 운영원칙을 적용합니다. 1. 댓글 삭제 아래에 해당하는 내용이 포함된 댓글은 이용자 신고 등에 의해 별도의 예고 없이 삭제·노출 제한될 수 있습니다. 타인에 대한 욕설 또는 비방 인신공격 또는 명예훼손 개인정보 유출 또는 사생활 침해 음란성 내용 또는 음란물 링크 상업적 광고 또는 사이트/홈페이지 홍보 불법정보 유출 같은 내용의 반복 (도배) 지역감정 조장 폭력 또는 사행심 조장 언론보도 형식의 허위 게시물 자살유발정보 혐오표현 또는 특정 속성을 이유로 특정 집단이나 그 구성원에 대한 비하·조롱 표현(이와 관련한 사항은 한국인터넷자율정책기구의 관련 가이드라인을 준수합니다) 기타 기사 내용과 관계없거나 부적절한 내용 2. 권한 제한 불건전한 댓글이 발견되는 경우 별도의 통보 없이 즉시 삭제하며, 상습적이거나 위반 정도가 심한 댓글을 게시하는 분에 대해서는 일정 기간 댓글 작성에 대한 권한을 제한할 수 있습니다. 또한 비정상적인 패턴으로 댓글 작성, 추천, 반대 등이 발생하는 것으로 관리자 또는 시스템이 판단하는 경우 부정 클릭여부를 확인하여 해당 IP나 ID를 제재할 수 있습니다. 댓글에 비속어 및 상대방의 불쾌감을 주는 단어를 사용하거나, 유명인이나 특정 일반인 또는 단체나 기관을 사칭하는 경우 제재될 수 있습니다. 명예훼손, 개인정보 유출, 욕설 등 법률에 위반되는 댓글은 관계 법령에 의거 민형사상의 불이익을 받을 수 있으니 이용에 주의를 부탁드립니다. 네이트 뉴스 댓글은 기사에 대한 자신의 생각을 말하고 남의 생각을 들으며 서로 다양한 의견을 나누는 공간입니다. 건전한 인터넷 문화 정착을 위해 아래와 같은 댓글 운영원칙을 적용합니다. 아래에 해당하는 내용이 포함된 댓글은 이용자 신고 등에 의해 별도의 예고 없이 삭제·노출 제한될 수 있습니다. 불건전한 댓글이 발견되는 경우 별도의 통보 없이 즉시 삭제하며, 상습적이거나 위반 정도가 심한 댓글을 게시하는 분에 대해서는 일정 기간 댓글 작성에 대한 권한을 제한할 수 있습니다. 또한 비정상적인 패턴으로 댓글 작성, 추천, 반대 등이 발생하는 것으로 관리자 또는 시스템이 판단하는 경우 부정 클릭여부를 확인하여 해당 IP나 ID를 제재할 수 있습니다. 댓글에 비속어 및 상대방의 불쾌감을 주는 단어를 사용하거나, 유명인이나 특정 일반인 또는 단체나 기관을 사칭하는 경우 제재될 수 있습니다. 명예훼손, 개인정보 유출, 욕설 등 법률에 위반되는 댓글은 관계 법령에 의거 민형사상의 불이익을 받을 수 있으니 이용에 주의를 부탁드립니다.",3820,bs4_selector,6.0,government_individual_case_not_policy,125.0,False,False,https://news.google.com/rss/articles/CBMieEFVX3lxTE9KdnNlRTlreXFWUHNBWlhybFJ0NkNPSkozeTkzYnNyUE90TzZrbkhPT09aSGNKOHI4U1FBWlhPekllT0xWeUl0Q2VuTEtac3dzcWRkSHVPMTRfczNRaXJBTUZqVkxGLUdYTVctYXotMXlENDlwdlRSUg?oc=5,https://m.news.nate.com/view/20260610n23960?mid=m02&list=recent&cpcd=,113.6,"ai_infrastructure_security,legal_regulatory_enforcement,market_power_platform,phishing_security,platform_obligation,policy_legislation,privacy_security_reliability",security_phishing_malware,2026-06-10,url_date,original_date_recent,2.0,142.9,privacy_security:kakao:data_leak:policy_change,21.0,global_incident:platform_enforcement:kakao:consumer_dark_pattern:sanction_penalty,global_incident:platform_enforcement:kakao:consumer_dark_pattern,56.0,self:platform_obligation,Y,,issue_representative_attempt,I050,"금융위·5대 금융지주, AI 보안 위협 대응 디지털 방어벽 구축",금융위원회,정부/국회,정부_국회,정부_국회,정부_국회,정부/국회,,,,,,,,,,,,,,,,,,,,,,,,,
