카테고리,카테고리명,검색어,기사제목,언론사,정규언론사,게시일,RSS게시일,RSS요약,본문전문,본문글자수,본문추출방식,본문품질점수,본문품질사유,중요도점수,본문사용가능,본문정제적용,원래RSS링크,링크,랭킹점수,사건태그,사건단계,원문날짜,원문날짜출처,날짜검증결과,날짜후보수,대표선택점수,개인정보보안사건키,개인정보보안대표보너스,전역사건키,전역사건기본키,전역사건대표보너스,이슈패밀리,정책규제의무,자사홍보성,제외단계,v20_issue_id,v20_issue_group,수집검색어,수집원카테고리,수집JSON카테고리,Gemini판단카테고리,최종카테고리,최종카테고리명,링크상태,링크검증사유,본문정합성,v20_issue_family,v20_internal_category,v20_issue_score,v21_self_tier,v21_gov_tier,v21_competitor_tier,v21_competitor_scope,Gemini카테고리,Gemini내부카테고리,Gemini이슈유형,Gemini이슈그룹,Gemini중복그룹,Gemini관련성,Gemini중요도,Gemini대외협력중요도,Gemini관련도,Gemini판단사유,Gemini선정사유,선정단계,선정순서,본문상태,최종카테고리검증결과
경쟁사_해외이슈,경쟁사/해외이슈,구글,"[속보]개인정보위, 쿠팡에 과징금 6247억원…""3750만명 개인정보 유출"" - 머니투데이",머니투데이,머니투데이,"Thu, 11 Jun 2026 02:00:00 GMT","Thu, 11 Jun 2026 02:00:00 GMT","[속보]개인정보위, 쿠팡에 과징금 6247억원…""3750만명 개인정보 유출"" - 머니투데이 머니투데이","글자크기 개인정보위, 11일 '쿠팡' 및 계열사의 개인정보 유출 및 침해 제재처분 의결. <",51,trafilatura,-18.0,too_short,113.0,False,False,https://news.google.com/rss/articles/CBMibEFVX3lxTE9aY1hpR2s3VlJxTlE4YU5XZ3NCTHhSX1pVNkRERDRhMURYVGlIakd5aFVCY2ZEQkVZUTR4NlcxWFFubFE4QnpMZTNRR0FZSGRiLVVpaF9pZXJqdm9Qb1pRMXNYRWZuZFVPc04tM9IBckFVX3lxTE91dGdFZEgxRnhpYnhqQmpnMkFvcFB4N1p4eDQ0WlRKQzRDUlZvY1dMWGNvZEpTMFFDZk1WOE93OU1vTkRLbXFoYWRrUi0wbTJ2T2NpbVViNnkwZTFFTktqNHNYN1pFeFNEa05LU280ZHlWUQ?oc=5,https://www.mt.co.kr/industry/2026/06/11/2026061108455786852,306.25,"antitrust_platform,legal_regulatory_enforcement,phishing_security,platform_obligation,policy_legislation,privacy_security_reliability,strategy_mna_governance",antitrust_general,2026-06-11,url_date,original_date_recent,6.0,69.9,privacy_security:coupang:data_leak:sanction_or_penalty,40.0,global_incident:platform_enforcement:coupang:privacy_data_violation:sanction_penalty,global_incident:platform_enforcement:coupang:privacy_data_violation,48.0,competitor:platform_obligation,Y,,issue_representative_attempt,I002,쿠팡 개인정보 유출 및 과징금 부과,구글,경쟁사/해외이슈,경쟁사_해외이슈,경쟁사_해외이슈,경쟁사_해외이슈,경쟁사/해외이슈,,,,,,,,,,,,,,,,,,,,,,,,,
정부_국회,정부/국회,금융위원회,금융위 “AI 공격은 AI로 방어”…망분리 완화·피싱 대응 강화,KBS 뉴스,KBS 뉴스,"Wed, 10 Jun 2026 06:03:00 GMT","Wed, 10 Jun 2026 06:03:00 GMT",금융위 “AI 공격은 AI로 방어”…망분리 완화·피싱 대응 강화 KBS 뉴스,"기사 본문 영역 금융위 “AI 공격은 AI로 방어”…망분리 완화·피싱 대응 강화 입력 2026.06.10 (15:00) 수정 2026.06.10 (15:03) 읽어주기 기능은 크롬기반의 브라우저에서만 사용하실 수 있습니다. 금융당국이 인공지능(AI)을 활용한 해킹과 보이스피싱 등 대응 체계 강화에 나섭니다. 이억원 금융위원장은 오늘(10일) 금융지주 회장 등과의 간담회에서 AI 시대 금융권이 직면한 디지털 위협 대응 방안을 논의했습니다. 이 위원장은 “‘인공지능 대전환’ 시대는 새로운 도약의 기회인 동시에 과거에 접하지 못한 도전과 위협을 마주하는 모험”이라며 최근 이슈가 된 ‘미토스’와 같은 프론티어 AI의 보안 침해 가능성과 AI·음성변조 기술을 악용한 보이스피싱 범죄를 주요 위협으로 꼽았습니다. 금융위는 우선 프론티어 AI에 따른 보안 위협에 대응하기 위해 보안 목적의 AI를 활용한 취약점 점검이 가능하도록 망분리 규제를 완화하고 있습니다. 아울러 고도의 AI·보안 역량을 갖춘 금융회사를 대상으로 망분리 규제를 전면 해제하는 방안도 연내 시행을 목표로 검토·추진할 계획입니다. 그동안 금융회사에는 해킹과 정보 유출 등을 막기 위해 내부 업무망과 인터넷망을 분리하는 규제가 적용돼 왔습니다. 그러나 이런 망 분리가 오히려 금융권의 AI 활용을 제한하고, AI로 인한 공격에 대응하기도 어렵게 한다는 지적이 나오면서 금융당국이 규제 완화에 나선 것입니다. 보이스피싱 대응 체계도 고도화합니다. 금융위는 지난해 10월 출범한 보이스피싱 정보공유·분석 AI 플랫폼 ‘ASAP’에 통신·수사 정보를 추가로 연계하고 범죄 유형별 AI 패턴 분석 기능을 강화할 예정입니다. 또 신종 피싱 범죄까지 즉시 계좌정지가 가능하도록 관련 가이드라인을 마련하고 금융권 이상거래탐지시스템(FDS)에 반영할 계획입니다. 금융권의 책임성을 높이고 피해자 구제를 강화하기 위해 금융회사의 잘못이 없어도 책임을 묻는 이른바 ‘무과실책임’ 제도 도입도 서두르겠다고 밝혔습니다. 이 위원장은 금융권에 정부와의 적극적인 공조와 전사적 대응 체계 구축도 주문했습니다. 간담회에 참석한 5대 금융지주 회장들은 AI 기반 보안관제 및 모의해킹 솔루션 도입, 보안 전담 조직 신설 등을 추진하고 있다고 설명했습니다. 또 의심거래 정보 공유와 AI 기반 지능형 FDS 구축, 보이스피싱 피해 보상보험 출시 등 피해 예방과 구제를 위한 노력도 확대하고 있다고 밝혔습니다. [사진 출처 : 게티이미지] 이억원 금융위원장은 오늘(10일) 금융지주 회장 등과의 간담회에서 AI 시대 금융권이 직면한 디지털 위협 대응 방안을 논의했습니다. 이 위원장은 “‘인공지능 대전환’ 시대는 새로운 도약의 기회인 동시에 과거에 접하지 못한 도전과 위협을 마주하는 모험”이라며 최근 이슈가 된 ‘미토스’와 같은 프론티어 AI의 보안 침해 가능성과 AI·음성변조 기술을 악용한 보이스피싱 범죄를 주요 위협으로 꼽았습니다. 금융위는 우선 프론티어 AI에 따른 보안 위협에 대응하기 위해 보안 목적의 AI를 활용한 취약점 점검이 가능하도록 망분리 규제를 완화하고 있습니다. 아울러 고도의 AI·보안 역량을 갖춘 금융회사를 대상으로 망분리 규제를 전면 해제하는 방안도 연내 시행을 목표로 검토·추진할 계획입니다. 그동안 금융회사에는 해킹과 정보 유출 등을 막기 위해 내부 업무망과 인터넷망을 분리하는 규제가 적용돼 왔습니다. 그러나 이런 망 분리가 오히려 금융권의 AI 활용을 제한하고, AI로 인한 공격에 대응하기도 어렵게 한다는 지적이 나오면서 금융당국이 규제 완화에 나선 것입니다. 보이스피싱 대응 체계도 고도화합니다. 금융위는 지난해 10월 출범한 보이스피싱 정보공유·분석 AI 플랫폼 ‘ASAP’에 통신·수사 정보를 추가로 연계하고 범죄 유형별 AI 패턴 분석 기능을 강화할 예정입니다. 또 신종 피싱 범죄까지 즉시 계좌정지가 가능하도록 관련 가이드라인을 마련하고 금융권 이상거래탐지시스템(FDS)에 반영할 계획입니다. 금융권의 책임성을 높이고 피해자 구제를 강화하기 위해 금융회사의 잘못이 없어도 책임을 묻는 이른바 ‘무과실책임’ 제도 도입도 서두르겠다고 밝혔습니다. 이 위원장은 금융권에 정부와의 적극적인 공조와 전사적 대응 체계 구축도 주문했습니다. 간담회에 참석한 5대 금융지주 회장들은 AI 기반 보안관제 및 모의해킹 솔루션 도입, 보안 전담 조직 신설 등을 추진하고 있다고 설명했습니다. 또 의심거래 정보 공유와 AI 기반 지능형 FDS 구축, 보이스피싱 피해 보상보험 출시 등 피해 예방과 구제를 위한 노력도 확대하고 있다고 밝혔습니다. [사진 출처 : 게티이미지] ■ 제보하기 ▷ 카카오톡 : 'KBS제보' 검색, 채널 추가 ▷ 전화 : 02-781-1234, 4444 ▷ 이메일 : kbs1234@kbs.co.kr ▷ 유튜브, 네이버, 다음에서도 KBS뉴스를 구독해주세요! 이 기사가 좋으셨다면 - 좋아요 0 - 응원해요 0 - 후속 원해요 0",2414,trafilatura,8.0,government_individual_case_not_policy,116.5,False,False,https://news.google.com/rss/articles/CBMiW0FVX3lxTE5EOXd3cnRqckNNOC0yeWRCcmhaTThCRnZZcUVGdnN4V3FQY0ZhM3lUcDRlUFBGYXk2Zk1qX3IxNkRsR0pmOW9ZNTVrUFZFU21SWXNPaVd6RlV4Z0E?oc=5,https://news.kbs.co.kr/news/pc/view/view.do?ncd=8582793,108.6,"ai_infrastructure_security,legal_regulatory_enforcement,market_power_platform,phishing_security,platform_obligation,policy_legislation,privacy_security_reliability",security_phishing_malware,2026-06-10,body_labeled_date,original_date_recent,7.0,143.75,privacy_security:toss:data_leak:policy_change,23.0,global_incident:platform_enforcement:naver:privacy_data_violation:general,global_incident:platform_enforcement:naver:privacy_data_violation,32.0,self:platform_obligation,Y,,issue_representative_attempt,I056,global_incident:platform_regulation:financial_authority:platform_content_moderation_obligation,금융위원회,정부/국회,정부_국회,정부_국회,정부_국회,정부/국회,,,,,,,,,,,,,,,,,,,,,,,,,
정부_국회,정부/국회,금융위원회,"금융위 ""AI 공격은 AI로 방어""…AX시대 해킹·보이스피싱 대응 강화",메트로신문,메트로신문,"Wed, 10 Jun 2026 05:30:14 GMT","Wed, 10 Jun 2026 05:30:14 GMT","금융위 ""AI 공격은 AI로 방어""…AX시대 해킹·보이스피싱 대응 강화 메트로신문","AX시대 해킹·보이스피싱 대응 간담회 개최 ""인공지능 대전환(AX) 시대는 새로운 도약의 기회이기도 하지만 과거에 접하지 못한 도전과 위협을 마주하는 모험이기도 하다. 정부는 AI 공격은 AI로 방어한다는 인식하에 다각적인 정책을 적극 추진하겠다."" 이억원 금융위원장은 10일 'AX 시대 해킹·보이스 피싱 대응 간담회'를 열고 ""미토스와 같은 프런티어 AI의 보안 침해 가능성과 AI 음성변조 등 최신 기술을 악용한 보이스 피싱 범죄가 주요 위협요소로 부상하고 있다""며 이같이 말했다. 이 위원장은 이날 디지털 위협에 적극적으로 대응해 달라고 강조했다. 그는 ""신종 피싱 범죄시 신속한 계좌 정지·피해 구제가 이뤄지도록 충분한 인적·물적 자원을 투입하고, 명확한 고객 대응 매뉴얼 마련에 신경 써 달라""며 ""경찰·금융정보분석원(FIU) 실무 부서와 원활히 협력해 달라""고 했다. 또 지주회사 차원에서 협력체계를 구축해야 한다고 덧붙였다. 이 위원장은 ""지주 차원에서 자체 모의해킹, 위기 상황별 대응 시나리오 등 역량을 구축하라""며 ""은행, 카드, 보험 등 계열사 간 피싱 범죄 정보를 공유하거나, 보이스 피싱 피해자를 두텁게 보호하기 위해 자체적인 보험상품을 마련하는 등 피싱 범죄 차단과 피해 구제에 적극적으로 관심을 가져달라""고 말했다. 이 밖에도 이 위원장은 AX는 아직 가보지 않은 길인 만큼 높은 역량과 자원을 갖춘 금융회사가 시장을 선도하고 성공 사례를 축적해 달라고 말했다. 이 위원장은 ""금융권 인공지능 대전환을 위해 그간 발표한 정책을 적극 추진해 나가겠다""며 ""금융권 의견을 적극 수용해 다양한 방안을 만들어 나가겠다""고 말했다.",812,trafilatura,-12.0,government_individual_case_not_policy,133.5,False,False,https://news.google.com/rss/articles/CBMiYEFVX3lxTE5Zano2VXZUdEthQ2JsZi1vYkkxdndiRE1MbGk5aEtMb0lYMlNDNUlBdWJiNHlURDZBbjM4Skc4bHctR1JHV21wRTBDSHd0MFJWMEI2dUMwWWRZTldrcTlIbg?oc=5,https://www.metroseoul.co.kr/article/20260610500251,106.6,"ai_infrastructure_security,legal_regulatory_enforcement,phishing_security,platform_obligation,policy_legislation,privacy_security_reliability,stablecoin",stablecoin_general,,no_original_date_found,no_original_date_found_kept,0.0,102.65,privacy_security:toss:data_leak:initial_investigation_response,23.0,global_incident:platform_regulation:toss:platform_content_moderation_obligation:announcement,global_incident:platform_regulation:toss:platform_content_moderation_obligation,32.0,government:platform_obligation,Y,,issue_representative_attempt,I056,global_incident:platform_regulation:financial_authority:platform_content_moderation_obligation,금융위원회,정부/국회,정부_국회,정부_국회,정부_국회,정부/국회,,,,,,,,,,,,,,,,,,,,,,,,,
정부_국회,정부/국회,금융위원회,"금융위, ‘AI 기반 보험사기 방지체계 구축 TF’ 출범…9월 종합대책 마련",thedailyeconomy.kr,thedailyeconomy.kr,"Thu, 11 Jun 2026 00:00:06 GMT","Thu, 11 Jun 2026 00:00:06 GMT","금융위, ‘AI 기반 보험사기 방지체계 구축 TF’ 출범…9월 종합대책 마련 thedailyeconomy.kr","금융위원회가 생성형 인공지능(AI)과 딥페이크 기술을 활용한 신종 보험사기에 대응하기 위해 범정부 차원의 ‘AI 기반 보험사기 방지체계 구축 TF’를 출범시켰다 . 금융위원회는 4일 김진홍 금융산업국장 주재로 ‘AI 기반 보험사기 방지체계 구축 TF’ 킥오프 회의를 겸한 보험조사협의회를 개최했다고 밝혔다. 보험조사협의회는 보험업법에 근거해 운영되는 정부·유관기관 협의체로, 최근 AI 기술이 보험사기에 악용되는 사례가 늘어나면서 보다 체계적이고 선제적인 대응체계 마련이 필요하다는 판단에 따라 TF를 출범하게 됐다. 이날 회의에는 금융위원회와 경찰청을 비롯해 금융감독원, 한국신용정보원, 금융보안원, 보험개발원, 국민건강보험공단, 건강보험심사평가원, 국민연금공단, 근로복지공단, 생명보험협회, 손해보험협회, 보험연구원 등이 참석했다. 금융위에 따르면 지난해 보험사기 적발 규모는 1조1,571억원으로 집계됐다. 적발되지 않은 잠재적 보험사기까지 포함하면 규모는 약 9조원에 이를 것으로 추산된다. 보험사기 유형은 장기손해보험이 44.7%로 가장 많았고 자동차보험(22.4%), 생명보험(21.8%), 일반손해보험(11.2%) 순으로 나타났다. 특히 생성형 AI 기술의 발전으로 진단서, 입·통원 확인서, 차량 파손 사진 등 각종 보험금 청구 서류를 정교하게 위·변조하는 사례가 증가하고 있다. 실제로 부산의 한 20대 보험계약자는 병원 발급 입·통원 확인서를 생성형 AI로 조작해 입원·퇴원 기간을 늘린 뒤 11개 보험사에 반복 청구하는 방식으로 약 1억5천만원의 보험금을 편취한 것으로 드러났다. 법원은 해당 피고인에게 보험사기방지특별법 위반 혐의로 징역 2년을 선고했다. 금융위는 현재 한국신용정보원, 보험개발원, 개별 보험사 등이 AI를 활용한 보험사기 탐지 시스템을 운영하고 있지만 기관별 정보가 분산돼 있어 실시간 정보 공유와 교차 검증에는 한계가 있다고 진단했다. 이에 따라 TF는 ▲법·제도 분과 ▲데이터 분과 ▲인프라 분과 등 3개 분과로 구성돼 보험사기 정보 집중 및 공유를 위한 법적 기반 마련, 보험사기 탐지 정보 확대, 보험업권·공공기관 간 실시간 정보 공유 체계 구축, AI 기반 위험지수 개발 등을 논의할 예정이다. 특히 한국신용정보원이 운영 중인 ‘AI 기반 인슈어테크 플랫폼’을 보험업권 전체가 활용하는 통합 보험사기 방지 인프라로 고도화하는 방안도 추진된다. 또한 건강보험공단과 건강보험심사평가원이 보유한 원천 데이터와의 교차 검증 체계도 강화될 전망이다. 금융위는 향후 3개월간 TF 논의를 거쳐 오는 9월 ‘AI 기반 보험사기 방지체계 구축방안’을 발표하고, 10월부터 관련 법령 개정과 플랫폼 고도화 작업에 착수할 계획이다. 김진홍 금융산업국장은 “AI 기반 보험사기 방지체계가 구축되면 사전 예방부터 실시간 탐지, 사후 조치까지 전 과정에서 보험사기를 효과적으로 줄일 수 있을 것”이라며 “보험산업에 대한 신뢰를 높이고 보험료 부담 완화와 건강보험 재정 누수 방지라는 국민적 편익으로 이어질 것으로 기대한다”고 말했다. 키워드 #금융산업국장 #김진홍 #한국신용정보원 #경찰청 #금융보안원@보험개발원 #국민건강보험공단 #국민연금공단 #근로복지공단 #생명보험협회 #손해보험협회 #보험연구원 배만식 선임기자 bmsik@hanmail.net 금융권, 신종피싱까지 전면 차단 나선다 새도약기금, 농협자산관리·상호금융권 장기연체채권 9,602억 원 매입 청년미래적금 최고 금리 8% 공개 금융위, 롯데손보 경영개선계획 조건부 승인… “보험서비스 정상 운영” 부산, 지역 혁신기업 투자 플랫폼 ‘MUST ROUND’ 개최 “비상장 투자 역량 키운다”…금투협, 모험자본 특설과정 개설 범정부 보이스피싱TF, 7개월 연속 피해 감소 성과 금융권, 신종피싱까지 전면 차단 나선다 금융권, 신종피싱까지 전면 차단 나선다 새도약기금, 농협자산관리·상호금융권 장기연체채권 9,602억 원 매입 청년미래적금 최고 금리 8% 공개 금융위, 롯데손보 경영개선계획 조건부 승인… “보험서비스 정상 운영” 부산, 지역 혁신기업 투자 플랫폼 ‘MUST ROUND’ 개최 “비상장 투자 역량 키운다”…금투협, 모험자본 특설과정 개설 범정부 보이스피싱TF, 7개월 연속 피해 감소 성과 새도약기금, 농협자산관리·상호금융권 장기연체채권 9,602억 원 매입 금융위, 롯데손보 경영개선계획 조건부 승인… “보험서비스 정상 운영” 부산, 지역 혁신기업 투자 플랫폼 ‘MUST ROUND’ 개최 “비상장 투자 역량 키운다”…금투협, 모험자본 특설과정 개설 범정부 보이스피싱TF, 7개월 연속 피해 감소 성과 보험사 주담대, 은행보다 낮은 금리로 부상…가계대출 풍선효과 현실화 부동산 세제 대수술 예고…장특공제·보유세·임대사업자 혜택 손질되나 OECD, 한국 성장률 2.6%로 대폭 상향…G20 중 최대 상승폭 신협 부실채권 관리체계 강화…자산관리회사 운영기준 구체화 금융위, ‘민간 기술자문단’ 출범… AI 보안위협 대응체계 강화 금융투자협회, 부동산투자자문인력 교육생 모집…6월 23일까지 접수 보험사 주담대, 은행보다 낮은 금리로 부상…가계대출 풍선효과 현실화 부동산 세제 대수술 예고…장특공제·보유세·임대사업자 혜택 손질되나 OECD, 한국 성장률 2.6%로 대폭 상향…G20 중 최대 상승폭 신협 부실채권 관리체계 강화…자산관리회사 운영기준 구체화 금융위, ‘민간 기술자문단’ 출범… AI 보안위협 대응체계 강화 금융투자협회, 부동산투자자문인력 교육생 모집…6월 23일까지 접수",2676,bs4_selector,6.0,government_individual_case_not_policy,110.0,False,False,https://news.google.com/rss/articles/CBMicEFVX3lxTE0teDk0TlJNaEs1a2trMVpiOFFMaDMxMEpoN2Mta1hHQ3YyUndCQlgtWWpldTFsbzFpZnZUUGVucGUxSmZNNUctQ2tFcE16T05MQ2J1bUs1QmNhaFR1cGxPY25hUzBCVlpnZTRyQjJyNzg?oc=5,https://www.thedailyeconomy.kr/news/articleView.html?idxno=5695,108.6,"ai_infrastructure_security,deepfake_youth,legal_regulatory_enforcement,market_power_platform,phishing_security,platform_obligation,policy_legislation,privacy_security_reliability,strategy_mna_governance",security_general,2026-06-11,meta:article:published_time,original_date_recent,1.0,129.4,,7.0,global_incident:platform_enforcement:microsoft:content_moderation_obligation:investigation_review,global_incident:platform_enforcement:microsoft:content_moderation_obligation,38.0,government:platform_obligation,Y,,issue_representative_attempt,I058,government_ai_core_policy:금융위 ai 기반 보험사기 방지체계 구축 tf 출범 9월 종합대책 마련,금융위원회,정부/국회,정부_국회,정부_국회,정부_국회,정부/국회,,,,,,,,,,,,,,,,,,,,,,,,,
