카테고리,카테고리명,검색어,기사제목,언론사,정규언론사,게시일,RSS게시일,RSS요약,본문전문,본문글자수,본문추출방식,본문품질점수,본문품질사유,중요도점수,본문사용가능,본문정제적용,원래RSS링크,링크,랭킹점수,사건태그,사건단계,원문날짜,원문날짜출처,날짜검증결과,날짜후보수,대표선택점수,개인정보보안사건키,개인정보보안대표보너스,전역사건키,전역사건기본키,전역사건대표보너스,이슈패밀리,정책규제의무,자사홍보성,링크상태,링크검증사유,본문정합성,v20_issue_id,v20_issue_group,v20_issue_family,v20_internal_category,v20_issue_score,v21_self_tier,v21_gov_tier,v21_competitor_tier,v21_competitor_scope,Gemini카테고리,Gemini내부카테고리,Gemini이슈유형,Gemini이슈그룹,Gemini중복그룹,Gemini관련성,Gemini중요도,Gemini대외협력중요도,Gemini관련도,Gemini판단사유,Gemini선정사유,선정단계,수집검색어,수집원카테고리,수집JSON카테고리,Gemini판단카테고리,최종카테고리,최종카테고리명,선정순서,본문상태,최종카테고리검증결과,v24대표기사정합성,v36_category_repair,v26최종수리결과,v26기사유형,v26오늘성점수,v26이벤트키,v26최종우선점수,v29_event_base,v29_event_stage,v29_stage_event_key,v26_2_final_priority,v27_final_priority,v28_final_priority,v29_final_guardrail,v29_bodyless_policy,v29_final_priority,v31_final_cleanup,v31_final_priority,브리핑ID,v20_bodyless_reason,v36_title_link_only,v35_title_link_only,v26_1_refill_source,v28_competitor_guardrail,최종카테고리재배치,v38_portfolio_added_stage
자사_및_계열사_이슈,자사 및 계열사 이슈,카카오,"카카오페이, 4000만명 정보 알리페이 제공…법원 “60억원 과징금 정당”",더퍼블릭,더퍼블릭,"Sat, 13 Jun 2026 23:59:08 GMT","Sat, 13 Jun 2026 23:59:08 GMT","카카오페이, 4000만명 정보 알리페이 제공…법원 “60억원 과징금 정당” 더퍼블릭","카카오페이, 4000만명 정보 알리페이 제공…법원 “60억원 과징금 정당” [더퍼블릭=이유정 기자] 고객 동의 없이 약 4000만명의 개인정보를 중국 알리페이에 제공한 카카오페이에 60억원 가까운 과징금을 부과한 처분은 정당하다는 법원 판단이 나왔다. 법원은 이용자들이 자신의 정보가 애플 서비스 결제능력 평가에 활용된다는 점을 인지했거나 명확히 동의했다고 보기 어렵다고 봤다. 12일 법조계에 따르면, 서울행정법원 행정12부(강재원 부장판사)는 지난 11일 카카오페이가 개인정보보호위원회를 상대로 낸 시정명령 등 처분 취소 청구 소송에서 원고 패소로 판결했다. 앞서 개인정보위는 지난해 1월 전체 이용자 약 4천만명의 개인정보를 동의 없이 알리페이에 제공한 카카오페이에 시정명령과 과징금 59억6천여만원을 부과했다. 개인정보위 조사 결과 카카오페이는 애플이 알리페이에 위탁한 ‘NSF 점수’ 산출 모델 구축을 위해 전체 이용자 정보를 제공한 것으로 드러났다. NSF 점수는 애플 서비스 이용자의 결제 대금 부족 가능성을 평가하기 위해 산출하는 일종의 고객별 점수다. 개인정보위는 애플에 대해서도 개인정보 국외 처리 위탁 사실을 정보주체에게 고지하지 않은 책임을 물었다. 애플에는 과징금 24억500만원과 과태료 220만원이 부과됐다. 재판부는 카카오페이 이용자 정보가 알리페이를 거쳐 애플에 이전됐고, 해당 정보 활용에 따른 이익은 애플에 귀속된다고 판단했다. 재판부는 “원고는 정보를 알리페이에 제공하면서 간편결제 이용자들로부터 동의를 받은 바가 없다”고 지적했다. 또 해당 정보가 애플에 의해 고객의 결제 능력을 평가하는 신용평가 지표로 활용된다는 점에 대해 정보주체가 이를 인지했거나 구체적이고 명확하게 동의했다고 보기 어렵다고 봤다. 카카오페이가 애플 이용자뿐 아니라 안드로이드 사용자 등 애플 미이용자까지 포함한 전체 이용자의 정보를 알리페이에 전송한 점도 문제로 판단됐다. 재판부는 이 같은 사정을 종합하면 개인정보위의 과징금 처분은 적법하다고 봤다. 재판부는 카카오페이의 청구를 모두 기각하며 “이용자들은 NSF 정보 산출 과정에서 개인정보 자기통제권이 사실상 무력화되는 데 동의했다고 볼 수 없다”고 지적했다.",1078,trafilatura,88.0,good,203.0,True,False,https://news.google.com/rss/articles/CBMib0FVX3lxTE9ELUtab0hZUTVPVDdQcnhTMzVaU29sbmZrSGdCaHJVZUtva3JzOTdRSE1yZklCTzlFNy1qc0dCNmtvQlIxcG8zakZTb2dVbzlIRkRFRHZpMmRvNUdBejduZzhoT2hKcDFzbkdmbEw0UdIBb0FVX3lxTE9ELUtab0hZUTVPVDdQcnhTMzVaU29sbmZrSGdCaHJVZUtva3JzOTdRSE1yZklCTzlFNy1qc0dCNmtvQlIxcG8zakZTb2dVbzlIRkRFRHZpMmRvNUdBejduZzhoT2hKcDFzbkdmbEw0UQ?oc=5,https://www.thepublic.kr/news/articleViewAmp.html?idxno=307589,128.8,"antitrust_platform,kakao_pay_alipay,legal_regulatory_enforcement,platform_obligation,policy_legislation,strategy_mna_governance",antitrust_inapp,2026-06-14,json_ld:datePublished,original_date_recent,2,263.3,privacy_security:kakao:data_leak:sanction_or_penalty,40.0,global_incident:platform_enforcement:kakao:privacy_data_violation:sanction_penalty,global_incident:platform_enforcement:kakao:privacy_data_violation,56.0,self:platform_obligation,Y,,ok,http_200,body_valid,I120,카카오페이 알리페이 개인정보 제공 관련 과징금 소송 패소,개인정보 제재,SELF_DIRECT_RISK,172.8,DIRECT_RISK,,COMP_OVERSEAS_REGULATION_DATA,overseas,자사_및_계열사_이슈,SELF_DIRECT_RISK,개인정보 제재,카카오페이 알리페이 개인정보 제공 관련 과징금 소송 패소,카카오페이 알리페이 개인정보 제공 관련 과징금 소송 패소,"카카오페이의 개인정보보호 관련 법적 리스크가 현실화되었으며, 이는 카카오그룹 전체의 개인정보보호 정책 및 이미지에 부정적인 영향을 미칠 수 있다.",1,1,1,로컬 보조 라벨 / v26: 오늘 새 직접 사건·진전,로컬 보조 라벨 / v26: 오늘 새 직접 사건·진전,issue_selected,카카오,,,자사_및_계열사_이슈,자사_및_계열사_이슈,자사 및 계열사 이슈,1001,본문추출성공,pass:self_guardrail_pass,pass:representative_aligned,v38_process_category_lock:자사_및_계열사_이슈,pass:self_guardrail_pass,official_action,29.0,v27:platform_enforcement:kakao:privacy_data_violation,548.8199999999999,v32_competitor:apple:ai_answer_legal_responsibility,enforcement_or_penalty,v32_competitor:apple:ai_answer_legal_responsibility:enforcement_or_penalty,548.8199999999999,548.8199999999999,548.8199999999999,pass:self_material_pass,has_body,688.82,pass:self_material_pass,688.82,1,,,,,,,
자사_및_계열사_이슈,자사 및 계열사 이슈,카카오,"네이버·SKT, 엔비디아와 AI 협력…카카오 첫 파업[뉴스잇(IT)쥬]",뉴스1,뉴스1,"Sun, 14 Jun 2026 01:22:44 GMT","Sun, 14 Jun 2026 01:22:44 GMT","네이버·SKT, 엔비디아와 AI 협력…카카오 첫 파업[뉴스잇(IT)쥬] 뉴스1","펄어비스 '붉은사막' 출시 83일 만에 600만 장 판매 편집자주 ... 정보통신기술(ICT)은 어떤 산업보다 빠르게 변화합니다. 그 안의 다양한 이해관계가 맞물려 소용돌이 치는 분야이기도 하지요. ICT 기사는 어렵다는 편견이 있지만 AI로 귀결되는 시대에 그 중요성은 날로 커지고 있습니다. <뉴스1>은 한주간 국내 ICT 업계를 달군 '핫이슈'를 한눈에 제공합니다. 놓쳐버린 주요 뉴스, [뉴스잇(IT)쥬]와 함께 하실래요? (서울=뉴스1) 김민재 기자 = 이번 주 정보기술(IT)업계에서는 네이버(035420)와 SK텔레콤(017670)이 엔비디아와 협력한다는 사실이 화제를 끌었다. 두 회사는 엔비디아와 'AI 팩토리'를 구축할 계획이다. 카카오(035720) 본사 등 5개 그룹 법인은 이번 주 부분 파업을 진행했다. 카카오 본사가 파업을 한 건 창사 이래 처음이다. 이들 법인은 오는 29일 추가 파업을 예고했다. 펄어비스(263750) 신작 '붉은사막'이 출시 83일 만에 판매량 600만 장을 달성하며 눈길을 끌었다. 전례 없는 흥행 성과에 문화체육관광부 장관이 축하의 뜻을 표하기도 했다. 젠슨 황 엔비디아 최고경영자(CEO)는 지난 8일 오전 SK텔레콤과 'AI 팩토리' 부문에서 협력할 예정이라고 밝혔다. SK텔레콤은 엔비디아 AI 팩토리 설루션 'DSX'를 바탕으로 AI 팩토리를 구축한다. 이는 2027년 가동을 시작한다. 양사는 최대 5기가와트(GW) 규모의 시설을 조성할 계획이다. 황 CEO는 이날 오후 네이버 사옥 '1784'를 찾아 이해진 의장과 함께 양사 간 협력 방안을 발표했다. 두 회사는 네이버 데이터센터 '각 세종'을 거점으로 AI 팩토리를 구축한다. 궁극적으로는 '각 세종' 최대 용량의 약 4배인 1GW까지 인프라를 확장할 계획이다. AI 팩토리는 전력과 데이터를 투입해 AI의 핵심 연산 단위인 '토큰'을 대량 생산하는 지능형 인프라다. 기존의 AI 데이터센터가 단순 연산을 수행하고 데이터를 저장·처리했다면, AI 팩토리는 데이터와 알고리즘으로 AI와 지능이라는 고부가가치 결과물을 생산한다. 카카오 노동조합이 지난 10일 오전 10시부터 오후 3시까지 부분파업을 진행했다. 이날 파업에는 카카오페이·카카오엔터프라이즈·디케이테크인·엑스엘게임즈 등 계열사 4곳도 참여했다. 이들 법인 5곳은 앞서 임금 협약 교섭이 결렬된 후 경기지방노동위원회에서도 조정이 중지되며 쟁의권을 확보했고, 파업 찬반투표를 찬성으로 가결했다. 노조는 성과급 등 보상 체계와 더불어 '불공정한 성과 배분'과 '계열사 매각에 따른 고용불안'을 노사 갈등의 핵심 원인으로 꼽았다. 조합에 따르면 이날 카카오 본사에서 파업에 참여한 조합원은 1000명 이상이다. 계열사를 포함한 그룹 차원에서는 1500명이 파업에 동참했다. 한편, 노조는 오는 29일 '로그오프 데이'를 실행하겠다고 말했다. 로그오프 데는 전 직원이 업무 툴에서 '로그아웃'해서 업무를 하지 않는 방식의 파업 방식을 뜻한다. 펄어비스는 지난 11일 '붉은사막'이 글로벌 누적 판매량 600만 장을 돌파했다고 밝혔다. 올해 3월 20일 출시 후 83일 만에 거둔 성과다. 게임은 출시 첫날 스팀 최고 동시 접속자 24만 명을 기록하며 200만 장을 판매했다. 한국 게임이 출시 당일 200만 장을 판매한 건 이번이 처음이다. 이후 출시 나흘 만에 300만 장, 12일 만에 400만 장을 돌파했다. 이어 70여일 동안 200만 장을 추가로 판매하며 600만 장 고지를 밟았다. 최휘영 문화체육관광부 장관도 축하의 뜻을 전했다. 최 장관은 12일 자신의 사회관계망서비스(SNS)를 통해 ""펄어비스 임직원 여러분에게 축하의 말씀을 드린다""고 말했다. 그는 ""앞으로 제2, 제3의 '붉은사막'이 탄생할 수 있도록 문체부도 제 역할을 다하겠다""며 ""인디게임 육성, 새로운 지식재산권(IP) 발굴, 금융 지원까지 챙기겠다""고 했다. minjae@news1.kr (서울=뉴스1) 김민재 기자 = 이번 주 정보기술(IT)업계에서는 네이버(035420)와 SK텔레콤(017670)이 엔비디아와 협력한다는 사실이 화제를 끌었다. 두 회사는 엔비디아와 'AI 팩토리'를 구축할 계획이다. 카카오(035720) 본사 등 5개 그룹 법인은 이번 주 부분 파업을 진행했다. 카카오 본사가 파업을 한 건 창사 이래 처음이다. 이들 법인은 오는 29일 추가 파업을 예고했다. 펄어비스(263750) 신작 '붉은사막'이 출시 83일 만에 판매량 600만 장을 달성하며 눈길을 끌었다. 전례 없는 흥행 성과에 문화체육관광부 장관이 축하의 뜻을 표하기도 했다. 젠슨 황 엔비디아 최고경영자(CEO)는 지난 8일 오전 SK텔레콤과 'AI 팩토리' 부문에서 협력할 예정이라고 밝혔다. SK텔레콤은 엔비디아 AI 팩토리 설루션 'DSX'를 바탕으로 AI 팩토리를 구축한다. 이는 2027년 가동을 시작한다. 양사는 최대 5기가와트(GW) 규모의 시설을 조성할 계획이다. 황 CEO는 이날 오후 네이버 사옥 '1784'를 찾아 이해진 의장과 함께 양사 간 협력 방안을 발표했다. 두 회사는 네이버 데이터센터 '각 세종'을 거점으로 AI 팩토리를 구축한다. 궁극적으로는 '각 세종' 최대 용량의 약 4배인 1GW까지 인프라를 확장할 계획이다. AI 팩토리는 전력과 데이터를 투입해 AI의 핵심 연산 단위인 '토큰'을 대량 생산하는 지능형 인프라다. 기존의 AI 데이터센터가 단순 연산을 수행하고 데이터를 저장·처리했다면, AI 팩토리는 데이터와 알고리즘으로 AI와 지능이라는 고부가가치 결과물을 생산한다. 카카오 노동조합이 지난 10일 오전 10시부터 오후 3시까지 부분파업을 진행했다. 이날 파업에는 카카오페이·카카오엔터프라이즈·디케이테크인·엑스엘게임즈 등 계열사 4곳도 참여했다. 이들 법인 5곳은 앞서 임금 협약 교섭이 결렬된 후 경기지방노동위원회에서도 조정이 중지되며 쟁의권을 확보했고, 파업 찬반투표를 찬성으로 가결했다. 노조는 성과급 등 보상 체계와 더불어 '불공정한 성과 배분'과 '계열사 매각에 따른 고용불안'을 노사 갈등의 핵심 원인으로 꼽았다. 조합에 따르면 이날 카카오 본사에서 파업에 참여한 조합원은 1000명 이상이다. 계열사를 포함한 그룹 차원에서는 1500명이 파업에 동참했다. 한편, 노조는 오는 29일 '로그오프 데이'를 실행하겠다고 말했다. 로그오프 데는 전 직원이 업무 툴에서 '로그아웃'해서 업무를 하지 않는 방식의 파업 방식을 뜻한다. 펄어비스는 지난 11일 '붉은사막'이 글로벌 누적 판매량 600만 장을 돌파했다고 밝혔다. 올해 3월 20일 출시 후 83일 만에 거둔 성과다. 게임은 출시 첫날 스팀 최고 동시 접속자 24만 명을 기록하며 200만 장을 판매했다. 한국 게임이 출시 당일 200만 장을 판매한 건 이번이 처음이다. 이후 출시 나흘 만에 300만 장, 12일 만에 400만 장을 돌파했다. 이어 70여일 동안 200만 장을 추가로 판매하며 600만 장 고지를 밟았다. 최휘영 문화체육관광부 장관도 축하의 뜻을 전했다. 최 장관은 12일 자신의 사회관계망서비스(SNS)를 통해 ""펄어비스 임직원 여러분에게 축하의 말씀을 드린다""고 말했다. 그는 ""앞으로 제2, 제3의 '붉은사막'이 탄생할 수 있도록 문체부도 제 역할을 다하겠다""며 ""인디게임 육성, 새로운 지식재산권(IP) 발굴, 금융 지원까지 챙기겠다""고 했다. 용어설명 토큰 언어 모델이 텍스트를 이해하고 생성하는 기본 단위. 예를 들어 AI는 ""당신을 사랑합니다""라는 문장을 '당신을' '사랑' '합니다'라는 토큰으로 나눠 문장의 의미를 파악한다. 토큰 언어 모델이 텍스트를 이해하고 생성하는 기본 단위. 예를 들어 AI는 ""당신을 사랑합니다""라는 문장을 '당신을' '사랑' '합니다'라는 토큰으로 나눠 문장의 의미를 파악한다. 언어 모델이 텍스트를 이해하고 생성하는 기본 단위. 예를 들어 AI는 ""당신을 사랑합니다""라는 문장을 '당신을' '사랑' '합니다'라는 토큰으로 나눠 문장의 의미를 파악한다.",3895,bs4_selector,68.0,good,181.3,True,False,https://news.google.com/rss/articles/CBMiYEFVX3lxTE9yU3dHd29SeDQwOVlGMUR1M2w0dzdPaDVvcG8yWDcwUkRjdWd1NUozVkx6R1FQT1kxYjdzY3RWNlAxemJqQTBJV0FwRjFLUEowVjNmMjR1QW02N3ZwVTZabw?oc=5,https://www.news1.kr/it-science/cc-newmedia/6196617,132.8,"ai_infrastructure_security,aidc_datacenter,labor_dispute,labor_negotiation,policy_legislation,strategy_mna_governance",labor_vote,2026-06-14,json_ld:datePublished,original_date_recent,5,252.11,,23.0,global_incident:platform_regulation:kakao:platform_self_preferencing:conflict_escalation,global_incident:platform_regulation:kakao:platform_self_preferencing,0.0,,,,ok,http_200,body_valid,I113,카카오 노조 임단협/파업 및 내부 갈등,노사 관계,SELF_DIRECT_RISK,191.8,DIRECT_RISK,,COMP_GENERAL_LOW_RELEVANCE,overseas,자사_및_계열사_이슈,SELF_DIRECT_RISK,노사 관계,카카오 노조 임단협/파업 및 내부 갈등,카카오 노조 임단협/파업 및 내부 갈등,"카카오 창사 이래 첫 부분 파업으로, 노사 관계 갈등이 심화되고 있으며, 서비스 영향 가능성 및 기업 이미지에 부정적 영향을 미칠 수 있다. 추가 파업 예고로 리스크 장기화 우려.",1,1,1,로컬 보조 라벨 / v26: 오늘 새 직접 사건·진전,로컬 보조 라벨 / v26: 오늘 새 직접 사건·진전 / 카카오 창사 첫 노조 파업과 이에 따른 주가 하락은 회사 운영 및 기업 이미지에 직접적인 영향을 미치는 중대 리스크이다. / v23_guardrail_fail:v26_2_market_stock_commentary_excluded,issue_selected,카카오,,,자사_및_계열사_이슈,자사_및_계열사_이슈,자사 및 계열사 이슈,1002,본문추출성공,pass:self_guardrail_pass,pass:representative_aligned,v38_process_category_lock:자사_및_계열사_이슈,pass:self_guardrail_pass,analysis_with_direct_risk,42.0,global_incident:platform_regulation:kakao:platform_self_preferencing,686.03,v32_competitor:naver:ai_infra_factory_strategy,action_executed,v32_competitor:naver:ai_infra_factory_strategy:action_executed,686.03,686.03,686.03,pass:self_material_pass,has_body,645.03,pass:self_material_pass,645.03,2,,,,,,,
자사_및_계열사_이슈,자사 및 계열사 이슈,카카오,"[게임주총] 카카오게임즈 ""지분구조 재편에 임직원 고용안정 명문화""",인벤,인벤,"Fri, 12 Jun 2026 20:00:12 GMT","Fri, 12 Jun 2026 20:00:12 GMT",,,0,title_link_only,0.0,all_candidates_failed_title_link_only,80.0,False,,https://news.google.com/rss/articles/CBMia0FVX3lxTFB0WW9UVWgwSUdQbDZubjQxaDhsdE04bTNOUW9VX0hUamh0MExGSVU3UE1hbmtCQ2tacm05enpkbjViSjlhNEl5bV90aVc2aDVXVklvSFhwQVM1eHJIbEphaDlUcVVfY1pkMm5V?oc=5,https://www.inven.co.kr/webzine/news?news=314782&site=over,108.8,strategy_mna_governance,strategy_mna_governance,,not_checked_bodyless,not_checked_bodyless,0,228.64,,,,,,,,,ok,http_200,,I133,카카오게임즈 최대주주 변경 및 공동대표 체제,카카오게임즈 경영,SELF_DIRECT_RISK,,,,,,자사_및_계열사_이슈,SELF_DIRECT_RISK,카카오게임즈 경영,카카오게임즈 최대주주 변경 및 공동대표 체제,카카오게임즈 최대주주 변경 및 공동대표 체제,카카오 계열사인 카카오게임즈의 지배구조 및 고용 환경 변화는 카카오 그룹 전체의 전략 및 리스크 관리와 연관된다.,1,1,1,로컬 보조 라벨 / v26: 오늘 새 직접 사건·진전,"로컬 보조 라벨 / v26: 오늘 새 직접 사건·진전 / 자회사 카카오게임즈의 중요한 지배구조 변화로, 그룹 전반의 경영 리스크 및 투명성에 직접적인 영향을 미칠 수 있다.",title_link_only_fallback,카카오,,,자사_및_계열사_이슈,자사_및_계열사_이슈,자사 및 계열사 이슈,1003,본문추출실패_대체없음_제목링크만,final_pass:self_guardrail_pass,,v38_process_category_lock:자사_및_계열사_이슈,pass:self_guardrail_pass,direct_risk,14.0,global_incident:labor_ir:kakao:labor_ir,309.16,global_incident:labor_ir:kakao:labor_ir,outcome_or_impact,global_incident:labor_ir:kakao:labor_ir:outcome_or_impact,309.16,309.16,309.16,pass:self_material_pass,bodyless_allowed_critical_self,288.16,pass:self_material_pass,288.16,3,all_candidates_failed_title_link_only,Y,Y,section_min_refill:자사_및_계열사_이슈,,,
