"date","section","rank","title","press","url","issue_group","issue_family","body_status","qa_overall","title_hash","url_hash","summary","canonical_url","event_key","event_stage","article_form","todayness_score","todayness_reason","source_version"
"2026-06-11","자사_및_계열사_이슈","1","네이버는 젠슨 황 업고 질주하는데…카카오 창사 첫 파업에 AI '경고등'","MTN 머니투데이방송","https://news.mtn.co.kr/news-detail/2026061016085670079","카카오 노조 임단협/파업 및 내부 갈등","노조 파업","본문추출성공","주의","네이버는 젠슨 황 업고 질주하는데 카카오 창사 첫 파업에 ai 경고등","https://news.mtn.co.kr/news-detail/2026061016085670079","네이버는 젠슨 황 업고 질주하는데…카카오 창사 첫 파업에 AI '경고등' 이상현기자 [앵커멘트] 카카오 본사가 창사 이후 처음으로 파업에 들어갔음. 임금교섭이 결렬되면서 노조가 부분 파업에 나선 건데요임.","https://news.mtn.co.kr/news-detail/2026061016085670079","global_incident:labor_ir:kakao:strike_negotiation","action_started","analysis_with_direct_risk","44.0","published_yesterday+today_date_action+yesterday_date_action","google_rss_v28_2_strict_same_event_replacement_dedupe"
"2026-06-11","자사_및_계열사_이슈","2","[Game & Now] 넷마블 ‘스톰랜드’, 카카오 한복, 넥써쓰 AI 보안…3색 성장 카드","ebn.co.kr","https://www.ebn.co.kr/news/articleView.html?idxno=1712097","카카오 AI 보안 솔루션 검토","AI 서비스","본문추출실패_중요이슈_RSS제한포함","주의","game now 넷마블 스톰랜드 카카오 한복 넥써쓰 ai 보안 3색 성장 카드","https://www.ebn.co.kr/news/articleView.html?idxno=1712097","[Game & Now] 넷마블 ‘스톰랜드’, 카카오 한복, 넥써쓰 AI 보안…3색 성장 카드 ebn.co.kr","https://www.ebn.co.kr/news/articleView.html?idxno=1712097","global_incident:ai_security_policy:kakao:ai_security_policy","consultation","direct_risk","24.0","published_today","google_rss_v28_2_strict_same_event_replacement_dedupe"
"2026-06-11","정부_국회","3","개보위, 13시간 심의 끝 쿠팡에 최대과징금 6천250억원…이유는(종합)","연합뉴스","https://www.yna.co.kr/view/AKR20260611086851530","global_incident:platform_regulation:coupang:platform_operator_obligation","comp_domestic_direct_risk","본문추출성공","주의","개보위 13시간 심의 끝 쿠팡에 최대과징금 6천250억원 이유는","https://www.yna.co.kr/view/AKR20260611086851530","3천756만명 개인정보 유출에 매출 규모까지 반영 회원 1천117만명 타사 활동기록 무단수집에도 과징금 2천11억원 과징금 6천246억 부과…개인정보위, 쿠팡사태 제재안 의결 브리핑 (서울=연합뉴스) 차민지 기자 = 개인정보보호위원회가 쿠팡과 물류 자회사 쿠팡풀필먼트서비스(CFS)에 부과한 과징금은 총 6천250억원에 육박해, 역대 최대 규모음.","https://www.yna.co.kr/view/AKR20260611086851530","v27:platform_enforcement:coupang:delivery_platform_fee_mfn","penalty_or_sanction","official_action","59.0","published_today+today_date_action+yesterday_date_action+exclusive_breaking","google_rss_v28_2_strict_same_event_replacement_dedupe"
"2026-06-11","정부_국회","4","K-푸드 제조혁신 본격화… 정부·식품업계, ‘AI 기반 스마트제조 연합군’ 출범","FA저널","https://www.fajournal.com/news/articleView.html?idxno=21030","government_ai_core_policy:k 푸드 제조혁신 본격화 정부 식품업계 ai 기반 스마트제조 연합군 출범","government_ai_core_policy","본문추출성공","주의","k 푸드 제조혁신 본격화 정부 식품업계 ai 기반 스마트제조 연합군 출범","https://www.fajournal.com/news/articleView.html?idxno=21030","중소벤처기업부(장관 한성숙, 이하 중기부)와 농림축산식품부(장관 송미령, 이하 농식품부), 식품의약품안전처(처장 오유경, 이하 식약처)가 식품 제조기업과 스마트제조기술기업, 전문기관이 참여하는 민관 협력체계인 ‘K-푸드 스마트제조 얼라이언스’를 출범시키고 AI 기반 제조혁신 확산에 속도를 낸음. 중소벤처기업부 한성숙 장관이 10일 서울특별시 강남구 코엑스에서 열린 'K-푸드 스마트제조 얼라이언스 출범식'에서 체험관을 둘러보고 있음.","https://www.fajournal.com/news/articleView.html?idxno=21030","global_incident:platform_regulation:platform_sector:platform_data_protection_obligation","action_started","direct_risk","44.0","published_yesterday+today_date_action+yesterday_date_action","google_rss_v28_2_strict_same_event_replacement_dedupe"
"2026-06-11","정부_국회","5","방미통위·과기정통부 정책협의회 출범…AI 데이터 공유","연합뉴스","https://www.yna.co.kr/view/AKR20260610067700017?section=culture%2Fmedia","과기부·방미통위, 차관급 정책협의회 출범…방송 데이터 AI 허브에 개방","AI 데이터 공유 및 미디어 정책 협력","본문추출성공","주의","방미통위 과기정통부 정책협의회 출범 ai 데이터 공유","https://www.yna.co.kr/view/AKR20260610067700017?section=culture%2Fmedia","AI·OTT 육성부터 이용자 보호까지 정책 공조 이미지 확대 류제명 과기정통부 2차관과 고민수 방미통위 상임위원 [방미통위 제공임. 방미통위와 과기정통부는 10일 서울 광화문 KT빌딩에서 정책협의회 착수회의를 열고 AI, 미디어·온라인동영상서비스(OTT), 디지털 규제·이용자 보호 분야의 협력 방안을 논의했다고 밝힘.","https://www.yna.co.kr/view/AKR20260610067700017?section=culture%2Fmedia","privacy_security:kakao:data_leak","action_started","official_action","26.0","published_yesterday+yesterday_date_action","google_rss_v28_2_strict_same_event_replacement_dedupe"
"2026-06-11","정부_국회","6","이해민 의원 ""AI 발전 속도 비해 제도·안전 논의 더뎌…균형 중요""","네이트","https://news.nate.com/view/20260610n11073","government_ai_core_policy:이해민 의원 ai 발전 속도 비해 제도 안전 논의 더뎌 균형 중요","government_ai_core_policy","본문추출성공","주의","이해민 의원 ai 발전 속도 비해 제도 안전 논의 더뎌 균형 중요","https://news.nate.com/view/20260610n11073","이해민 조국혁신당 의원이 10일 오전 서울 영등포구 여의도 글래드호텔 블룸홀에서 '에이전틱 AI 시대 산업 질서가 바뀐다'를 주제로 열린 2026 뉴스1 테크포럼(NTF)에서 축사를 하고 있음. 2026.6.10 ⓒ 뉴스1 김진환 기자 (서울=뉴스1) 이민주 기자 = 이해민 조국혁신당 의원이 에이전틱 AI 시대를 맞아 기술혁신과 사회적 안전장치의 균형의 중요성이 대두되고 있다고 10일 밝힘.","https://news.nate.com/view/20260610n11073","global_incident:platform_regulation:toss:platform_operator_obligation","action_started","business_change","14.0","published_yesterday","google_rss_v28_2_strict_same_event_replacement_dedupe"
"2026-06-11","정부_국회","7","정부, ‘AI‧ICT 미래 유니콘’ 참여기업 선정…해외 진출 지원","KBS 뉴스","https://news.kbs.co.kr/news/pc/view/view.do?ncd=8582797","government_ai_core_policy:정부 ai ict 미래 유니콘 참여기업 선정 해외 진출 지원","government_ai_core_policy","본문추출성공","주의","정부 ai ict 미래 유니콘 참여기업 선정 해외 진출 지원","https://news.kbs.co.kr/news/pc/view/view.do?ncd=8582797","기사 본문 영역 정부, ‘AI‧ICT 미래 유니콘’ 참여기업 선정…해외 진출 지원 입력 2026.06.10 (15:07) 수정 2026.06.10 (15:13) 읽어주기 기능은 크롬기반의 브라우저에서만 사용하실 수 있음. 과학기술정보통신부는 유망 인공지능(AI)과 디지털 혁신기업의 글로벌 도약을 돕는 ‘글로벌 ICT 미래 유니콘 육성사업’ 참여기업으로 올해 15개사를 선정했음.","https://news.kbs.co.kr/news/pc/view/view.do?ncd=8582797","global_incident:platform_regulation:kakao:platform_algorithm_ad_obligation","general","business_change","14.0","published_yesterday","google_rss_v28_2_strict_same_event_replacement_dedupe"
"2026-06-11","정부_국회","8","과기부, “Brain to Korea” 본격화…해외우수과학자유치사업 신규 90개 과제 선정","산학뉴스","https://www.sanhaknews.kr/news/articleView.html?idxno=21400","government_ai_core_policy:과기부 brain to korea 본격화 해외우수과학자유치사업 신규 90개 과제 선정","government_ai_core_policy","본문추출성공","주의","과기부 brain to korea 본격화 해외우수과학자유치사업 신규 90개 과제 선정","https://www.sanhaknews.kr/news/articleView.html?idxno=21400","과기부, “Brain to Korea” 본격화…해외우수과학자유치사업 신규 90개 과제 선정 SNS 기사보내기 SNS 기사보내기 스크롤 이동 상태바 과기부, “Brain to Korea” 본격화…해외우수과학자유치사업 신규 90개 과제 선정 SNS 기사보내기 SNS 기사보내기 과기부, “Brain to Korea” 본격화…해외우수과학자유치사업 신규 90개 과제 선정 과학기술정보통신부는 6 월 8 일 ‘Brain to Korea’(2030 년까지 글로벌 인재 2,000 명 유치 ) 추진의 일환으로 2026 년도 해외우수과학자유치사업 (BP/BP+) 신규과제를 최종 선정했다고 밝힘.","https://www.sanhaknews.kr/news/articleView.html?idxno=21400","global_incident:platform_regulation:science_ict_ministry:platform_data_protection_obligation","action_started","analysis_feature","17.0","published_today+exclusive_breaking+analysis_without_direct_event","google_rss_v28_2_strict_same_event_replacement_dedupe"
"2026-06-11","정부_국회","9","금융위 “AI 공격은 AI로 방어”…망분리 완화·피싱 대응 강화","KBS 뉴스","https://news.kbs.co.kr/news/pc/view/view.do?ncd=8582793","AI 공격 대응","AI 보안","본문추출실패_중요이슈_RSS제한포함","주의","금융위 ai 공격은 ai로 방어 망분리 완화 피싱 대응 강화","https://news.kbs.co.kr/news/pc/view/view.do?ncd=8582793","금융위 “AI 공격은 AI로 방어”…망분리 완화·피싱 대응 강화 KBS 뉴스","https://news.kbs.co.kr/news/pc/view/view.do?ncd=8582793","global_incident:platform_regulation:financial_authority:platform_content_moderation_obligation","general","direct_risk","14.0","published_yesterday","google_rss_v28_2_strict_same_event_replacement_dedupe"
"2026-06-11","경쟁사_해외이슈","10","""스마트글라스를 물류공정에 적용""…딥파인-LX판토스 기술실증 - 머니투데이","머니투데이","https://www.mt.co.kr/future/2026/06/10/2026061016023260139","global_incident:platform_regulation:toss:platform_operator_obligation","comp_domestic_finance_commerce","본문추출성공","주의","스마트글라스를 물류공정에 적용 딥파인 lx판토스 기술실증","https://www.mt.co.kr/future/2026/06/10/2026061016023260139","[이 기사에 나온 스타트업에 대한 보음. 다양한 기업정보는 유니콘팩토리 빅데이터 플랫폼 '데이터랩' 에서 볼 수 있습니다.] XR(확장현실) 공간 컴퓨팅 플랫폼 기업 딥파인 이 종합물류기업 LX판토스와 물류 자동화 사업 협력을 위한 업무협약을 체결했다고 10일 밝힘.","https://www.mt.co.kr/future/2026/06/10/2026061016023260139","global_incident:platform_regulation:toss:platform_content_moderation_obligation","action_started","direct_risk","19.0","published_yesterday+exclusive_breaking","google_rss_v28_2_strict_same_event_replacement_dedupe"
"2026-06-11","경쟁사_해외이슈","11","캐나다, 16세 미만 청소년 SNS 사용금지 추진…페북도 포함 가능성","뉴시스","https://mobile.newsis.com/view_amp.html?ar_id=NISX20260611_0003665298","global_incident:platform_regulation:platform_sector:platform_content_moderation_obligation","comp_domestic_ai_platform","본문추출성공","주의","캐나다 16세 미만 청소년 sns 사용금지 추진 페북도 포함 가능성","https://mobile.newsis.com/view_amp.html?ar_id=NISX20260611_0003665298","캐나다, 16세 미만 청소년 SNS 사용금지 추진…페북도 포함. 월스트리트저널(WSJ)은 10일 캐나다에서 16세 미만 청소년에 소셜미디어 사용 금지 방안이 추진되고 있으며 메타나 스냅챗 같은 미국 기술 기업에도 적용될 가능성이 높다고 보도했음.","https://mobile.newsis.com/view_amp.html?ar_id=NISX20260611_0003665298","global_incident:platform_regulation:meta:platform_content_moderation_obligation","penalty_or_sanction","analysis_with_direct_risk","36.0","published_today+yesterday_date_action","google_rss_v28_2_strict_same_event_replacement_dedupe"
"2026-06-11","경쟁사_해외이슈","12","불법촬영 이미지도 차단 의무…구글·네이버 적용","매일경제 마켓","https://stock.mk.co.kr/news/view/1102700?type=theme","플랫폼 불법촬영 이미지 차단 의무 확대","comp_domestic_strategy","본문추출실패_중요이슈_RSS제한포함","주의","불법촬영 이미지도 차단 의무 구글 네이버 적용","https://stock.mk.co.kr/news/view/1102700?type=theme","불법촬영 이미지도 차단 의무…구글·네이버 적용 매일경제 마켓","https://stock.mk.co.kr/news/view/1102700?type=theme","global_incident:platform_regulation:naver:platform_content_moderation_obligation","action_started","general","24.0","published_today","google_rss_v28_2_strict_same_event_replacement_dedupe"
"2026-06-11","경쟁사_해외이슈","13","독일 법원 ""구글 'AI 개요'는 구글 자신의 말""...허위 답변에 직접 책임 묻는다...뮌헨지법, 검색엔진 면책 논리는 AI에 적용 안 돼","한국정보기술진흥원","https://kitpa.org/news/1628","global_incident:platform_regulation:google:platform_algorithm_ad_obligation","comp_overseas_platform_ai","본문추출실패_중요이슈_RSS제한포함","주의","독일 법원 구글 ai 개요 는 구글 자신의 말 허위 답변에 직접 책임 묻는다 뮌헨지법 검색엔진 면책 논리는 ai에 적용 안 돼","https://kitpa.org/news/1628","독일 법원 ""구글 'AI 개요'는 구글 자신의 말""...허위 답변에 직접 책임 묻는다...뮌헨지법, 검색엔진 면책 논리는 AI에 적용 안 돼 한국정보기술진흥원","https://kitpa.org/news/1628","global_incident:platform_regulation:google:platform_algorithm_ad_obligation","action_started","business_change","14.0","published_yesterday","google_rss_v28_2_strict_same_event_replacement_dedupe"
"2026-06-11","산업동향","14","[AI생태계] NHN클라우드, MLOps 인재 양성 나서 / 네이버 D2SF, AI 보안 스타트업에 전략투자","웹이코노미","https://www.webeconomy.co.kr/news/articleView.html?idxno=2195423","global_incident:ai_security_policy:naver:ai_security_policy","comp_domestic_ai_platform","본문추출성공","주의","ai생태계 nhn클라우드 mlops 인재 양성 나서 네이버 d2sf ai 보안 스타트업에 전략투자","https://www.webeconomy.co.kr/news/articleView.html?idxno=2195423","[AI생태계] NHN클라우드, MLOps 인재 양성 나서 / 네이버 D2SF, AI 보안 스타트업에 전략투자 가 가 기사의 본문 내용은 이 글자크기로 변경됨. 스크롤 이동 상태바 [AI생태계] NHN클라우드, MLOps 인재 양성 나서 / 네이버 D2SF, AI 보안 스타트업에 전략투자 가 가 기사의 본문 내용은 이 글자크기로 변경됨.","https://www.webeconomy.co.kr/news/articleView.html?idxno=2195423","global_incident:ai_security_policy:naver:openai_security_access","general","direct_risk","24.0","published_today","google_rss_v28_2_strict_same_event_replacement_dedupe"
"2026-06-11","산업동향","15","오픈AI, 엔비디아 지원으로 美 연방부지에 대규모 데이터센터 구축 나서…완공시 세계 ...","마켓인","https://marketin.edaily.co.kr/News/ReadE?newsId=05926966645480408","global_incident:ai_security_policy:openai:openai_security_access","comp_overseas_regulation_data","본문추출실패_중요이슈_RSS제한포함","주의","오픈ai 엔비디아 지원으로 연방부지에 대규모 데이터센터 구축 나서 완공시 세계","https://marketin.edaily.co.kr/News/ReadE?newsId=05926966645480408","오픈AI, 엔비디아 지원으로 美 연방부지에 대규모 데이터센터 구축 나서…완공시 세계 ... 마켓인","https://marketin.edaily.co.kr/News/ReadE?newsId=05926966645480408","global_incident:ai_security_policy:openai:openai_security_access","general","business_change","14.0","published_yesterday","google_rss_v28_2_strict_same_event_replacement_dedupe"
